{"run":132,"commit":"c108537","metric":0.9288,"metrics":{"ai_dev_clean_preserved_rate":0.9714,"ai_dev_pass_rate":0.8136,"ai_dev_slang_kept_rate":0.9167,"ai_holdout_pass_rate":0.8,"qwen_dev_errors_fixed_rate":0.962,"qwen_dev_p95_ms":1827,"qwen_holdout_pass_rate":0.9048},"status":"keep","description":"Docs: RESULTS.md brought up to date with #127-#131 (latest live run, robustness 221: Qwen 207 vs AI 169, British-spelling and dialect restores, chain timing). No code change","timestamp":1791661841841,"segment":8,"confidence":null,"asi":{"files":"RESULTS.md: latest live run #131; robustness row 207/221 vs 169/221 (9 rounds); bug list + #128/#130; post-processing cost note (#127); Qwen-default rationale with #131 numbers; 131 experiments. PIPELINE.md already current","hypothesis":"housekeeping: RESULTS.md predated #127-#131 (chain timing, British-spelling and dialect restores, round 9, latest live numbers)","next_action_hint":"docs current; nothing pending live; owner items"}}
{"run":133,"commit":"db1309d","metric":0.9288,"metrics":{"ai_dev_clean_preserved_rate":0.9714,"ai_dev_pass_rate":0.8136,"ai_dev_slang_kept_rate":0.9167,"ai_holdout_pass_rate":0.8,"qwen_dev_errors_fixed_rate":0.962,"qwen_dev_p95_ms":1827,"qwen_holdout_pass_rate":0.9048},"status":"keep","description":"Adversarial round 10 (expressive typing): deliberate capitals the model recased (sUrE, WHY; ALL-CAPS words keep caps when corrected), elongations shortened to one letter (looong → long), and tonite/nite/luv now come back. 13/20 → 16/20; a first elongation rule would have undone 'offfice' typo fixes, caught by replay and replaced by a run-length rule; 0 harm, parity 0 diffs","timestamp":1791662733342,"segment":8,"confidence":null,"asi":{"design":"the first elongation rule ('squeezed forms equal') would have undone 6 corpus typo fixes (offfice, shippping, isssue, foooter: 200+ stored rows passing -> failing). The run-length rule (a 3+ run written ONCE is an elongation; written twice is a typo of a double letter) has 0 conflicts. The casing pass also needed an ALL-CAPS rule for corrected words, or 'PLEASE SEND TEH FILE' came out 'PLEASE SEND the FILE'","files":"SpellingVariantRestorer: deliberate-case pass over kept words (ALL CAPS 2+ letters or an internal capital, output differs only in case), ALL-CAPS casing on corrected 1:1 words, elongation restore via run-length comparison; SlangRestorer + tonite/nite/luv; +1 test (6 expectations incl. offfice/foooter staying fixed, TEH -> THE); harness mirrors; PIPELINE.md 2b; round 10 appended (227 adversarial inputs)","harm_check":"no labelled output newly changed except s4-d16, whose labels accept both 'tonight' and 'tonite'. Full-chain replay new vs committed over 27,428 stored outputs: 29 changes, 21 fail->pass (fresh-2 s5-g10 'night' -> 'nite' on both engines, which the label keeps), 8 still passing (s4-d16), 0 pass->fail. Invariants hold; Swift/Python parity 0 differences on 3,793 pairs incl. round 10 and 20 edge cases. Dev .9288 unchanged","hypothesis":"adversarial round 10, expressive typing (elongations, CAPS emphasis, *asterisks*, ~tildes~, sarcastic sUrE, spaced letters, ?!?!, kaomoji, lmaooo, hahaha, yesss, heyyy, tonite): deliberate capitals and elongations are the writer's style, and models flatten them","next_action_hint":"remaining round-10 misses are model punctuation edits; a live batch for #128-#133 changes (fixin', expressive restores) can go next","result":"round 10 through the Qwen chain: 13/20 before. Real style losses: 'sUrE' -> 'sure', 'WHY' -> 'why', 'looong' -> 'long', 'sooo' -> 'soo', 'tonite' -> 'tonight' (+ 'c o o l' safely rejected, 'ugh,' comma added). After: 16/20; left: 'c o o l' (rejected, safe), an added comma, 'sooo' -> 'soo' (a 3-run written twice is treated as a typo by design), WHY gets an added '?'"}}
{"run":134,"commit":"e68c477","metric":0.9288,"metrics":{"ai_dev_clean_preserved_rate":0.9714,"ai_dev_pass_rate":0.8136,"ai_dev_slang_kept_rate":0.9167,"ai_holdout_pass_rate":0.8,"qwen_dev_errors_fixed_rate":0.962,"qwen_dev_p95_ms":1839,"qwen_holdout_pass_rate":0.9048},"status":"keep","description":"Live verification of #133: corpus output byte-identical to #131 (400/400, both engines); only predicted changes ('nite'/'tonite' kept; fresh set 2 now Qwen 27/30, AI 26/30). Robustness 241: Qwen 223, AI 180. Latency at baseline","timestamp":1791663910102,"segment":8,"confidence":null,"asi":{"hypothesis":"live verification of #133 (deliberate capitals, elongations, tonite/nite/luv), both engines: all 400 corpus cases, 241 robustness inputs (incl. round 10), fresh set 2","latency":"Qwen p50 391 ms, AI 701 ms (baseline)","next_action_hint":"nothing pending live. Probing yield is small style restores; remaining levers are owner decisions and real-usage data","result":"corpus: raw and user-visible output byte-identical to #131 on 400/400 for both engines. Robustness 241: Qwen 223, AI 180. Changes on shared inputs are exactly the predicted ones: fresh-2 s5-g10 'night' -> 'nite' on both engines (fail->pass: fresh set 2 now Qwen 27/30, AI 26/30) and s4-d16 'tonight' -> 'tonite' for Qwen (still passing; both forms labelled). Round-10 inputs pass in the app as in the Python run for Qwen"}}
{"run":135,"commit":"61fa59b","metric":0.9288,"metrics":{"ai_dev_clean_preserved_rate":0.9714,"ai_dev_pass_rate":0.8136,"ai_dev_slang_kept_rate":0.9167,"ai_holdout_pass_rate":0.8,"qwen_dev_errors_fixed_rate":0.962,"qwen_dev_p95_ms":1827,"qwen_holdout_pass_rate":0.9048},"status":"keep","description":"Docs: RESULTS.md brought up to date with #133-#134 (latest live run; fresh set 2 27/30 vs 26/30; robustness 241: Qwen 223 vs AI 180; expressive-typing restores). No code change","timestamp":1791663975961,"segment":8,"confidence":null,"asi":{"files":"RESULTS.md: latest live run #134; fresh 2 27/30 vs 26/30; robustness 223/241 vs 180/241 (10 rounds); bug list + #133 (incl. the elongation-rule near miss); Qwen-default rationale with #134 numbers; 134 experiments. PIPELINE.md already current","hypothesis":"housekeeping: RESULTS.md predated #133-#134 (expressive-typing restores, round 10, latest live numbers)","next_action_hint":"docs current; nothing pending live; owner items"}}
{"run":136,"commit":"81f6fb4","metric":0.9,"metrics":{"ai_dev_clean_preserved_rate":0.9714,"ai_dev_pass_rate":0.8136,"ai_dev_slang_kept_rate":0.9167,"ai_holdout_pass_rate":0.8,"qwen_dev_errors_fixed_rate":0.962,"qwen_dev_p95_ms":695,"qwen_holdout_pass_rate":0.9048},"status":"keep","description":"Out-of-sample fresh set 3 (30 messages written after #135, labels first, overlaps removed): Qwen 27/30 in the app (= Python), AI 23/30. No restorer or gate misfired on unseen text; failures are model misses and judgment-call punctuation. Kept as held-out (not tuned on)","timestamp":1791664183917,"segment":8,"confidence":null,"asi":{"failures":"Qwen: 2 trailing '?' added to casual questions (judgment call), 1 model miss ('their bringing'). Apple Intelligence: recased '@jordan' -> '@Jordan,', capitalized the first word of a writer who uses no sentence capitals ('The new cafe… SO good'), 'their' -> 'they are', 'wifi' -> 'Wi-Fi', a trailing period and '?' added, and '3–5' -> '3°5' (garbage, correctly rejected by introducedSymbol)","hypothesis":"out-of-sample check of the #102-#133 robustness work: a third fresh set of 30 realistic messages written after #135, labels fixed before any run, 6-word overlaps with every existing set removed by rewording 5 cases before running","integrity":"fresh3 is now a held-out measurement: ideas drawn from its failures are recorded in ideas.md but not applied to it; any fix motivated by them must be validated on a new set","next_action_hint":"loop complete; owner items. If AI-specific fixes (a)/(b) in ideas.md are wanted, write fresh set 4 first to validate them out of sample","result":"Qwen 27/30 in the app (Python mirror 27/30, identical failures), Apple Intelligence 23/30. 0 failures caused by a restorer or gate misfiring; every deterministic step behaved on unseen text (abbreviations, 'nite', 'amazinggg', 'sooo', colour/finalised, SO/WHY caps, links, paths, 2.5kg, 2pm, the email, lists, `main`). Generalization holds: fresh 1 0.971, fresh 2 0.90, fresh 3 0.90 for Qwen"}}
{"run":137,"commit":"e05a0fc","metric":0.9288,"metrics":{"ai_dev_clean_preserved_rate":0.9714,"ai_dev_pass_rate":0.8136,"ai_dev_slang_kept_rate":0.9167,"ai_holdout_pass_rate":0.8,"qwen_dev_errors_fixed_rate":0.962,"qwen_dev_p95_ms":1827,"qwen_holdout_pass_rate":0.9048},"status":"keep","description":"@handles are never proofread (@jordan → @Jordan, restored), and lowercase writers who use only ALL-CAPS emphasis keep their lowercase style. Fresh set 4 (written before the change): neutral A/B (27/30 → 27/30 both engines); stored-output replay 10 independent fail→pass, 0 harm; parity 0 diffs","timestamp":1791665040089,"segment":8,"confidence":null,"asi":{"decision":"kept despite the neutral out-of-sample A/B: both rules are policy-driven (literals are never proofread; a lowercase writer's style), cost ~25 lines, have 0 harm on every stored and labelled output, and give 10 independent fail->pass on stored outputs. The fresh3 gains are excluded as contaminated (the ideas came from fresh3)","files":"LinkRestorer: @handle literal (not inside emails or <@…> mentions; a lone '@' isn't one); ProofreadPrompt.keepAllLowercase generalized (+ isAllCaps helper); +2 tests (LinkRestorer handles; ProofreadPrompt lowercase-writer incl. 'I seen' and 'i met Sam' left alone); harness mirrors; PIPELINE.md steps 6 and 8; fresh4-2026-10-10/ with before/after Swift outputs","fresh4_ab":"the fixes don't fire on fresh set 4: Qwen 27/30 -> 27/30, AI 27/30 -> 27/30, 0 outputs changed (AI didn't recase a handle or capitalize a lowercase writer's first word in this sample). Neutral out of sample, no harm","harm_check":"no labelled output in any set newly changed. Full-chain replay new vs committed over 28,818 stored outputs: 12 fail->pass (AI s5-e20 x8 'Monday, Tuesday' -> lowercase writer's 'monday, tuesday'; Qwen s5-069 x2 'Hey,' -> 'hey,'; plus AI fresh3 s5-f3-02 and s5-f3-23, which are contaminated: the ideas came from fresh3), 0 pass->fail. Invariants hold (echo 720, idempotence 23,762, blocked answers 264 / 0 laundered); Swift/Python parity 0 differences on 4,218 pairs","hypothesis":"two Apple-Intelligence-motivated rules from fresh set 3's failures, evaluated under a clean protocol: fresh set 4 (30 messages) written and saved BEFORE implementing, A/B'd before vs after in the app. (a) bare @handles are literals like <@U…> mentions; (b) keepAllLowercase generalized: a writer who starts lowercase and capitalizes only ALL-CAPS words (OK, AMAZING, PRs) keeps those and loses the model's other capitals","next_action_hint":"fresh3 and fresh4 are now both held out. The loop has reached the point where fixes only matter on rare cases; owner items remain"}}
{"run":138,"commit":"f697701","metric":0.9288,"metrics":{"ai_dev_clean_preserved_rate":0.9714,"ai_dev_pass_rate":0.8136,"ai_dev_slang_kept_rate":0.9167,"ai_holdout_pass_rate":0.8,"qwen_dev_errors_fixed_rate":0.962,"qwen_dev_p95_ms":1854,"qwen_holdout_pass_rate":0.9048},"status":"keep","description":"Live verification of #137: corpus output byte-identical to #134 (400/400, both engines); only predicted AI changes (lowercase writer's 'monday', '@jordan' kept). Qwen unchanged: robustness 223/241, fresh 2 27/30, fresh 3 27/30","timestamp":1791666229486,"segment":8,"confidence":null,"asi":{"hypothesis":"live verification of #137 (@handle literals, generalized keepAllLowercase), both engines: all 400 corpus cases, 241 robustness inputs, fresh sets 2 and 3","latency":"Qwen p50 395 ms, AI 705 ms (baseline)","next_action_hint":"nothing pending live; owner items","result":"corpus: raw and user-visible output byte-identical to #134 on 400/400 for both engines. Only the predicted Apple Intelligence changes: s5-e20 'Monday, Tuesday' -> the writer's 'monday, tuesday' (robustness 180 -> 181/241), and fresh-3 s5-f3-02 'The new cafe' -> 'the new cafe' and s5-f3-23 '@Jordan' -> '@jordan' (fresh 3 AI 23 -> 25/30; these two count as contaminated because the ideas came from fresh 3). Qwen unchanged (223/241, fresh 2 27/30, fresh 3 27/30)"}}
{"run":139,"commit":"294d3e0","metric":0.9288,"metrics":{"ai_dev_clean_preserved_rate":0.9714,"ai_dev_pass_rate":0.8136,"ai_dev_slang_kept_rate":0.9167,"ai_holdout_pass_rate":0.8,"qwen_dev_errors_fixed_rate":0.962,"qwen_dev_p95_ms":1827,"qwen_holdout_pass_rate":0.9048},"status":"keep","description":"Docs: RESULTS.md brought up to date with #136-#138 (fresh sets 3 and 4 as held-out checks, @handle and lowercase-writer rules, latest live run, out-of-sample discipline note). No code change","timestamp":1791666293281,"segment":8,"confidence":null,"asi":{"files":"RESULTS.md: latest live run #138; beyond-corpus table + fresh set 3 (held out, Qwen 27/30 vs AI 23/30 at #136) and fresh set 4 (before/after A/B, neutral); robustness AI 181/241; bug list + #137; an out-of-sample discipline note; Qwen-default rationale with fresh-3 numbers; 138 experiments. PIPELINE.md already current","hypothesis":"housekeeping: RESULTS.md predated #136-#138 (fresh sets 3 and 4, @handle and lowercase-writer rules, latest live numbers)","next_action_hint":"docs current; nothing pending live; owner items"}}
