{"run":120,"commit":"1eab323","metric":0.9288,"metrics":{"ai_dev_clean_preserved_rate":0.9714,"ai_dev_pass_rate":0.8136,"ai_dev_slang_kept_rate":0.9167,"ai_holdout_pass_rate":0.8,"qwen_dev_errors_fixed_rate":0.962,"qwen_dev_p95_ms":1847,"qwen_holdout_pass_rate":0.9048},"status":"keep","description":"Live verification of #119: corpus output byte-identical to #118 (400/400, both engines); the only robustness change is the intended one (AI's dropped 'she said' is now rejected instead of pasted). Latency at baseline","timestamp":1791655193432,"segment":8,"confidence":null,"asi":{"hypothesis":"live verification of #119 (droppedContent catches 2+ outright-deleted words), both engines: all 400 corpus cases, 195 robustness inputs, fresh set 2","latency":"Qwen p50 398 ms, AI 702 ms (baseline)","next_action_hint":"nothing pending live. The loop's remaining levers are owner decisions and real-usage data; further probing rounds are optional","result":"corpus: raw and user-visible output byte-identical to #118 on 400/400 for both engines (the replay's other two hits, s4-001 AI and s5-068 Qwen, came from older stored runs whose outputs the current engines no longer produce). Robustness: the only change is the intended one, AI s1-p17 'I don't know,' (dropped 'she said', pasted) -> rejected with droppedContent, so the user keeps their text. Pass counts unchanged (Qwen 181/195, AI 149/195; fresh 2 26/30, 25/30) because the row was already failing; it now fails safe instead of pasting a deletion"}}
{"run":121,"commit":"9e27b83","metric":0.9288,"metrics":{"ai_dev_clean_preserved_rate":0.9714,"ai_dev_pass_rate":0.8136,"ai_dev_slang_kept_rate":0.9167,"ai_holdout_pass_rate":0.8,"qwen_dev_errors_fixed_rate":0.962,"qwen_dev_p95_ms":1827,"qwen_holdout_pass_rate":0.9048},"status":"keep","description":"Adversarial round 8 (6 mixed-feature documents: README, team recap, email, incident report, recipe, PR review): all restorers coexist correctly; one style bug (Qwen recased the writer's 'thurs' → 'Thurs'). SlangRestorer now restores a recased lowercase abbreviation mid-sentence. 5/6 → 6/6; replay over 22,445 outputs unchanged; parity 0 diffs","timestamp":1791655617475,"segment":8,"confidence":null,"asi":{"files":"SlangRestorer: a pass over aligned (kept) words restores a lowercase table abbreviation the model recased, skipping sentence and line starts; +1 test (3 expectations); harness restore_slang mirror; PIPELINE.md step 2; round 8 appended to the adversarial set (187 inputs)","harm_check":"full-chain replay new vs committed over 22,445 stored user-visible outputs: no change (the only stored instance, s5-072 Qwen 'TBH', is already lowercased by keepAllLowercase since that input has no capitals). Invariants hold (echo 674, idempotence 19,762, blocked answers 264 / 0 laundered); Swift/Python parity 0 differences on 3,620 pairs incl. round 8 and 10 recasing edge cases. Dev .9288 unchanged","hypothesis":"adversarial round 8: 6 realistic mixed-feature documents (a setup README with fence/inline code/schemeless+scheme links/@mention/list/—/…/2GB/6pm; a casual team recap with emoji, skin tone, abbreviations, ~/path, :); a formal email with approx./450kg/“quotes”/phone/email/signature; an incident report with timestamps, a commit hash, #channel, <@U…>, numbered list; a recipe with fractions, 350°F, 60 min, :P; a PR review with <@U…>, inline code, a schemeless typo-looking link, 14 mins, emoji) to find interactions between restorers","next_action_hint":"restorer interactions on mixed documents are clean; probing yield is now ~1 small style issue per round. Loop is effectively complete; owner items remain","result":"round 8 through the Qwen chain: 5/6 before. All restorers coexisted correctly (code, links incl. the typo-looking exmaple.com/old-docs, mention, hash, timestamps, units, fractions, °, emoji, emoticons, smart punctuation, line breaks, signature). One style bug: the model capitalized the writer's lowercase 'thurs' mid-sentence ('Thurs'); the mixed-case input means keepAllLowercase doesn't apply. Fixed: 6/6"}}
{"run":122,"commit":"1dd8426","metric":0.9288,"metrics":{"ai_dev_clean_preserved_rate":0.9714,"ai_dev_pass_rate":0.8136,"ai_dev_slang_kept_rate":0.9167,"ai_holdout_pass_rate":0.8,"qwen_dev_errors_fixed_rate":0.962,"qwen_dev_p95_ms":1828,"qwen_holdout_pass_rate":0.9048},"status":"keep","description":"Live verification of #121: corpus output byte-identical to #120 (400/400, both engines); Qwen passes all 6 mixed documents in the app. Found: Apple Intelligence deletes a leading Slack mention and it's pasted (no gate covers a dropped literal); next candidate","timestamp":1791656736883,"segment":8,"confidence":null,"asi":{"ai_round8":"Apple Intelligence on the 6 mixed documents: 2/6. Two ENGINE_FAILED (nothing pasted). s4-m03: 'approx.' -> 'approx' and '450kg' -> '450 kg' (unit respacing, which restoreUnits doesn't cover: it only maps spelled-out names). s5-m06: it DELETED the leading Slack mention '<@U02ZZ9K1>' and the output was pasted: LinkRestorer only repairs respelled literals, and deletesWords counts it as 1 word","hypothesis":"live verification of #121 (recased abbreviations) plus the new round-8 documents, both engines","next_action_hint":"a 'droppedLiteral' gate: any input literal (link, email, path, mention, hashtag, identifier, backslash token) missing from the output after LinkRestorer means the model deleted or rewrote it, so reject (replay for false positives first). Then unit-spacing restore ('450kg' -> '450 kg') for AI","result":"corpus: raw and user-visible output byte-identical to #120 on 400/400 for both engines. Robustness 201: Qwen 187 (round-8 documents 6/6 in the app, matching Python), AI 151. No changes on inputs shared with #120. Fresh 2 unchanged. Latency baseline (Qwen p50 389 ms, AI 710 ms)"}}
{"run":123,"commit":"251cdc0","metric":0.9288,"metrics":{"ai_dev_clean_preserved_rate":0.9714,"ai_dev_pass_rate":0.8136,"ai_dev_slang_kept_rate":0.9167,"ai_holdout_pass_rate":0.8,"qwen_dev_errors_fixed_rate":0.962,"qwen_dev_p95_ms":1827,"qwen_holdout_pass_rate":0.9048},"status":"keep","description":"droppedContent also rejects a deleted or rewritten literal: a typed link/email/path/mention/hashtag/identifier still missing after LinkRestorer (AI dropped '<@U02ZZ9K1>'). 0 labelled or passing outputs affected; parity 0 diffs","timestamp":1791656991897,"segment":8,"confidence":null,"asi":{"files":"OutputGate.dropsContent: rejects when any LinkRestorer literal of the input is missing from the output (gate runs after cleanResponse, so respelled ones are already restored); +1 test (3 expectations: dropped mention, dropped commit hash, kept URL); harness drops_content mirror; PIPELINE.md §4","harm_check":"0 acceptable outputs in any labelled set are missing a typed literal. Over every stored pasted output it fires on 6 rows, all failing: s5-m06 AI (the dropped mention) and s5-a31 AI (old pre-#100 rows whose shrug the current chain restores first, so it won't fire live); 0 passing rows. Invariants hold (echo 680, idempotence 20,562, blocked answers 264 / 0 laundered); Swift/Python parity 0 differences on 3,657 pairs incl. 16 literal edge cases (respelled literals restored and accepted; deleted or reworded ones rejected). Dev .9288 unchanged","hypothesis":"#122: Apple Intelligence deleted a leading Slack mention and it was pasted (LinkRestorer repairs only respelled literals; deletesWords counts one word). Literals are never proofread, so a typed literal missing after LinkRestorer means the model deleted or rewrote it: reject with droppedContent","next_action_hint":"unit-spacing restore for AI ('450kg' -> '450 kg'); then a live batch for #123-#124"}}
{"run":124,"commit":"d09358e","metric":0.9288,"metrics":{"ai_dev_clean_preserved_rate":0.9714,"ai_dev_pass_rate":0.8136,"ai_dev_slang_kept_rate":0.9167,"ai_holdout_pass_rate":0.8,"qwen_dev_errors_fixed_rate":0.962,"qwen_dev_p95_ms":1827,"qwen_holdout_pass_rate":0.9048},"status":"keep","description":"Units the model respaced or recased come back as typed ('450kg' → '450 kg' → '450kg', '300 MB' → '300MB' → '300 MB'), same number only. Replay: 1 change (AI s4-m03 fail→pass), 0 harm; parity 0 diffs","timestamp":1791657295968,"segment":8,"confidence":null,"asi":{"files":"TypographyRestorer.restoreUnits: alternatives = the unit's names + the typed symbol, spacing optional (\\\\s?), case-insensitive; doc comment updated; +1 test (3 expectations: 450kg, 300 MB, 10GB); harness restore_units mirror; PIPELINE.md 7b","harm_check":"full-chain replay new vs committed over 23,672 stored user-visible outputs: 1 change, AI s4-m03 fail->pass, 0 pass->fail. Invariants hold; Swift/Python parity 0 differences on 3,655 pairs incl. 14 unit edge cases ('5kg' -> '6 kg' left alone, '1300 mb' not matched for '300MB', 2.5GHz, decimal comma). Dev .9288 unchanged","hypothesis":"#122: Apple Intelligence respaces the writer's units ('450kg' -> '450 kg'), which #111 didn't cover (it only maps spelled-out names); extend restoreUnits to the same symbol respaced or recased, same number only","next_action_hint":"live batch for #123 (dropped literal) and #124 (unit spacing); expect AI s5-m06 rejected instead of pasted and s4-m03 passing"}}
{"run":125,"commit":"223449f","metric":0.9288,"metrics":{"ai_dev_clean_preserved_rate":0.9714,"ai_dev_pass_rate":0.8136,"ai_dev_slang_kept_rate":0.9167,"ai_holdout_pass_rate":0.8,"qwen_dev_errors_fixed_rate":0.962,"qwen_dev_p95_ms":1843,"qwen_holdout_pass_rate":0.9048},"status":"keep","description":"Live verification of #123-#124: corpus output byte-identical to #122 (400/400, both engines); exactly the two predicted AI changes (450kg restored, fail→pass; the dropped Slack mention now rejected instead of pasted). Qwen unchanged; latency at baseline","timestamp":1791658410343,"segment":8,"confidence":null,"asi":{"hypothesis":"live verification of #123 (dropped literal rejected) and #124 (respaced units restored), both engines: all 400 corpus cases, 201 robustness inputs, fresh set 2","latency":"Qwen p50 396 ms, AI 702 ms (baseline)","next_action_hint":"nothing pending live. Probing yield is ~1 small issue per round, mostly Apple Intelligence-only now; remaining levers are owner decisions and real-usage data","result":"corpus: raw and user-visible output byte-identical to #122 on 400/400 for both engines. Robustness: exactly the two predicted changes, both Apple Intelligence: s4-m03 '450 kg' -> '450kg' (fail->pass; AI robustness 151 -> 152/201), and s5-m06 the dropped '<@U02ZZ9K1>' mention, previously pasted, now rejected with droppedContent. Qwen unchanged (187/201). Fresh 2 unchanged (26/30, 25/30)"}}
{"run":126,"commit":"9f92543","metric":0.9288,"metrics":{"ai_dev_clean_preserved_rate":0.9714,"ai_dev_pass_rate":0.8136,"ai_dev_slang_kept_rate":0.9167,"ai_holdout_pass_rate":0.8,"qwen_dev_errors_fixed_rate":0.962,"qwen_dev_p95_ms":1827,"qwen_holdout_pass_rate":0.9048},"status":"keep","description":"Docs: RESULTS.md brought up to date with #116-#125 (latest live run, robustness 201: Qwen 187 vs AI 152, new fixes and gates, the laundering invariant and answered_pasted guardrail). No code change","timestamp":1791658476611,"segment":8,"confidence":null,"asi":{"files":"RESULTS.md: latest live run #125; robustness row 187/201 vs 152/201 (8 rounds); bug list + #116, #119/#123, #121/#124; guardrails paragraph (#117 invariant, answered_pasted check); Qwen-default rationale with #125 numbers; 125 experiments. PIPELINE.md already current per iteration","hypothesis":"housekeeping: RESULTS.md predated #116-#125 (edge brackets, short-deletion and dropped-literal gates, recased abbreviations, respaced units, the laundering invariant and answered_pasted check, latest live numbers)","next_action_hint":"docs current; nothing pending live. Owner decisions and real-usage data are the remaining levers"}}
{"run":127,"commit":"44e16a5","metric":0.9288,"metrics":{"ai_dev_clean_preserved_rate":0.9714,"ai_dev_pass_rate":0.8136,"ai_dev_slang_kept_rate":0.9167,"ai_holdout_pass_rate":0.8,"qwen_dev_errors_fixed_rate":0.962,"qwen_dev_p95_ms":1827,"qwen_holdout_pass_rate":0.9048},"status":"keep","description":"Timing probe of the Swift post-processing chain: ~20 ms at 1k chars, ~50 ms at 2k, 120-150 ms at the 3.3k input cap (quadratic alignments). About 1% of a long document's 8-14 s generation, so no optimization now; noted in ideas.md","timestamp":1791658596897,"segment":8,"confidence":null,"asi":{"decision":"no change: optimizing (one shared alignment per call, flat Int32 LCS tables) would save at most ~100 ms on near-cap inputs whose generation takes 8-14 s; noted in ideas.md for later","hypothesis":"the post-processing chain now runs several O(n*m) word alignments (slang, contraction, line breaks, deletesWords) plus close-spelling matching; on inputs near the 3.3k-char cap it might add noticeable latency in the real app","method":"env-gated scratch Swift test (never committed) timing ProofreadPrompt.cleanResponse + OutputGate.rejection, best of 3, on the 9 long documents' stored outputs plus synthetic 1k/2k/3.3k-char inputs (incl. a worst case: many lines, half the words recased)","next_action_hint":"nothing pending; owner decisions and real-usage data","result":"~20 ms at 1k chars, ~50 ms at 2k, 107-150 ms at 2.9-3.3k (quadratic). Typical selections (<500 chars) are a few ms. Relative to generation (p50 ~0.4 s for corpus-sized inputs, 8-14 s for 3k-char documents) the chain is ~1-5%"}}
{"run":128,"commit":"93366f5","metric":0.9288,"metrics":{"ai_dev_clean_preserved_rate":0.9714,"ai_dev_pass_rate":0.8136,"ai_dev_slang_kept_rate":0.9167,"ai_holdout_pass_rate":0.8,"qwen_dev_errors_fixed_rate":0.962,"qwen_dev_p95_ms":1827,"qwen_holdout_pass_rate":0.9048},"status":"keep","description":"Adversarial round 9 (over-editing clean text): Qwen Americanized 'colour' → 'color'. New SpellingVariantRestorer puts back a listed British spelling the model Americanized (curated ~600-form table, so real fixes like four→for are never undone). 19/20 → 20/20; replay 12 fail→pass (AI favourite, cancelled), 0 harm; parity 0 diffs","timestamp":1791659150230,"segment":8,"confidence":null,"asi":{"design":"the first version used suffix rules (our->or, ence->ense, lled->led) and the false-positive scan showed why that's unsafe: 'expence' -> 'expense' is a typo fix, and rules would also turn 'four'/'filled' into restorations of real fixes. Switched to a curated table of ~600 British forms (explicit words + inflected -our, -ise/-yse, -tre and doubled-l stems); the first table version also had a bug generating the doubled-l pairs as no-ops, caught in its own printout","files":"new bulletproof/Engines/SpellingVariantRestorer.swift (table + restore over 1:1-paired changed words, keeping the output's capitalization and punctuation), chained after SlangRestorer in cleanResponse; SpellingVariantRestorerTests (2 tests, 6 expectations incl. four/for, expence/expense, an American writer); harness restore_spelling_variants mirror; invariants echo list includes it; PIPELINE.md step 2b; round 9 appended to the adversarial set (207 inputs)","harm_check":"no labelled output conflicts (s3-045 lists both 'cancelled' and 'canceled'). Full-chain replay new vs committed over 24,898 stored user-visible outputs: 12 changes, all fail->pass (AI s1-c17 'favorite' -> 'favourite' x11, AI s2-059 'canceled' -> 'cancelled'), 0 pass->fail. Invariants hold (echo 680, idempotence 21,362, blocked answers 264 / 0 laundered); Swift/Python parity 0 differences on 3,681 pairs incl. round 9 and 20 variant edge cases (COLOUR, (colour), filled/filed, four/for). Dev .9288 unchanged","hypothesis":"adversarial round 9, over-editing of already-correct text: British spellings, intentional nonstandard forms (smol, heckin, gonna, y'all, fixin', ain't), archaic grammar, poetry line breaks, brand casing (iPhone, eBay, YouTube, LaTeX), legal text. A British writer's spelling is style the policy says to keep","next_action_hint":"loop effectively complete; live batch for #128 can go with the next verification","result":"round 9 through the Qwen chain: 19/20 before; the one failure: 'colour' -> 'color' (Qwen Americanized; it kept organise, travelled, cheque, programme, grey, centre, licence, favourite, flavour, defence). Everything else came through unchanged. After: 20/20"}}
{"run":129,"commit":"dba7bd9","metric":0.9288,"metrics":{"ai_dev_clean_preserved_rate":0.9714,"ai_dev_pass_rate":0.8136,"ai_dev_slang_kept_rate":0.9167,"ai_holdout_pass_rate":0.8,"qwen_dev_errors_fixed_rate":0.962,"qwen_dev_p95_ms":1823,"qwen_holdout_pass_rate":0.9048},"status":"keep","description":"Live verification of #128: corpus output byte-identical to #125 (400/400, both engines); Qwen keeps all 20 clean-text inputs incl. 'colour'; only intended change (AI 'favorite' → 'favourite'). AI standardizes dialect (smol, y'all, fixin', ain't), noted as an optional follow-up","timestamp":1791660290580,"segment":8,"confidence":null,"asi":{"ai_round9":"Apple Intelligence on round 9 (clean text): 15/20; it standardizes dialect and nonstandard forms ('smol heckin doggo' -> 'small doggo', \"y'all gonna\" -> \"you'll all\", \"fixin'\" -> 'fixing', \"Ain't nobody got time\" -> 'Nobody has time'); LaTeX blocked by the verify gate. Candidates if wanted: restore-only entries for smol/heckin and a g-dropping rule (fixin' -> fixing -> fixin'); Apple Intelligence-only and small, noted","hypothesis":"live verification of #128 (SpellingVariantRestorer), both engines: all 400 corpus cases, 221 robustness inputs (incl. round 9), fresh set 2","latency":"Qwen p50 393 ms, AI 700 ms (baseline)","next_action_hint":"nothing pending live; AI dialect standardization is a possible small follow-up. Otherwise owner items","result":"corpus: raw and user-visible output byte-identical to #125 on 400/400 for both engines. Robustness 221: Qwen 207 (round 9: 20/20 in the app, colour kept), AI 168. The only change on shared inputs is the intended one: AI s1-c17 'favorite' -> 'favourite' (fail->pass). Fresh 2 unchanged (26/30, 25/30)"}}
{"run":130,"commit":"f3d5c6b","metric":0.9288,"metrics":{"ai_dev_clean_preserved_rate":0.9714,"ai_dev_pass_rate":0.8136,"ai_dev_slang_kept_rate":0.9167,"ai_holdout_pass_rate":0.8,"qwen_dev_errors_fixed_rate":0.962,"qwen_dev_p95_ms":1827,"qwen_holdout_pass_rate":0.9048},"status":"keep","description":"Dialect forms come back: a dropped-g word with the writer's apostrophe ('fixin'' → 'fixing' → 'fixin''), and 'smol' (restore-only). Replay: 1 change (AI s1-k19 fail→pass), 0 harm; parity 0 diffs. Phrase rewrites (y'all, ain't) stay out of scope","timestamp":1791660650630,"segment":8,"confidence":null,"asi":{"files":"SpellingVariantRestorer: dropped-g branch (typed word ends in in' or in’ after trimming trailing punctuation, 4+ letters, output letters == typed letters + 'g'; keeps the writer's apostrophe style and the output's capitalization and punctuation); SlangRestorer table + 'smol'; +1 test (4 expectations incl. no apostrophe = typo fix, a trailing comma); harness mirrors; PIPELINE.md 2b","harm_check":"every labelled occurrence (s1-k19 fixin', s1-k10 smol) is kept in its labels. Full-chain replay new vs committed over 26,163 stored outputs: 1 change, AI s1-k19 fail->pass, 0 pass->fail. Invariants hold (echo 700, idempotence 22,162, blocked answers 264 / 0 laundered); Swift/Python parity 0 differences on 3,769 pairs incl. 16 edge cases (curly apostrophe, no apostrophe left corrected)","hypothesis":"#129: Apple Intelligence standardizes the writer's dialect (\"fixin'\" -> 'fixing', 'smol' -> 'small'); a dropped-g form with the writer's apostrophe, and 'smol', are style and can be restored safely when the model wrote exactly the standard form","limits":"phrase rewrites ('y'all gonna' -> \"you'll all\", \"Ain't nobody got time\" -> 'Nobody has time', 'smol heckin doggo' -> 'small doggo' with 'heckin' deleted) aren't word-for-word and stay as written; those rows still fail","next_action_hint":"nothing pending except a live check of #130 with the next batch; owner items"}}
{"run":131,"commit":"e0b90b4","metric":0.9288,"metrics":{"ai_dev_clean_preserved_rate":0.9714,"ai_dev_pass_rate":0.8136,"ai_dev_slang_kept_rate":0.9167,"ai_holdout_pass_rate":0.8,"qwen_dev_errors_fixed_rate":0.962,"qwen_dev_p95_ms":1820,"qwen_holdout_pass_rate":0.9048},"status":"keep","description":"Live verification of #130: corpus output byte-identical to #129 (400/400, both engines); only intended change (AI keeps the writer's \"fixin'\", 168 → 169/221 robustness). Qwen unchanged; latency at baseline","timestamp":1791661780089,"segment":8,"confidence":null,"asi":{"hypothesis":"live verification of #130 (dropped-g forms, smol), both engines: all 400 corpus cases, 221 robustness inputs, fresh set 2","latency":"Qwen p50 390 ms, AI 703 ms (baseline)","next_action_hint":"nothing pending live. The loop's yield is now one small, mostly Apple-Intelligence-only style issue per probing round; remaining levers are owner decisions and real-usage data","result":"corpus: raw and user-visible output byte-identical to #129 on 400/400 for both engines. Robustness: the only change is the intended one, AI s1-k19 'fixing' -> \"fixin'\" (fail->pass; AI 168 -> 169/221). Qwen unchanged 207/221. Fresh 2 unchanged (26/30, 25/30)"}}
