{"run":100,"commit":"0c25b31","metric":0.9288,"metrics":{"ai_dev_clean_preserved_rate":0.9714,"ai_dev_pass_rate":0.8136,"ai_dev_slang_kept_rate":0.9167,"ai_holdout_pass_rate":0.8,"qwen_dev_errors_fixed_rate":0.962,"qwen_dev_p95_ms":1827,"qwen_holdout_pass_rate":0.9048},"status":"keep","description":"Two Apple Intelligence silent-damage fixes: OutputGate.introducedSymbol rejects added currency signs/symbols/emoji ('$€1,299.99'), and LinkRestorer protects backslash tokens ('¯\\_(ツ)_/¯' lost its backslash). Each fires only on its target row (5 stored runs each), 0 harm; parity 0 diffs","timestamp":1791645700194,"segment":8,"confidence":3.000000000000033,"asi":{"caveat":"introducedSymbol also applies on the dictation path: a transcript model that turns spoken 'twenty dollars' into '$20' would now fall back to the raw transcript. The corpus has no such case and the dictation prompt keeps the speaker's words, so this is conservative by design","files":"OutputGate.introducedSymbol (new Rejection case: an introduced Unicode scalar of category Sc or So; message shares 'garbled text'); LinkRestorer: new literal pattern for any token containing a backslash, plus a fallback for backslash literals to match new plain output tokens; +2 tests (OutputGate 3 expectations incl. writer's $/skin tone/flag kept; LinkRestorer 2); harness mirrors; PIPELINE.md §3/§4","harm_check":"replay over every stored user-visible output: introducedSymbol fires only on s1-a25 AI (x5, failing rows); LinkRestorer change fires only on s5-a31 AI (x5, fail->pass); 0 pass->fail; 0 acceptable corpus outputs introduce a currency symbol. Invariants hold (594 inputs, 15,762 outputs). Swift/Python parity 0 differences on 3,054 pairs incl. 20 symbol/escape edge cases (© for (c) and ° for deg are rejected too, which is right for a proofread). Dev .9288 unchanged","hypothesis":"two silent-damage classes left in Apple Intelligence's pasted robustness failures: (1) introduced symbols ('$1,299.99' -> '$€1,299.99'); (2) dropped backslash escapes ('¯\\_(ツ)_/¯' -> '¯_(ツ)_/¯', markdown-escape interpretation). A proofread never adds symbols, and backslash tokens are literals like paths and links","next_action_hint":"remaining AI pasted failures are model-level (They are, notse->note, taks->tasks, 3:30 PM, tab->': '); Qwen's are model-level too. Deterministic headroom on the robustness set is essentially used up"}}
{"run":101,"commit":"0a91eaf","metric":0.8333,"metrics":{"ai_dev_clean_preserved_rate":0.9714,"ai_dev_pass_rate":0.8136,"ai_dev_slang_kept_rate":0.9167,"ai_holdout_pass_rate":0.8,"qwen_dev_errors_fixed_rate":0.962,"qwen_dev_p95_ms":1358,"qwen_holdout_pass_rate":0.9048},"status":"keep","description":"Out-of-sample set 2 (30 realistic messages written after #100, labels fixed first): Qwen 26/30 in the app, Apple Intelligence 25/30. 0 failures caused by a restorer or gate; all are model misses or gates correctly blocking model changes (AI emoji swap 🙂→😊, 'appt'→'app')","timestamp":1791645924032,"segment":8,"confidence":1.5000000000000164,"asi":{"failures":"Qwen (Swift): s2-g17 'Me and her' and s2-g18 'less people' (model grammar misses), s5-g10 'nite' -> 'night' (my label says keep; arguably a judgement call, left as labelled), s5-g27 'appt' -> 'app' blocked by the verify gate (correct catch). Apple Intelligence: s5-g07 swapped 🙂 -> 😊, which #100's introducedSymbol correctly blocked (not a false positive: the writer's emoji was replaced); s5-g09 '+' -> 'and' (rewording); s5-g10 nite; s2-g17 blocked (it wrote 'Me and she'); s5-g27 'thurs' -> 'thursday' blocked by the spell gate","hypothesis":"out-of-sample check of the deterministic steps added in #72-#100 on 30 new realistic messages (labels fixed before any run): do restorers or gates misfire on natural text with smart quotes, abbreviations, emoji with skin tones, links/paths/code/markup?","next_action_hint":"(a) emoji literal restorer for AI's emoji swaps; (b) weekday abbreviations in SlangRestorer (both in ideas.md). Neither is a harm fix; both turn AI errors into correct pastes","result":"no misfires: every deterministic step behaved on natural text (smart quotes and dashes kept, abbreviations kept, URL/path/code/markup untouched, skin-tone emoji intact). Qwen 26/30 in the app (Python mirror 25/30, the difference is runtime noise), Apple Intelligence 25/30. Every failure is model-level (grammar misses, rewording) or a gate correctly blocking a model change. 0 failures caused by a restorer or gate false positive","set":"fresh2-2026-10-10/ (30 cases; 1 incidental 6-word corpus overlap reworded before running); outputs saved as swift-outputs.jsonl and python-outputs.jsonl"}}
{"run":102,"commit":"b4319f8","metric":0.9288,"metrics":{"ai_dev_clean_preserved_rate":0.9714,"ai_dev_pass_rate":0.8136,"ai_dev_slang_kept_rate":0.9167,"ai_holdout_pass_rate":0.8,"qwen_dev_errors_fixed_rate":0.962,"qwen_dev_p95_ms":1827,"qwen_holdout_pass_rate":0.9048},"status":"keep","description":"SlangRestorer: weekday and month abbreviations (thurs, tues, sept…), restore-only. AI's 'thurs' → 'thursday' (then rejected by the spell gate) now comes back as typed. 0 stored outputs affected. Parity found a pre-existing Swift/Python key mismatch on Thai combining marks (fix next)","timestamp":1791646200568,"segment":8,"confidence":3.000000000000033,"asi":{"files":"SlangRestorer table +18 restore-only entries (mon, tue/tues, wed, thu/thur/thurs, fri, sat, sun, jan, feb, aug, sep/sept, oct, nov, dec); +1 test (3 expectations incl. 'the sun' untouched); harness _SLANG mirror","harm_check":"every corpus/fresh/robustness occurrence (thurs, sun x2) is labelled kept; replay over every stored user-visible output: 0 fires (no stored output expanded a weekday/month), 0 harm; AI's fresh-set-2 s5-g27 raw now comes out 'fyi, the vet appt moved to thurs at 4' with no gate rejection (was introducedMisspelling on lowercase 'thursday'). Invariants hold; dev .9288 unchanged","hypothesis":"weekday and month abbreviations are missing from SlangRestorer's table: Apple Intelligence expanded 'thurs' -> 'thursday' on fresh set 2 and the spell gate then rejected the lowercase day name","next_action_hint":"fix the Thai parity divergence (WordTokens.keys: use scalar-level letter/number categories like Python's isalnum, which drops combining marks); then the emoji restorer idea","parity_finding":"Swift/Python chain parity on 3,218 pairs: 1 difference, pre-existing and unrelated to this change. On a Thai input the model reordered a vowel sign ('สวัสดี' -> 'สัวสดี') and added a line break. Python's alignment keys drop combining marks (isalnum is False for Mn), so the words align and LineBreakRestorer removes the added break; Swift's keys filter grapheme clusters (Character.isLetter keeps the marks), so they don't align and the break stays. Fix next iteration"}}
{"run":103,"commit":"70e3da4","metric":0.9288,"metrics":{"ai_dev_clean_preserved_rate":0.9714,"ai_dev_pass_rate":0.8136,"ai_dev_slang_kept_rate":0.9167,"ai_holdout_pass_rate":0.8,"qwen_dev_errors_fixed_rate":0.962,"qwen_dev_p95_ms":1827,"qwen_holdout_pass_rate":0.9048},"status":"keep","description":"Parity fix: Swift word-alignment keys now drop combining marks per Unicode scalar (as the harness does), so a model's reordered Thai/Hindi vowel sign no longer breaks alignment. Swift/Python parity back to 0 diffs on 3,218 pairs","timestamp":1791646441947,"segment":8,"confidence":null,"asi":{"files":"WordTokens.keys (LineBreakRestorer.swift): scalar-level letter/number general categories instead of Character.isLetter/isNumber; +1 LineBreakRestorer test (Thai reorder + key equality); full suite passes","hypothesis":"fix the Swift/Python parity divergence found in #102: Swift alignment keys kept combining marks (grapheme-level filter), the harness's isalnum drops them, so words that differ only in a vowel sign (a Thai reorder) aligned in Python but not in Swift","next_action_hint":"loop paused by the owner. Not yet live-verified: #100, #102, #103 (all deterministic and parity-checked). Next live batch: SWIFT_VERIFY when the GPU is idle (also gives a clean latency reading)","result":"Swift/Python chain parity 0 differences on 3,218 pairs (was 1), incl. 10 new Thai/Hindi/combining-accent edge cases; invariants hold; Qwen dev .9288 unchanged (the Python side was already this behaviour)"}}
{"run":104,"commit":"5ca6282","metric":0.9288,"metrics":{"ai_dev_clean_preserved_rate":0.9714,"ai_dev_pass_rate":0.8136,"ai_dev_slang_kept_rate":0.9167,"ai_holdout_pass_rate":0.8,"qwen_dev_errors_fixed_rate":0.962,"qwen_dev_p95_ms":1878,"qwen_holdout_pass_rate":0.9048},"status":"keep","description":"Live verification of #100, #102, #103: corpus output byte-identical to #99 (400/400, both engines). Only intended robustness changes: AI's '$€' now rejected, shrug backslash kept, 'thurs' restored (AI robustness 84→85). Qwen p50 399 ms = idle baseline, so latency is unchanged","timestamp":1791647453693,"segment":8,"confidence":null,"asi":{"hypothesis":"live verification batch for #100 (introducedSymbol gate, backslash literals), #102 (weekday/month abbreviations), #103 (scalar-level alignment keys): SWIFT_VERIFY both engines all 400, then 115 robustness + 30 fresh-set-2 inputs through the app","latency":"Qwen p50 399 ms (= #91's idle 398), p95 1.88 s; AI p50 711 ms. Despite 82-85% GPU utilisation from other apps before the run, this matches the idle baseline, so #96's 766 ms was the Zoom call; latency is unchanged by #86-#103","next_action_hint":"nothing pending live; docs (RESULTS.md/PIPELINE.md) cover up to #92 plus pipeline notes through #100: a docs pass for #93-#104 is the remaining housekeeping. Further work needs a stronger model or real-usage data","result":"corpus: raw and user-visible output byte-identical to #99 on 400/400 for both engines (none of the three changes touches a corpus case, as predicted by replay). Robustness (115): Qwen 106 (unchanged), Apple Intelligence 85 (+1); the only changes are the intended ones: s1-a25 '$€1,299.99' now rejected (introducedSymbol) instead of pasted; s5-a31 shrug keeps its backslash (fail->pass); fresh-2 s5-g27 'thurs' restored, so it's pasted instead of rejected (still fails on an added comma). Fresh set 2: Qwen 26/30, AI 25/30 (unchanged)"}}
{"run":105,"commit":"46049e0","metric":0.9288,"metrics":{"ai_dev_clean_preserved_rate":0.9714,"ai_dev_pass_rate":0.8136,"ai_dev_slang_kept_rate":0.9167,"ai_holdout_pass_rate":0.8,"qwen_dev_errors_fixed_rate":0.962,"qwen_dev_p95_ms":1827,"qwen_holdout_pass_rate":0.9048},"status":"keep","description":"Docs: RESULTS.md and PIPELINE.md brought up to date with #93-#104 (latest live table, beyond-corpus table: fresh 1/2, robustness, typography; full bug list; slang/typography/markup/symbol steps; parity). No code change","timestamp":1791647552886,"segment":8,"confidence":null,"asi":{"files":"RESULTS.md (latest live run #104 table from per-engine metrics.py on run-2026-10-10-live-104; beyond-corpus table: fresh 1, fresh 2, robustness 115, typography probes; bug list extended to #93-#103; parity 3,218 pairs; Qwen-default rationale with #104 numbers; 104 experiments). PIPELINE.md: SlangRestorer v2-v3 + table extensions, scalar-level alignment keys (#103), fresh2 in the eval section","hypothesis":"housekeeping: RESULTS.md and PIPELINE.md predated #93-#104 (markup and symbol gates, slang v3 and table extensions, typography restorers, parity key fix, fresh set 2, latest live numbers)","next_action_hint":"docs current. Remaining work needs real-usage data (dictation:* telemetry, proofreadStats) or a stronger model; owner items in RESULTS.md"}}
{"run":106,"commit":"9893f38","metric":0.9288,"metrics":{"ai_dev_clean_preserved_rate":0.9714,"ai_dev_pass_rate":0.8136,"ai_dev_slang_kept_rate":0.9167,"ai_holdout_pass_rate":0.8,"qwen_dev_errors_fixed_rate":0.962,"qwen_dev_p95_ms":1827,"qwen_holdout_pass_rate":0.9048},"status":"keep","description":"Real-usage probe: proofreadStats (counts only) show 41 proofreads, 34 applied, 5 unchanged, 4 no-selection aborts, 0 gate rejections, 0 engine errors, no dictation use. Too small and clean to guide changes; no code change","timestamp":1791647700468,"segment":8,"confidence":null,"asi":{"conclusion":"real usage is too small (41 events) and shows no failure class to work on: every proofread either applied, came back unchanged or was a user-side no-selection. The corpus, fresh sets and robustness probes remain the only evidence for further changes. The release build is probably older than most of #24-#103, so its numbers describe the old chain","data":"proofreadStats in UserDefaults (counts only, no text), read-only. Release build (com.mahdiyusuf.bulletproof): Qwen 24 APPLIED / 3 UNCHANGED / 2 ABORTED(no-selection); Apple Intelligence 8 APPLIED / 2 UNCHANGED. Dev build (.dev): Apple Intelligence 2 APPLIED / 1 UNCHANGED / 2 ABORTED(no-selection). Totals: 41 events, 34 applied (83%), 5 unchanged, 4 no-selection aborts (hotkey with nothing selected or a failed copy), 0 gate rejections, 0 engine errors, 0 dictation events (no dictation:* keys: dictation unused or the installed build predates #69). No per-event log lines are retrievable (the telemetry logger isn't in the unified log under this subsystem)","hypothesis":"real-usage telemetry (proofreadStats, recorded since #69) may show failure classes the synthetic sets miss","next_action_hint":"install the current build and use it for a week, then read proofreadStats again (owner item 6). No deterministic headroom left on the eval sets; the loop is complete","privacy":"only aggregate counts were read; nothing written to the repo"}}
{"run":107,"commit":"4bc1e36","metric":0.9288,"metrics":{"ai_dev_clean_preserved_rate":0.9714,"ai_dev_pass_rate":0.8136,"ai_dev_slang_kept_rate":0.9167,"ai_holdout_pass_rate":0.8,"qwen_dev_errors_fixed_rate":0.962,"qwen_dev_p95_ms":1827,"qwen_holdout_pass_rate":0.9048},"status":"keep","description":"OutputGate.appendedContent: reject output that is the writer's whole text plus generated extra (Qwen pasted a 300-emoji run 2.3× long). Fires only on that case over all stored outputs; parity caught and fixed a Swift/Python word-character mismatch first (0 diffs on 3,228 pairs)","timestamp":1791648063772,"segment":8,"confidence":null,"asi":{"files":"OutputGate.appendedContent (new Rejection case + appendsContent + private GeneralCategory helpers isWordCharacter / isPunctuation), user-facing message in ProofreadingEngine; +1 OutputGateTests test (6 expectations: emoji run, appended phrase rejected; '?', cut-off-word completion, '3pm', a corrected text accepted); harness appends_content mirror; PIPELINE.md §4; ideas.md entry closed","harm_check":"0 acceptable corpus/fresh/robustness outputs flagged; over every stored user-visible output it fires only on s1-t05 Qwen (x5, already failing). Guard answers it also matches (g-01, g-02, g-11) were already rejected by earlier rules. Invariants hold; Swift/Python parity 0 differences on 3,228 pairs incl. 20 edge cases. Dev .9288 unchanged","hypothesis":"since #88's larger budget, Qwen (the default engine) can echo the writer's text and keep generating; the 300-emoji probe was pasted at 2.3x length (under overExpansion's 3x). Reject output that is the whole input plus 3+ non-punctuation characters added after a word boundary","next_action_hint":"no silent-damage case left in any stored pasted output that a deterministic rule can catch; remaining failures are model-level. Loop complete pending real-usage data","parity_catch":"the first version used Swift isAlphabetic vs Python isalpha for the word-boundary test; parity flagged 4 differences (a Thai vowel sign and a Devanagari mark are Alphabetic in Swift but not isalpha in Python). Both now use the same general-category set (letters, numbers, marks)","scope_limit":"in scripts without spaces (Thai), an appended word is indistinguishable from a completed word, so it's accepted (conservative: the gate doesn't fire)"}}
{"run":108,"commit":"ac309a9","metric":0.9288,"metrics":{"ai_dev_clean_preserved_rate":0.9714,"ai_dev_pass_rate":0.8136,"ai_dev_slang_kept_rate":0.9167,"ai_holdout_pass_rate":0.8,"qwen_dev_errors_fixed_rate":0.962,"qwen_dev_p95_ms":1827,"qwen_holdout_pass_rate":0.9048},"status":"keep","description":"Adversarial round 4 (20 technical inputs): Qwen 'corrected' a Slack mention <@U02ABC123> → <@U02ABC124> (pings someone else). LinkRestorer now also protects chat mentions and letter-digit identifiers (hashes, UUIDs). 0 corpus outputs affected; parity 0 diffs","timestamp":1791648432599,"segment":8,"confidence":null,"asi":{"files":"LinkRestorer pattern +2 literals (chat mentions <@…>/<#…>/<!…>; tokens of 6+ chars mixing letters and digits: commit hashes, UUIDs, Qwen3-4B, 120-room); +1 test (3 expectations incl. '3pm'/'gr8' not literals); harness _LINK mirror; PIPELINE.md step 6; round-4 cases appended to the adversarial set (121 inputs)","harm_check":"no labelled output in any set changes such a token (8 occurrences, all kept). Over every stored user-visible output no such token was ever altered, so 0 corpus changes. Invariants hold; Swift/Python parity 0 differences on 3,238 pairs incl. round 4 and 10 edge cases. Dev .9288 unchanged","hypothesis":"adversarial round 4 (20 technical-user inputs: bare identifiers, flags, Slack mentions, :shortcodes:, UUIDs, commit hashes, phone/date/time/units, €12,50, math, acronyms, ordinals, an email quote block, 'Sent from my iPhone', NODE_ENV=, #channel, camelCase, 9am-5pm): chat mentions and letter-digit identifiers are literals; a 'fixed' one pings or points to something else","next_action_hint":"time format restore: the writer's '6pm' / '8am' / '3:30pm' comes back as '6 pm' / '8 AM' (Qwen and AI, 16 stored outputs incl. corpus s5-024 for AI; every labelled output keeps the writer's form). Restore the typed time token when the output has the same time with different spacing/case","result":"round 4 through the Qwen chain: 17/20 before. Real bug: s5-d04 '<@U02ABC123>' -> '<@U02ABC124>' (a different person pinged); the opt-in verify gate caught it in the harness, but with the verify gate off (the app default) it would be pasted. Now restored, so the typo fix ships and the mention is untouched. Others left: s1-d08 '6pm' -> '6 pm' (time spacing, next), s5-d20 'its 9am-5pm' unfixed (model, 'its' is ambiguous)"}}
{"run":109,"commit":"a0bb7c2","metric":0.9288,"metrics":{"ai_dev_clean_preserved_rate":0.9714,"ai_dev_pass_rate":0.8136,"ai_dev_slang_kept_rate":0.9167,"ai_holdout_pass_rate":0.8,"qwen_dev_errors_fixed_rate":0.962,"qwen_dev_p95_ms":1827,"qwen_holdout_pass_rate":0.9048},"status":"keep","description":"Keep the writer's time format: '3:30pm' → '3:30 PM' / '6pm' → '6 pm' now come back as typed (same digits and a/p only). Replay: 16 fires, 13 fail→pass (both engines), 0 pass→fail; parity 0 diffs","timestamp":1791648659688,"segment":8,"confidence":null,"asi":{"files":"TypographyRestorer.restoreTimes (clock-time regex, key = digits + a/p), run first inside TypographyRestorer.restore; +1 test (5 expectations incl. a different time left alone); harness restore_times mirror; PIPELINE.md step 7b","harm_check":"every labelled output in all sets keeps the writer's time form (9 corpus inputs with clock times). Replay over every stored user-visible output: 16 fires, 13 fail->pass (s1-a24 on both engines: '3:30 PM'/'3:30 pm' -> '3:30pm'), 3 improved but still failing on other edits (corpus s5-024 AI '8 am' -> '8am'), 0 pass->fail. Invariants hold (614 inputs); Swift/Python parity 0 differences on 3,335 pairs incl. 20 time edge cases ('at 6pm' -> 'at 7 pm' left alone, ranges, a.m., 12:00am). Dev .9288 unchanged","hypothesis":"the writer's clock-time spelling is style ('6pm', '3:30pm', '11 a.m.'), but both models respace or recase it ('6 pm', '3:30 PM', '8 AM'); when the output has the same time (same digits, same a/p) spelled differently, put the writer's spelling back","next_action_hint":"round-4 leftovers are model-level ('its' ambiguity). A live verification batch for #107-#109 is the next useful step (corpus: expect AI s5-024 still failing, a24 passes on both)"}}
