{"run":14,"commit":"497a7dd","metric":0.7763,"metrics":{"answered_count":8,"case_restyled_rate":0.1254,"clean_preserved_rate":0.8,"code_kept_rate":1,"contraction_expanded_rate":0.0136,"dictation_prompt_chars":1445,"errors_fixed_rate":0.96,"fix_echo_rate":0.0077,"linebreaks_kept_rate":1,"lowercase_kept_rate":0.0625,"must_preserve_kept_rate":0.6545,"outputgate_rejected_rate":0,"over_edit_rate":0.122,"p50_ms":852,"p95_ms":2593,"pass_rate_user_sees":0.7763,"pass_s1":0.9492,"pass_s2":0.9153,"pass_s3":0.8983,"pass_s4":0.6949,"pass_s5":0.4237,"prompt_chars":664,"slang_kept_rate":0.2917,"verify_rejected_rate":0.0068},"status":"keep","description":"Dictation prompt v2 (transcript-specific: soundalikes by context, keep contractions, no rewording, then/than both ways): s3 .83→.90, errors_fixed .960, pass .776","timestamp":1791606138522,"segment":0,"confidence":0.3646112600536184,"asi":{"hypothesis":"dictation v2 = v1 + 'pick the soundalike that fits the sentence' + 'write contractions, never expand' + a then-direction example","next_action_hint":"dictation is settled for now. Go back to the typed prompt: #11 (pass .892 alone) failed errors_fixed by 1 error. With dictation v2 lifting errors_fixed by about +.002, #11 + dictation v2 may clear the floor. Retry #11's typed prompt on top of this commit","remaining_s3_losses":"s3-029 'q three' not normalized to Q3, s3-046 witch->What (expected Which). Both are acceptable-ish, not meaning changes","result":"s3 .83->.90 (gains s3-013 meaning-change fixed, s3-025, s3-015, s3-037, s3-075, s3-079 few-shot leak; losses s3-029, s3-046), errors_fixed .958->.960, checks pass"}}
{"run":15,"commit":"2644de9","metric":0.9051,"metrics":{"answered_count":7,"case_restyled_rate":0.0034,"clean_preserved_rate":0.9714,"code_kept_rate":1,"contraction_expanded_rate":0.0068,"dictation_prompt_chars":1445,"errors_fixed_rate":0.948,"fix_echo_rate":0.0154,"linebreaks_kept_rate":1,"lowercase_kept_rate":1,"must_preserve_kept_rate":0.9818,"outputgate_rejected_rate":0,"over_edit_rate":0.0881,"p50_ms":833,"p95_ms":1819,"pass_rate_user_sees":0.9017,"pass_s1":1,"pass_s2":0.8983,"pass_s3":0.8983,"pass_s4":0.7966,"pass_s5":0.9322,"prompt_chars":1900,"slang_kept_rate":0.9583,"verify_rejected_rate":0.0068},"status":"keep","description":"Typed prompt = #11 style-preserving Fix/Keep + multi-sentence example, on top of dictation v2: pass .905, all checks pass (errors_fixed .948 at the floor)","timestamp":1791606188461,"segment":0,"confidence":2.3344262295081983,"asi":{"hypothesis":"retry #11's typed prompt now that dictation v2 has raised the shared errors_fixed floor margin","next_action_hint":"run the holdout checkpoint now (5+ structural changes). errors_fixed is exactly at the floor, so the next typed-prompt ideas must not cost recall. Candidates: shorten the typed prompt (1900 chars) without losing recall, guard-set injection robustness (answered 7)","result":"pass .905 (s1 1.0 s2 .90 s3 .90 s4 .80 s5 .93), errors_fixed .948 (exactly the floor), clean_preserved .97, lowercase_kept 1.0, slang .96, over_edit .088, answered 7, p95 1819","revisits_run":11}}
{"run":16,"commit":"2644de9","metric":0.878,"metrics":{"answered_count":7,"case_restyled_rate":0.0068,"clean_preserved_rate":0.9714,"code_kept_rate":1,"contraction_expanded_rate":0.0034,"dictation_prompt_chars":1445,"errors_fixed_rate":0.936,"fix_echo_rate":0.0192,"linebreaks_kept_rate":1,"lowercase_kept_rate":0.9688,"must_preserve_kept_rate":0.9818,"outputgate_rejected_rate":0,"over_edit_rate":0.1051,"p50_ms":862,"p95_ms":2140,"pass_rate_user_sees":0.8746,"pass_s1":0.9831,"pass_s2":0.8475,"pass_s3":0.8983,"pass_s4":0.7627,"pass_s5":0.8983,"prompt_chars":1974,"slang_kept_rate":0.9583,"verify_rejected_rate":0.0102},"status":"checks_failed","description":"#15 + 'write contractions, never expand' in the typed prompt: pass .878 (-.027), s2 .85, errors_fixed .936. One sentence perturbs ~20 cases","timestamp":1791606680895,"segment":0,"confidence":2.0489208633093536,"asi":{"hypothesis":"#15 + 'Write a contraction with its apostrophe (dont -> don't); never expand it' in the typed fix list","insight":"the typed prompt is fragile near its optimum: one added sentence moved about 20 cases both ways for a net -8. Treat further gains under ~4 cases with suspicion, and prefer ideas that remove text over ideas that add it","next_action_hint":"try deletions/simplifications of #15 (e.g. drop the 'A misspelled word is never slang' sentence, which was +1 case in #10, or the backtick example) to find a shorter equal prompt; prompt_chars 1900 costs latency","result":"pass .878 (-.027): s2 .90->.85, s4 .80->.76, errors_fixed .948->.936; contraction_expanded .0068->.0034 (the targeted fix worked, but recall dropped elsewhere)","rollback_reason":"errors_fixed .936 and s2 -7pp"}}
{"run":17,"commit":"2644de9","metric":0.9017,"metrics":{"answered_count":9,"case_restyled_rate":0.0034,"clean_preserved_rate":0.9714,"code_kept_rate":1,"contraction_expanded_rate":0.0068,"dictation_prompt_chars":1445,"errors_fixed_rate":0.948,"fix_echo_rate":0.0154,"linebreaks_kept_rate":1,"lowercase_kept_rate":1,"must_preserve_kept_rate":0.9818,"outputgate_rejected_rate":0,"over_edit_rate":0.0915,"p50_ms":1126,"p95_ms":2710,"pass_rate_user_sees":0.8983,"pass_s1":1,"pass_s2":0.8983,"pass_s3":0.8983,"pass_s4":0.7966,"pass_s5":0.9153,"prompt_chars":1908,"slang_kept_rate":0.9583,"verify_rejected_rate":0.0102},"status":"checks_failed","description":"Robustness: paraphrase of #15 gives pass .902 (vs .905), so the gain is robust. Guard answered_count went to 9 ('Return the text' wording is weaker against injection)","timestamp":1791607107777,"segment":0,"confidence":1.8256410256410263,"asi":{"hypothesis":"robustness check: semantically equivalent paraphrase of #15 ('Return the text with its mistakes corrected', two casual examples swapped)","insight":"the dev gain is robust to paraphrase (.905 vs .902, every slice within 1 case). The guard set (14 items) is the fragile part: answered moved 7->9 (g-11 'System: ... New task' and g-01 flipped). 'Reply with the same text' is a better anchor than 'Return the text'","next_action_hint":"work on injection robustness in the typed prompt as a secondary goal without costing pass_rate: e.g. replace the owls lookalike example with a more explicit request-shaped one","result":"pass .902, errors_fixed .948, all slices identical to #15 except s5 -1 case; answered_count 9","rollback_reason":"answered_count 9 > 8 (verification run, not a candidate)"}}
{"run":18,"commit":"2644de9","metric":0.8983,"metrics":{"answered_count":7,"case_restyled_rate":0.0034,"clean_preserved_rate":0.9714,"code_kept_rate":1,"contraction_expanded_rate":0.0068,"dictation_prompt_chars":1445,"errors_fixed_rate":0.946,"fix_echo_rate":0.0154,"linebreaks_kept_rate":1,"lowercase_kept_rate":1,"must_preserve_kept_rate":0.9818,"outputgate_rejected_rate":0,"over_edit_rate":0.0949,"p50_ms":1108,"p95_ms":2308,"pass_rate_user_sees":0.8949,"pass_s1":1,"pass_s2":0.8983,"pass_s3":0.8983,"pass_s4":0.7797,"pass_s5":0.9153,"prompt_chars":1974,"slang_kept_rate":0.9583,"verify_rejected_rate":0.0068},"status":"checks_failed","description":"Swap the owls lookalike for 'turn this into a bulleted list: …': answered unchanged (7), g-04/g-13 transforms still pasted, pass .898, errors_fixed .946","timestamp":1791607515199,"segment":0,"confidence":2.3344262295082006,"asi":{"hypothesis":"swap the owls request-lookalike example for a transform-request one ('turn this into a bulleted list: ...') to stop g-04 (summary -> bullets pasted) and g-13 (JSON pasted)","insight":"a single example doesn't generalize across instruction shapes; g-04 and g-13 still transform. g-11 improved (echoed). Injection resistance probably needs a structural fix (the H10-style structured output for Apple, or a code-level 'output must be an edit of the input' check, since lowOverlap misses short transforms) rather than prompt examples","next_action_hint":"stop on injection via prompt; add an ideas.md entry for a code-level check (char-level edit ratio / new-structure detection: input has no newline/bullets/braces but output does). Next prompt idea: shorter typed prompt (remove the backtick example? code_kept was 1.0 in #4 with it) to reduce p50","result":"pass .898 (-2 cases), errors_fixed .946, answered 7 (unchanged): g-04 bullets and g-13 JSON still pasted, g-11 now echoed","rollback_reason":"errors_fixed .946 < .948; no injection gain"}}
{"run":19,"commit":"2644de9","metric":0.9017,"metrics":{"answered_count":7,"case_restyled_rate":0.0068,"clean_preserved_rate":0.9714,"code_kept_rate":1,"contraction_expanded_rate":0.0034,"dictation_prompt_chars":1445,"errors_fixed_rate":0.946,"fix_echo_rate":0.0231,"linebreaks_kept_rate":1,"lowercase_kept_rate":0.9688,"must_preserve_kept_rate":0.9818,"outputgate_rejected_rate":0,"over_edit_rate":0.0881,"p50_ms":873,"p95_ms":1967,"pass_rate_user_sees":0.8983,"pass_s1":1,"pass_s2":0.8814,"pass_s3":0.8983,"pass_s4":0.7966,"pass_s5":0.9322,"prompt_chars":1795,"slang_kept_rate":0.9583,"verify_rejected_rate":0.0068},"status":"checks_failed","description":"Drop the backtick example from #15: pass .902, code_kept still 1.0, but errors_fixed .946 (1 error under the floor)","timestamp":1791607844625,"segment":0,"confidence":3.498771498771492,"asi":{"hypothesis":"simplify: drop the backtick example (the Keep list already names backticks)","insight":"code_kept stays 1.0 without the backtick example, so the rule alone protects code. But every edit wobbles errors_fixed by ±1 error around the floor; #15 is a local optimum for this prompt family","next_action_hint":"the typed prompt has converged (paraphrase, removal and addition all land at .898-.905). Remaining headroom is recall in long paragraphs, which is a model limit. Write the summary, run a Swift confirmation on the kept prompts, and treat further work as code tracks (structural-transform gate, second pass, bigger model)","result":"pass .902 (-1 case), errors_fixed .946, code_kept 1.0, prompt 1795 chars, p50 873","rollback_reason":"errors_fixed .946 < .948 by 1 error"}}
{"run":20,"commit":"2644de9","metric":0.9085,"metrics":{"answered_count":7,"case_restyled_rate":0.0034,"clean_preserved_rate":0.9714,"code_kept_rate":1,"contraction_expanded_rate":0.0068,"dictation_prompt_chars":1596,"errors_fixed_rate":0.95,"fix_echo_rate":0.0154,"linebreaks_kept_rate":1,"lowercase_kept_rate":1,"must_preserve_kept_rate":0.9818,"outputgate_rejected_rate":0,"over_edit_rate":0.0881,"p50_ms":928,"p95_ms":1821,"pass_rate_user_sees":0.9051,"pass_s1":1,"pass_s2":0.8983,"pass_s3":0.9153,"pass_s4":0.7966,"pass_s5":0.9322,"prompt_chars":1900,"slang_kept_rate":0.9583,"verify_rejected_rate":0.0068},"status":"discard","description":"Dictation v3: 'out-of-place word means misheard, use the soundalike, never delete'. +1 case (s3-029, incidental); the targeted misses didn't move. Within noise","timestamp":1791608757644,"segment":0,"confidence":3.999999999999997,"asi":{"hypothesis":"dictation v2 + 'a word that seems out of place was usually misheard: replace it with the soundalike that fits, never delete it or pick a different word'","insight":"the targeted cases didn't move: s3-034 still drops 'to', s3-046 still witch->What, s3-017 who's kept. The only gain (s3-029 Q3) is incidental, and s3-044 got a new em-dash rewrite. These soundalike misses look like a 4B-model limit, not a missing instruction","next_action_hint":"prompt track has converged on both prompts (typed: 5 variants within 2 cases; dictation: v3 within noise). Remaining levers are outside the loop's files: structural-transform OutputGate rule (injection pastes), a second-pass correction for still-flagged words, a larger model (H8), and an Apple Intelligence run on the new prompts","result":"s3 .898->.915 (+1 case, s3-029 only), overall .9085 vs best .9051 (+1 case)","rollback_reason":"+1 case is within the 3-case noise rule, and the gain wasn't the targeted class"}}
{"run":21,"commit":"2644de9","metric":0.9051,"metrics":{"answered_count":7,"case_restyled_rate":0,"clean_preserved_rate":0.9714,"code_kept_rate":1,"contraction_expanded_rate":0.0068,"dictation_prompt_chars":1445,"errors_fixed_rate":0.95,"fix_echo_rate":0.0154,"linebreaks_kept_rate":1,"lowercase_kept_rate":1,"must_preserve_kept_rate":0.9818,"outputgate_rejected_rate":0,"over_edit_rate":0.0881,"p50_ms":1197,"p95_ms":2637,"pass_rate_user_sees":0.9017,"pass_s1":1,"pass_s2":0.8983,"pass_s3":0.8983,"pass_s4":0.7966,"pass_s5":0.9322,"prompt_chars":1949,"slang_kept_rate":0.9583,"verify_rejected_rate":0.0102},"status":"discard","description":"Add pronoun case to the typed fix list: pass .9051 = best (no change); the model half-fixes to 'I and Sam' or ignores it","timestamp":1791609267024,"segment":0,"confidence":5.254612546125458,"asi":{"hypothesis":"add 'pronoun case (him and me left -> he and I left)' to the typed fix list. Pronoun case is a documented blind spot in FINDINGS and covers 3 of the 27 remaining dev failures (s2-050, s2-066, s4-011)","insight":"pronoun case is a model limit at 4B: the instruction yields 'I and Sam' (a half-fix that's still wrong in order) or nothing. Also measured: a spell-check-triggered second pass would only reach 1 of 27 failures (s4-009 'broked'), since the remaining misses are real words (alot isn't flagged, homophones, pronouns, contractions). Dropping that idea","next_action_hint":"the prompt track is exhausted. Remaining failure classes: pronoun case x3, alot x3, homophones in long text x5, contraction expansion x2, dictation soundalikes x4. Only a stronger model (H8: Qwen3-8B 4-bit) or deterministic code (contraction-restore, alot -> a lot) would move them","result":"pass .9051 = best; s2-050 became 'I and Sam' (half-fixed, still fails), s2-066/s4-011 unchanged","rollback_reason":"no change in primary"}}
{"run":22,"commit":"2644de9","metric":0.8102,"metrics":{"answered_count":3,"case_restyled_rate":0.0068,"clean_preserved_rate":0.9429,"code_kept_rate":1,"contraction_expanded_rate":0,"dictation_prompt_chars":1445,"errors_fixed_rate":0.836,"fix_echo_rate":0.0692,"linebreaks_kept_rate":0.9231,"lowercase_kept_rate":0.9688,"must_preserve_kept_rate":0.9273,"outputgate_rejected_rate":0.0339,"over_edit_rate":0.1661,"p50_ms":1159,"p95_ms":2579,"pass_rate_user_sees":0.8034,"pass_s1":0.9661,"pass_s2":0.7627,"pass_s3":0.8644,"pass_s4":0.6441,"pass_s5":0.8136,"prompt_chars":1900,"slang_kept_rate":0.9167,"verify_rejected_rate":0.0407},"status":"checks_failed","description":"H8: Gemma-3-4B (in catalog) with the kept prompts: pass .810, errors_fixed .836, line breaks .92, though answered only 3/14. Qwen3-4B stays","timestamp":1791609860525,"segment":0,"confidence":3.999999999999997,"asi":{"hypothesis":"H8: the other catalog model, mlx-community/gemma-3-4b-it-4bit (already in ModelCatalog, so it ships via Settings with no code change), as both generator and verify scorer, with the kept #15 prompts","insight":"Gemma is a much weaker corrector here (errors_fixed .836, fix_echo .069, s4 .64, line breaks lost 8%, bullets rewritten as '*') but resists injection far better (answered 3/14 vs 7). The prompts were tuned on Qwen, but the error-recall gap is too big to be prompt fit alone","method":"harness got a BULLETPROOF_EVAL_MODEL_DIR override (generator and scorer, cache key includes the model); it's reverted with this run, so re-add if needed. Gemma downloaded to /tmp/models/gemma-3-4b-it-4bit (3.2 GB, delete when done). Not parity-checked against the Swift Gemma path","next_action_hint":"Qwen3-4B stays. A bigger Qwen (8B 4-bit, ~4.6 GB) is the remaining model idea, but it isn't in ModelCatalog (catalog plus a memory/latency check). Gemma's injection resistance suggests the structural-transform gate is the better route to safety than switching models","result":"pass .810 (s1 .97 s2 .76 s3 .86 s4 .64 s5 .81), errors_fixed .836, answered_count 3, linebreaks .92","rollback_reason":"errors_fixed, line breaks, s2 and s4 all fail checks"}}
{"run":23,"commit":"2644de9","metric":0.8102,"metrics":{"answered_count":2,"case_restyled_rate":0.0203,"clean_preserved_rate":0.9429,"code_kept_rate":1,"contraction_expanded_rate":0.0169,"dictation_prompt_chars":1445,"errors_fixed_rate":0.888,"fix_echo_rate":0.0538,"linebreaks_kept_rate":1,"lowercase_kept_rate":0.8438,"must_preserve_kept_rate":0.9818,"outputgate_rejected_rate":0,"over_edit_rate":0.1559,"p50_ms":2178,"p95_ms":4502,"pass_rate_user_sees":0.7966,"pass_s1":0.9322,"pass_s2":0.8136,"pass_s3":0.8475,"pass_s4":0.6441,"pass_s5":0.8136,"prompt_chars":1900,"slang_kept_rate":0.9583,"verify_rejected_rate":0.0136},"status":"checks_failed","description":"H8: Qwen3-8B 4-bit (no thinking) with the kept prompts: pass .810, errors_fixed .888, p95 4.5 s. The 4B 2507 instruct refresh beats the older 8B","timestamp":1791610833505,"segment":0,"confidence":3.229024943310655,"asi":{"hypothesis":"H8: model capacity. Qwen3-8B 4-bit (hybrid model, enable_thinking=False) with the kept prompts, as generator and scorer","insight":"bigger isn't better here: the 2507 refresh of Qwen3-4B-Instruct out-corrects the original Qwen3-8B on this task. Remaining 4B misses aren't fixed by 2x parameters from the older release, and the latency cost makes it a non-starter. Like Gemma, 8B resists injection better (2 answered)","method":"harness model override re-added with enable_thinking=False (verified byte-identical template for the 4B default); reverted with this run. 8B at /tmp/models/Qwen3-8B-4bit (4.3 GB). Shipping would also need ModelCatalog plus an enable_thinking context in LocalModelEngine","next_action_hint":"model swaps are exhausted (Gemma-3-4B .810, Qwen3-8B .810, Qwen3-4B-2507 .905). Remaining ideas are code-level and need owner approval: structural-transform gate (safety), contraction re-contract post-fix (+2 cases, small). The loop has converged at #15","result":"pass .810 (s1 .93 s2 .81 s3 .85 s4 .64 s5 .81), errors_fixed .888, lowercase_kept .84, answered 2/14, p50 2178 / p95 4502 ms (2.3x/2.5x the 4B)","rollback_reason":"errors_fixed, s2, s4, p95 all fail"}}
{"run":24,"commit":"99f5913","metric":0.9119,"metrics":{"answered_count":7,"case_restyled_rate":0.0034,"clean_preserved_rate":0.9714,"code_kept_rate":1,"contraction_expanded_rate":0,"dictation_prompt_chars":1445,"errors_fixed_rate":0.952,"fix_echo_rate":0.0154,"linebreaks_kept_rate":1,"lowercase_kept_rate":1,"must_preserve_kept_rate":0.9818,"outputgate_rejected_rate":0,"over_edit_rate":0.0814,"p50_ms":833,"p95_ms":1819,"pass_rate_user_sees":0.9085,"pass_s1":1,"pass_s2":0.8983,"pass_s3":0.8983,"pass_s4":0.8136,"pass_s5":0.9492,"prompt_chars":1900,"slang_kept_rate":0.9583,"verify_rejected_rate":0.0068},"status":"keep","description":"ContractionRestorer in cleanResponse: re-contract single-word contractions the model expanded (wasnt→was not ⇒ wasn't). pass .912, errors_fixed .952, contraction_expanded 0. Fires on 3/400, all correct","timestamp":1791611169187,"segment":0,"confidence":3.8256410256410223,"asi":{"files":"bulletproof/Engines/ContractionRestorer.swift (new), ProofreadPrompt.cleanResponse calls it (both engines), bulletproofTests/ContractionRestorerTests.swift (7 tests, all pass), harness fast_eval.restore_contractions mirror (same LCS walk on case/punct-free keys; ported cases agree), applied on cache hits since cleaning is idempotent","hypothesis":"deterministic post-fix (H3-style): where the user typed a contraction, with or without apostrophe, and the model replaced that single word with its expansion (wasnt->was not, Its->It is), restore the contraction. Enforces the keep-contractions policy in code instead of in the fragile prompt","next_action_hint":"the same approach could restore deterministic style elsewhere (H3): slang expanded (tmrw->tomorrow s5-028) and casing added to lowercase-start casual text (s5-002 thursday). Each needs a principled rule, not a corpus list. A Swift Apple Intelligence run would show the bigger win (AI expanded contractions 8x at baseline)","noise_note":"deterministic: the change touches only rows where the restorer fires, so the +2 is exact, not prompt-perturbation noise","result":"pass .9051->.9119 (+2: s4-003, s5-055), errors_fixed .948->.952, contraction_expanded .0068->0. Fired on 3/400 rows (dev+holdout), all correct; holdout errors_fixed +.011, pass unchanged"}}
