{"run":68,"commit":"c6e0575","metric":0.9186,"metrics":{"ai_dev_clean_preserved_rate":0.9429,"ai_dev_pass_rate":0.8102,"ai_dev_slang_kept_rate":0.9167,"ai_holdout_pass_rate":0.7905,"qwen_dev_errors_fixed_rate":0.954,"qwen_dev_p95_ms":1827,"qwen_holdout_pass_rate":0.9048},"status":"keep","description":"H7: the practice drill only learns real typing slips (misspelled, apostrophe-only, soundalike, or a one-letter slip), not model rewrites. Real stats: understood→understand ×7, know→knows, til→until now excluded, all 14 real typos kept","timestamp":1791631724978,"segment":8,"confidence":null,"asi":{"evidence":"the developer's 19 real drill pairs: the 4 suspected model rewrites (understood->understand x7, know->knows, til->until, hellod->hello) are now excluded, and all 14 real typos are kept (dont, wonderign, cuold, tempplate, its/it's, fro->for...). Of->have is excluded too (grammar, debatable). Corpus single-word error pairs: 519/563 still drillable; dropped are mostly grammar/tense pairs (is/are, has/have, build/built, seen/saw) plus a few homophones the skeleton misses (accept/except, witch/which, threw/through)","files":"CorrectionStats.isTypo(_:fixedTo:) + soundSkeleton + isOneEditApart, injectable isMisspelled, CorrectionStatsTests.modelRewritesAreNotDrilledButTyposAndHomophonesAre (full suite passes)","hypothesis":"H7: the practice drill records every one-word diff as the user's typo, so model rewrites get drilled. Count a pair only if the typed word is misspelled, differs only by an apostrophe, sounds the same (consonant skeleton), or is a one-letter slip in a 5+ letter word","metric_note":"the drill isn't part of the correction eval, so the primary is unchanged (.9186)","next_action_hint":"H5 (dictation fallback telemetry) is the last backlog item; product hygiene"}}
{"run":69,"commit":"ff1709e","metric":0.9186,"metrics":{"ai_dev_clean_preserved_rate":0.9429,"ai_dev_pass_rate":0.8102,"ai_dev_slang_kept_rate":0.9167,"ai_holdout_pass_rate":0.7905,"qwen_dev_errors_fixed_rate":0.954,"qwen_dev_p95_ms":1827,"qwen_holdout_pass_rate":0.9048},"status":"keep","description":"H5: dictation proofreads are now counted in proofreadStats (dictation:<engine>|<outcome>), including the silent raw-transcript fallback on rejection or error. Unit-tested without touching the real defaults; eval unchanged","timestamp":1791631905250,"segment":8,"confidence":null,"asi":{"files":"ProofreadEntryPoint.dictation, DictationController (engineLabel + injectable recordTelemetry, default ProofreadTelemetry.shared), HotkeyDispatcher passes the engine label, DictationControllerTests.dictationProofreadOutcomesAreCounted + test helper uses a no-op recorder (never writes the real app defaults); full suite passes","hypothesis":"H5: dictation proofread outcomes (including the silent raw-transcript fallback on gate rejection or error) were never counted, so real usage couldn't show dictation problems. Record a ProofreadEvent per dictation proofread under 'dictation:<engine>|<outcome>' in proofreadStats","metric_note":"telemetry only; the correction eval is unchanged (.9186)","next_action_hint":"backlog H1-H10 is now fully addressed or tested. After a week of real use, read proofreadStats for dictation:* rejection rates and compare with the hotkey path (H5's goal). The loop is complete","ui_note":"no overlay notice added for the fallback (UI decision left to the owner); the counts appear in Settings > Statistics automatically"}}
{"run":70,"commit":"a3985a9","metric":0.9186,"metrics":{"ai_dev_clean_preserved_rate":0.9429,"ai_dev_pass_rate":0.8102,"ai_dev_slang_kept_rate":0.9167,"ai_holdout_pass_rate":0.7905,"qwen_dev_errors_fixed_rate":0.954,"qwen_dev_p95_ms":1861,"qwen_holdout_pass_rate":0.9048},"status":"keep","description":"Refactor: one shared WordAlignment for the contraction, slang and line-break restorers (net -57 lines). Proven no-op: live Swift output byte-identical to #64 on all 400 cases for both engines","timestamp":1791632747280,"segment":8,"confidence":null,"asi":{"files":"WordAlignment (new, in LineBreakRestorer.swift beside WordTokens), ContractionRestorer drops its own tokenizer + LCS walk, SlangRestorer and LineBreakRestorer use WordAlignment.steps; full test suite passes","hypothesis":"simplicity refactor: three restorers each carried their own copy of the LCS word alignment (and ContractionRestorer its own tokenizer). Extract one shared WordAlignment.steps (the same EditDiff walk) and reuse WordTokens","next_action_hint":"nothing left in scope. Loop complete; owner items only","result":"net -57 lines (56+/113-) across the 3 restorers. Behaviour proven identical: live Swift, both deterministic engines, all 400 cases are byte-identical to #64 (Apple Intelligence 400/400, Qwen 400/400, user_sees 400/400 each)"}}
{"run":71,"commit":"6582985","metric":0.9186,"metrics":{"ai_dev_clean_preserved_rate":0.9429,"ai_dev_pass_rate":0.8102,"ai_dev_slang_kept_rate":0.9167,"ai_holdout_pass_rate":0.7905,"qwen_dev_errors_fixed_rate":0.954,"qwen_dev_p95_ms":1827,"qwen_holdout_pass_rate":0.9048},"status":"keep","description":"Docs: PIPELINE.md describes the current correction pipeline (two prompts, prefix cache, greedy AI, the 6-step post-processing chain, gates, verify gate, telemetry, eval commands), checked against the code. README updated. No code change","timestamp":1791632859470,"segment":8,"confidence":null,"asi":{"files":"bulletproof-correction-improvements/PIPELINE.md (new: current pipeline with file pointers and experiment refs), README.md table points to PIPELINE.md and RESULTS.md; context/pipeline.md kept as the baseline snapshot","hypothesis":"documentation: context/pipeline.md describes the baseline (75e4a8a) and is wrong about almost every stage now. Write a current pipeline reference (prompts, engines, post-processing order, gates, verify gate, telemetry, eval commands and gotchas), checked against the code","next_action_hint":"loop complete; owner items only","result":"docs only; eval unchanged (.9186)"}}
{"run":72,"commit":"8431125","metric":0.9186,"metrics":{"ai_dev_clean_preserved_rate":0.9429,"ai_dev_pass_rate":0.8102,"ai_dev_slang_kept_rate":0.9167,"ai_holdout_pass_rate":0.7905,"qwen_dev_errors_fixed_rate":0.954,"qwen_dev_p95_ms":1827,"qwen_holdout_pass_rate":0.9048},"status":"keep","description":"Fix a #46 regression: correct non-English fixes (très, réunion, útil, Mittwoch) were rejected as misspellings. The spell check now uses the output's own language when confidently non-English. Multilingual set 8/10 rejected → 0; 0 English cases affected (10,148 stored outputs)","timestamp":1791633230095,"segment":8,"confidence":null,"asi":{"design":"the dictionary is decided on the corrected output (cleaner than the typo-laden input) and only when NLLanguageRecognizer is >=0.8 confident it isn't English. Typo-heavy short English inputs scored 0.65-0.78 (they would misfire on the input), so English keeps the #46 US/British rule","files":"SpellCheckGate.dictionary(forText:) + automaticLanguage, OutputGatedEngine passes the output's dictionary to the introducedMisspelling check, OutputGateTests.correctNonEnglishFixesAreNotMisspellings (full suite passes); harness langdet.swift + spellcheck.swift language arg + fast_eval mirror; multilingual-2026-10-10/ (10 cases + README + before/after outputs)","harm_check":"of 10,148 stored English-corpus outputs, 23 are classified non-English, all of them s5-068 Spanish *translations*, already rejected earlier by lowOverlap. So no English case changes; dev .9186 unchanged","hypothesis":"regression from #46: on an English system the en/en_GB spell check flags every correct non-English word the model writes, so introducedMisspelling discards correct French/Spanish/German/Portuguese fixes. Use the corrected text's own language (NLLanguageRecognizer >= 0.8 confidence, not English) for the introducedMisspelling check","next_action_hint":"SpanTriage typo detection for non-English text still uses the English rule (it only skips scoring, fail-safe). Fine to leave. Loop complete","result":"multilingual set: 8/10 correct fixes rejected -> 0 rejected (s1-m08 is still blocked by droppedContent because Qwen translated German to English, which is correct). Before #46 (auto-language) 0/10 were rejected, so this was a regression I introduced and it's now fixed"}}
{"run":73,"commit":"f55e051","metric":0.9186,"metrics":{"ai_dev_clean_preserved_rate":0.9429,"ai_dev_pass_rate":0.8102,"ai_dev_slang_kept_rate":0.9167,"ai_holdout_pass_rate":0.7905,"qwen_dev_errors_fixed_rate":0.954,"qwen_dev_p95_ms":1827,"qwen_holdout_pass_rate":0.9048},"status":"keep","description":"Fix: ApostropheFixer corrupted non-English text (German \"im\" → \"I'm\", French \"dont\" → \"don't\"). Now skipped when the text is confidently non-English. 4 regression controls added (all pass); English unaffected (dev .9186)","timestamp":1791633424999,"segment":8,"confidence":null,"asi":{"files":"TextLanguage.confidentNonEnglish (nonisolated, shared with SpellCheckGate.dictionary), cleanResponse gates ApostropheFixer on it, ApostropheFixerTests.nonEnglishTextIsLeftAlone (full suite passes), harness fix_apostrophes mirror gated via langdet; multilingual-2026-10-10 +4 clean controls (s1-m11..m14) and outputs","harm_check":"of all stored English-corpus outputs that contain an apostrophe candidate (10), 0 are now skipped as non-English; dev .9186 unchanged; short English like 'im on my way, dont wait' still gets fixed","hypothesis":"ApostropheFixer (#41) is English-only but ran on every text: German 'im' (in the) became \"I'm\" and French 'dont' (of which) became \"don't\" ('Ich bin I'm Büro'). Skip it when the text is confidently non-English (the same TextLanguage check as #72)","next_action_hint":"remaining English-only restorers (Slang, Contraction) only fire when the model wrote an English expansion, so they're self-limiting. Loop complete","result":"multilingual set (14): 11 pass; the 3 failures are model-level (s1-m06 se->sé missed, s1-m08 German translated to English and correctly blocked, s1-m10 partial accents). The 4 new apostrophe-trap controls all pass (were all corrupted before)"}}
{"run":74,"commit":"5764378","metric":0.9186,"metrics":{"ai_dev_clean_preserved_rate":0.9429,"ai_dev_pass_rate":0.8102,"ai_dev_slang_kept_rate":0.9167,"ai_holdout_pass_rate":0.7905,"qwen_dev_errors_fixed_rate":0.954,"qwen_dev_p95_ms":1827,"qwen_holdout_pass_rate":0.9048},"status":"keep","description":"Invariants hold: no restorer changes a model echo (493 inputs incl. edge cases), and the chain is idempotent on all 10,162 stored outputs. Added harness/invariants.py as a reusable check","timestamp":1791633596649,"segment":8,"confidence":null,"asi":{"files":"harness/invariants.py (reusable check, exit 1 on violation), PIPELINE.md eval section points to it","hypothesis":"invariant check of the post-processing chain after #72-#73: (1) on a model echo, no restorer may change the text; (2) the chain must be idempotent","next_action_hint":"run harness/invariants.py after any restorer change. Loop complete","note_on_apostrophe":"in the first raw scan, all 49 echo changes came from ApostropheFixer, and each is a genuine typo fix the model would leave (Im->I'm, dont->don't, Thats->That's; 'Its'/'its' left alone, never wrong). That's its job, so the invariant exempts it","result":"echo: 493 inputs (all corpora + 21 adversarial edge inputs: empty, single backtick, fences, URLs, emails, tabs, curly quotes, dont_cache...), 0 restorer changes. Idempotence: 10,162 stored outputs, 0 violations. Dev .9186 unchanged"}}
{"run":75,"commit":"968f3d9","metric":0.9186,"metrics":{"ai_dev_clean_preserved_rate":0.9429,"ai_dev_pass_rate":0.8102,"ai_dev_slang_kept_rate":0.9167,"ai_holdout_pass_rate":0.7905,"qwen_dev_errors_fixed_rate":0.954,"qwen_dev_p95_ms":1827,"qwen_holdout_pass_rate":0.9048},"status":"keep","description":"Gate fix: typo-dense corrections ('Teh qiuck borwn fxo…') were rejected as lowOverlap/droppedContent. Words now survive as close spellings (one-to-one, Damerau ≤1-2, accent-folded). 6/6 good fixes now accepted; every historical catch kept","timestamp":1791633926716,"segment":8,"confidence":null,"asi":{"files":"OutputGate.surviving + isCloseSpelling (Swift), diacritic-folded word keys in lowOverlap and dropsContent, OutputGateTests.typoDenseCorrectionsAreNotLowOverlapOrDroppedContent (full suite passes, incl. a translation still rejected); harness output_gate/drops_content mirror","harm_check":"replay over all stored outputs: gate decisions change on only 2 (both s4-f02 fresh: the correct shopping-list fix was a droppedContent false positive, now accepted). Every historical catch is kept (s4-038 sentence drop, s1-m08 translation, all lowOverlap answers). Guard-set decisions unchanged; answered_pasted 0; dev .9186 unchanged","hypothesis":"gate false positives on typo-dense input (fast typing, the app's core use): lowOverlap (baseline gate) and droppedContent (#39) used exact word survival, so a sentence whose words were mostly *corrected* looked dropped or rewritten. A word now survives if it's kept verbatim or matched one-to-one to a new output word within Damerau-Levenshtein 1 (<= 4 letters) or 2 (longer); keys are diacritic-folded","next_action_hint":"adversarial-input checks are the productive direction now (they found 3 real bugs: #72, #73, #75). Candidates: very short inputs (1-3 words) against the gates, emoji-only, mixed scripts","result":"6 synthetic typo-dense good fixes (e.g. 'Teh qiuck borwn fxo jmups ovr the lazy dog', 'Plaese sned teh reprot tmorow mornign', the shopping list 'bred'/'coffe'): 6/6 were rejected (lowOverlap/droppedContent), now 0/6"}}
{"run":76,"commit":"95416cf","metric":0.9186,"metrics":{"ai_dev_clean_preserved_rate":0.9429,"ai_dev_pass_rate":0.8102,"ai_dev_slang_kept_rate":0.9167,"ai_holdout_pass_rate":0.7905,"qwen_dev_errors_fixed_rate":0.954,"qwen_dev_p95_ms":1827,"qwen_holdout_pass_rate":0.9048},"status":"keep","description":"Adversarial probe (34 unusual inputs, real model): 31/34 pass. Found the model 'fixing' a URL (exmaple.com → example.com). New LinkRestorer: links and emails are never proofread. Now 32/34; invariants hold; 0 corpus outputs affected","timestamp":1791634177640,"segment":8,"confidence":null,"asi":{"adversarial_set":"adversarial-2026-10-10/ (34 inputs + outputs): 1-3 words, emoji, mixed scripts (ja/ru + English typo), ALL CAPS, headings, markdown bold/links, @mentions/#tags, camelCase, URL, email, CRLF, tabs, bullets, numbered list, money/time, double spaces, curly quotes, shrug. Before the fix: 31/34 pass; failures were s5-a17 (URL 'exmaple.com' -> 'example.com': a silently changed link), s1-a24 ('3:30pm' -> '3:30 pm', minor style), s1-a33 ('Its 2026' missed). After: s5-a17 passes (32/34); the other two are model-level","files":"bulletproof/Engines/LinkRestorer.swift (new; after CodeSpanRestorer in cleanResponse), LinkRestorerTests (2 tests; full suite passes), harness restore_links mirror (3/3 agree), invariants.py covers links + the adversarial inputs","harm_check":"invariants: echo 527 inputs 0 restorer changes, idempotence 10,162 outputs 0 violations; replay over stored corpus outputs: fired 0 (no URL was ever altered in the corpora), so it's pure safety; dev .9186 unchanged","hypothesis":"adversarial probe with the real model: URLs/emails must never be proofread; a 'fixed' typo-looking domain silently points elsewhere. LinkRestorer puts each input link that's missing from the output back over the closest-spelled new link (similarity >= 0.8)","next_action_hint":"noticed: Qwen adds markdown trailing double spaces before line breaks in lists ('milk  \\n'), invisible but changes the text. LineBreakRestorer could copy the input's exact gap whitespace around breaks. Candidate next"}}
{"run":77,"commit":"eb38922","metric":0.9186,"metrics":{"ai_dev_clean_preserved_rate":0.9429,"ai_dev_pass_rate":0.8102,"ai_dev_slang_kept_rate":0.9167,"ai_holdout_pass_rate":0.7905,"qwen_dev_errors_fixed_rate":0.954,"qwen_dev_p95_ms":1827,"qwen_holdout_pass_rate":0.9048},"status":"keep","description":"LineBreakRestorer copies the input's exact whitespace around line breaks: removes the trailing spaces Qwen added before breaks in 41% of multi-line outputs ('milk  \\n'). Replay: 125 fires, 14 fail→pass, 0 pass→fail; invariants hold","timestamp":1791634394120,"segment":8,"confidence":null,"asi":{"files":"LineBreakRestorer: the aligned-gap rule and the next-word-anchor rule both copy the input's gap when a break is involved and the whitespace differs; +1 test (full suite passes); harness mirror","finding":"Qwen added markdown hard-break spaces before a line break in 94/229 (41%) of stored multi-line outputs, Apple Intelligence in 12/167; invisible in most views, but pasted into the user's text","harm_check":"invariants hold (echo 527 inputs 0 changes; idempotence 10,162 outputs 0 violations). Replay: fired 125, fail->pass 14 (rows where the trailing spaces broke an exact-match check), pass->fail 0; outputs still adding trailing whitespace before a break: 0. Dev .9186 unchanged (the metric normalizes whitespace)","hypothesis":"LineBreakRestorer copies the input's exact gap whitespace around line breaks, so trailing spaces the model adds before a break ('milk  \\n') are removed; the writer's own trailing spaces stay","next_action_hint":"more adversarial probing (#72-#77 found 5 real issues); e.g. inputs with trailing/leading spaces mid-text, numbered lists > 9, nested bullets"}}
{"run":78,"commit":"8672cc7","metric":0.9186,"metrics":{"ai_dev_clean_preserved_rate":0.9429,"ai_dev_pass_rate":0.8102,"ai_dev_slang_kept_rate":0.9167,"ai_holdout_pass_rate":0.7905,"qwen_dev_errors_fixed_rate":0.954,"qwen_dev_p95_ms":1827,"qwen_holdout_pass_rate":0.9048},"status":"keep","description":"Adversarial round 2 (fences, nested lists, quotes, tables, headings, signatures): 11/12 fine; the model edited code inside a ``` fence. CodeSpanRestorer now restores fenced blocks verbatim. Both rounds: 44/46; invariants hold","timestamp":1791634584479,"segment":8,"confidence":null,"asi":{"files":"CodeSpanRestorer.restoreFences + fences(in:) run before the inline restorer; CodeSpanRestorerTests.fencedBlocksAreNeverProofread (full suite passes); harness restore_fences mirror; adversarial set +12 round-2 cases with outputs","harm_check":"invariants hold (echo 539 inputs 0 changes; idempotence 10,162 0 violations); fence replay over stored corpus outputs fired 0 (no corpus case has a fence); dev .9186 unchanged","hypothesis":"adversarial round 2 (12 structural inputs: fenced code, nested and indented bullets, numbered lists past 9, > quoted replies, markdown table, headings, -- signature, multi-paragraph lowercase, emoji status list, TODO(owner)). Fenced multi-line code blocks weren't protected (CodeSpanRestorer was single-line only)","next_action_hint":"remaining adversarial misses are style (3:30pm spacing) and a model miss (Its 2026); adversarial headroom is exhausted for now. Loop complete","result":"round 2: 11/12 handled correctly before the fix. The model edited code inside a fence (s5-b02 'npm instal' -> 'npm install'); with fence restoration, both rounds pass 44/46 (remaining: 3:30pm -> 3:30 pm style, 'Its 2026' model miss). Nested/indented lists, quotes, tables, headings, signatures all came through intact"}}
{"run":79,"commit":"0ea4528","metric":0.9186,"metrics":{"ai_dev_clean_preserved_rate":0.9429,"ai_dev_pass_rate":0.8102,"ai_dev_slang_kept_rate":0.9167,"ai_holdout_pass_rate":0.7905,"qwen_dev_errors_fixed_rate":0.954,"qwen_dev_p95_ms":1846,"qwen_holdout_pass_rate":0.9048},"status":"keep","description":"Live Swift verification of #72-#78: 400 corpus cases unchanged except 6 Qwen outputs that lose added trailing spaces; robustness sets Qwen 55/60 (Swift = Python on 60/60), AI 47/60 (mostly model-level). All six adversarial fixes confirmed in the app","timestamp":1791635477659,"segment":8,"confidence":null,"asi":{"ai_robustness_fails":"13 of 60, mostly model-level: Their -> They are, notse -> note, $ -> $€ glitch, shrug lost its backslash, min -> minutes, em dash -> --, missed French accents; droppedContent correctly blocked 2 AI drops (b02, b08); one layout gap: tabs turned into ': ' (s4-a20). Tabs aren't covered by the line-break gap copy","hypothesis":"live Swift verification of #72-#78 (language-aware spell check, apostrophe gating, close-spelling gates, LinkRestorer, line-break whitespace, fences), both engines: all 400 cases + the adversarial (46) and multilingual (14) sets","next_action_hint":"optional: extend the line-break gap copy to tab gaps (s4-a20, AI only). Otherwise done","result":"400 corpus: Apple Intelligence raw identical to #64 on 400/400; Qwen differs on 6/400, all explained by #77's trailing-space removal; pass rates unchanged (Qwen dev .9186 / holdout .9048, AI dev .8102 / holdout .7905). Robustness sets in Swift: Qwen 55/60, identical to the Python mirror on 60/60 (all six adversarial fixes confirmed in the real app); the 5 Qwen fails are model-level (3:30pm style, Its 2026, se->sé, the German translation correctly blocked, partial Portuguese accents). Apple Intelligence 47/60"}}
