{"run":80,"commit":"2e1a0a4","metric":0.922,"metrics":{"ai_dev_clean_preserved_rate":0.9429,"ai_dev_pass_rate":0.8102,"ai_dev_slang_kept_rate":0.9167,"ai_holdout_pass_rate":0.7905,"qwen_dev_errors_fixed_rate":0.956,"qwen_dev_p95_ms":1827,"qwen_holdout_pass_rate":0.9048},"status":"keep","description":"ApostropheFixer v2: fix misplaced-apostrophe contractions (would'nt, does'nt, ca'nt) and the model's half-fix (would't). Dev +1 (s4-019), 0 lost; replay: 22 fires, all fail→pass (incl. AI does’t, has’nt); curly apostrophes kept; invariants hold","timestamp":1791635783876,"segment":8,"confidence":null,"asi":{"dead_end":"tab gap restore (#79 hint, s4-a20): only 1 tab-changing output in all stored runs (AI, adversarial), and AI also inserted a colon ('name: value'), so a whitespace-only copy wouldn't fix it. Skipped on the simplicity rule","files":"ApostropheFixer.misplaced map + branch (keeps curly vs straight apostrophe), +1 test (full suite passes); harness fix_apostrophes mirror (language-check trigger includes misplaced forms)","flips":"dev +1 (s4-019 would't -> wouldn't), 0 lost. Replay over stored outputs: 22 fires on 3 cases (s4-019 Qwen x14 and AI, s4-040 AI does’t, s3-033 AI has’nt), all fail->pass, 0 pass->fail","harm_check":"invariants hold (echo 539 inputs 0 changes; idempotence 10,962 outputs 0 violations); the model fixes typed would'nt itself in 108/108 inputs, so this only catches its half-fixes and AI's misses","hypothesis":"ApostropheFixer v2: misplaced apostrophes in n't contractions (would'nt, does'nt, ca'nt) and the model's half-fix (would't, does’t) are never words, so fix them deterministically to the n't form; dropped-n forms only for stems > 2 letters (is't, do't left alone)","metrics_note":"ai_* values are carried from the #79 live run (AI isn't re-measured by measure.sh); the replay suggests AI gains s4-040 in the greedy runs","next_action_hint":"deterministic headroom is now small; remaining Qwen dev failures are model recall (alot, should of, homophones in long text, dictation soundalikes)"}}
{"run":81,"commit":"0ffef7b","metric":0.9288,"metrics":{"ai_dev_clean_preserved_rate":0.9429,"ai_dev_pass_rate":0.8102,"ai_dev_slang_kept_rate":0.9167,"ai_holdout_pass_rate":0.7905,"qwen_dev_errors_fixed_rate":0.962,"qwen_dev_p95_ms":1827,"qwen_holdout_pass_rate":0.9048},"status":"keep","description":"Split run-together phrases that are never words (alot, atleast, eachother, noone…) in ApostropheFixer; links now skipped too. Dev .922→.9288 (+2, 0 lost); replay 57 fires, 41 fail→pass, 0 pass→fail. Checkpoint: holdout .9048 unchanged, fresh 34/35","timestamp":1791636078356,"segment":8,"confidence":null,"asi":{"checkpoint":"holdout (Python, gated): pass .9048 (unchanged vs the #79 Swift live .9048); errors_fixed .933, and the only rows whose fixed count differs from #79 are s4-038 (Python/Swift raw differ, the known dropped-sentence row, rejected) and s5-041 (+1, alot now fixed). Fresh set 34/35 (unchanged). No overfitting signal","files":"ApostropheFixer forms + 11 run-together phrases; skips links now too (LinkRestorer.ranges); +1 test (full suite passes); harness mirror","flips":"dev +2 (s2-069, s4-017: 'alot' the model left), 0 lost. Replay over all stored user-visible outputs: 57 fires, 41 fail->pass, 0 pass->fail (cases s2-069, s4-017 Qwen; s4-007, s5-041 AI; s2-055/s4-023 still fail for other errors)","harm_check":"invariants hold (echo 539 inputs 0 changes; idempotence 10,962 0 violations). Every corpus case with a run-together phrase (16 inputs, incl. casual s5) expects it split; no acceptable output keeps one. Hashtags, code, links and longer words (alotment) untouched","hypothesis":"run-together phrases that are never words (alot, atleast, eachother, noone, incase, infact, aswell, ofcourse, inspite, abit, alittle) are typos under the fix-my-mistakes policy, and the model leaves 'alot' in ~20% of Qwen and ~10% of AI outputs; split them deterministically (same whole-word, code-, link- and hashtag-safe walk as ApostropheFixer)","next_action_hint":"remaining Qwen dev failures: should of/weather homophones, pronoun case (Me and my team), tense (are waiting since), dictation soundalikes: model recall, not deterministic","overfit_note":"alot is over-represented in the corpus (16 cases), but the rule is the general policy (a misspelling is never slang), it fires only where the model left a non-word, and the list is the standard run-together set rather than corpus words"}}
{"run":82,"commit":"0ffef7b","metric":0.9288,"metrics":{"ai_dev_clean_preserved_rate":0.9429,"ai_dev_pass_rate":0.8102,"ai_dev_slang_kept_rate":0.9167,"ai_holdout_pass_rate":0.7905,"qwen_dev_errors_fixed_rate":0.962,"qwen_dev_p95_ms":1827,"qwen_holdout_pass_rate":0.9048},"status":"discard","description":"Mid-sentence capital restore (Sam→sam put back): replay over all stored outputs fires 20 times on 3 cases, all correct, but 0 fail→pass (those rows fail for other reasons). No measurable gain, not shipped; noted in ideas.md","timestamp":1791636197216,"segment":8,"confidence":null,"asi":{"finding":"all 4 distinct restorations were right (sam->Sam x17, python->Python, a bullet's Load), so the model does sometimes lowercase deliberate capitals; it just never decides a case here. Gotcha for a future version: a '- ' bullet's first word is a line start, which the probe missed","hypothesis":"mid-sentence capital restore: a Titlecase word the writer typed away from a sentence or line start (a name like Sam, Python) that the model lowercased gets its capital back","next_action_hint":"remaining Qwen failures are model recall (homophones, pronoun case, tense, dictation soundalikes). Deterministic headroom on the corpus is essentially exhausted again","replay":"over all stored user-visible outputs (both engines, all corpora): fired 20 on 3 cases (s2-050 x17, s4-030, s5-070), 0 fail->pass, 0 pass->fail; s2-050 still fails on 'me and Sam' -> 'Sam and I'","rollback_reason":"no measurable gain (precedent #59): app code + tests for 0 cases. Recorded in ideas.md with the probe, for when telemetry shows names getting lowercased"}}
{"run":83,"commit":"a923a15","metric":0.9288,"metrics":{"ai_dev_clean_preserved_rate":0.9429,"ai_dev_pass_rate":0.8102,"ai_dev_slang_kept_rate":0.9167,"ai_holdout_pass_rate":0.8,"qwen_dev_errors_fixed_rate":0.962,"qwen_dev_p95_ms":1857,"qwen_holdout_pass_rate":0.9048},"status":"keep","description":"Live Swift verification of #80+#81 (both engines, 400): exactly the intended fixes moved. Qwen 4 outputs changed, 3 fail→pass (dev .9288 = Python); AI 1 changed (s5-041), holdout .790→.800. 0 pass→fail","timestamp":1791636917138,"segment":8,"confidence":null,"asi":{"hypothesis":"live Swift verification of #80 (misplaced-apostrophe contractions) and #81 (run-together phrases), both engines, all 400","next_action_hint":"deterministic headroom exhausted on both engines; remaining failures are model recall. Loop complete; owner items only","result":"vs #79 live: Apple Intelligence differs on exactly 1/400 user-visible outputs (s5-041 alot->a lot, fail->pass; AI holdout .790->.800, dev .810 unchanged). Qwen differs on exactly 4/400, all the intended fixes (s2-069, s4-017 alot; s4-019 would't; s2-055 alot fixed but still fails on doesn't), 3 fail->pass, 0 pass->fail. Qwen dev .9288 = Python; Swift/Python user-visible identical on 292/295 dev (the known ~1% runtime noise). Nothing else moved"}}
{"run":84,"commit":"6d9f519","metric":0.9288,"metrics":{"ai_dev_clean_preserved_rate":0.9429,"ai_dev_pass_rate":0.8102,"ai_dev_slang_kept_rate":0.9167,"ai_holdout_pass_rate":0.8,"qwen_dev_errors_fixed_rate":0.962,"qwen_dev_p95_ms":1857,"qwen_holdout_pass_rate":0.9048},"status":"keep","description":"Docs: PIPELINE.md and RESULTS.md brought up to date with #72-#83 (8-step post-processing chain in code order, language-aware spell check, close-spelling gates, robustness sets; latest live numbers: Qwen .923, AI .808 all 400). No code change","timestamp":1791637035295,"segment":8,"confidence":null,"asi":{"files":"PIPELINE.md §3 (post-processing: 8 steps in cleanResponse order, checked against ProofreadPrompt.cleanResponse), §4 (language-aware spell check #72, close-spelling survival #75), §7 (robustness sets); RESULTS.md: latest live table from run-2026-10-10-live-83 (both engines, all 400, per-engine metrics.py), later restorers, AI determinism caveat, Qwen recommended as default with the out-of-sample evidence","hypothesis":"documentation: PIPELINE.md (#71) and RESULTS.md predate #72-#83 (LinkRestorer, fences, line-break whitespace, language-aware spell check, close-spelling gates, ApostropheFixer v2/v3, greedy AI) and were wrong about the post-processing chain and the headline numbers","next_action_hint":"loop complete; owner items only (db65f20 history rewrite, #25 decision, /tmp/models cleanup, Qwen default, dictation telemetry review)"}}
{"run":85,"commit":"8a18e7d","metric":0.9288,"metrics":{"ai_dev_clean_preserved_rate":0.9429,"ai_dev_pass_rate":0.8102,"ai_dev_slang_kept_rate":0.9167,"ai_holdout_pass_rate":0.8,"qwen_dev_errors_fixed_rate":0.962,"qwen_dev_p95_ms":1827,"qwen_holdout_pass_rate":0.9048},"status":"keep","description":"Adversarial round 3 (20 inputs): the model 'fixed' a Windows path (Documnets), a hashtag (#teh) and an API route (/prefernces). LinkRestorer now also protects file paths, routes and hashtags. Rounds 1-3: 62/66; 0 corpus outputs affected; invariants hold","timestamp":1791637322872,"segment":8,"confidence":null,"asi":{"files":"LinkRestorer pattern + paths/hashtags and close-spelling match (OutputGate.isCloseSpelling) as an alternative to similarity >= 0.8, +1 test (full suite passes), harness mirror, PIPELINE.md step 6, adversarial set +20 round-3 cases with outputs; ApostropheFixer now also skips paths/hashtags (it uses LinkRestorer.ranges)","harm_check":"invariants hold (echo 559 inputs 0 changes; idempotence 11,762 0 violations). Replay over every stored corpus output from both engines: fired 0 (61 inputs contain paths or hashtags; none was altered, so no false positives). Not literals by design: dates 10/12, and/or, single-segment /slash commands, '# ' headings. Dev .9288 unchanged","hypothesis":"adversarial round 3 (20 inputs: paths, versions, IPs, hex colours, slash commands, @user/#tag lookalikes, checkboxes, markdown link text, curly apostrophes, NBSP, ZWJ emoji, Hebrew, combining accents, a 34-letter word, punctuation-only, an API route). File paths and hashtags are literals the user typed on purpose, like links, so they should never be proofread","next_action_hint":"remaining adversarial misses are cosmetic (NBSP thousands separator, NFC normalization) or model-level; noted in ideas.md. A live Swift run of #85 can wait for the next verification batch","result":"round 3 before the fix: 15/20. Real bugs: Windows path 'Documnets' -> 'Documents' (s5-c02), hashtag '#teh' -> '#the' (s5-c08), API route '/prefernces' -> '/preferences' (s1-c20). After: all three fixed; rounds 1-3: 62/66. Left: NBSP thousands separator rewritten to a comma (s1-c13), combining accent NFC-normalized (s1-c16, invisible), and the two old ones (3:30pm, Its 2026)"}}
{"run":86,"commit":"b0a4675","metric":0.9288,"metrics":{"ai_dev_clean_preserved_rate":0.9429,"ai_dev_pass_rate":0.8102,"ai_dev_slang_kept_rate":0.9167,"ai_holdout_pass_rate":0.8,"qwen_dev_errors_fixed_rate":0.962,"qwen_dev_p95_ms":1863,"qwen_holdout_pass_rate":0.9048},"status":"keep","description":"Fix a real-app bug the Python harness can't see: mlx-swift-lm's streaming detokenizer dropped tokens that extend a character (👍🏽→👍, 🇨🇦→🇨, 1️⃣→1, ZWJ emoji, Thai/Hindi marks), pasted silently in 7/10 probes. LocalModelEngine now decodes token IDs once. Corpus output identical 400/400, no latency cost","timestamp":1791639200011,"segment":8,"confidence":null,"asi":{"apple_intelligence":"not affected (no MLX detokenizer); its grapheme-set losses are model-level and were gated (z02 rejected)","bug":"mlx-swift-lm NaiveStreamingDetokenizer diffs chunks by grapheme count (newSegment.suffix(newSegment.count - segment.count)), so any token that extends the previous grapheme cluster is silently dropped. Python mlx_lm decodes bytes, which is why the harness never saw it. Found via s5-c14 (ZWJ family emoji), the only Swift != Python robustness row in #85's live check","files":"LocalModelEngine: ChatSession.respond replaced by static generate(...) = container.perform(nonSendable: prefix) + processor.prepare(UserInput(chat: [system?, user])) + generateTokens + one tokenizer.decode at the end (same prompt tokens as ChatSession in both the prefix-cached and plain paths); PIPELINE.md engine note; 10-case grapheme set appended to the adversarial slice; upstream-bug note in ideas.md","hypothesis":"live Swift check of #85 found Swift != Python on the ZWJ family emoji: mlx-swift-lm's ChatSession streaming detokenizer drops tokens that extend the previous grapheme. Generate token IDs and decode once (like Python mlx_lm)","next_action_hint":"file the upstream mlx-swift-lm bug (owner). The adversarial slice now has 76 inputs incl. 10 grapheme cases; run it through the Swift runner after any engine change","probe_before":"10 grapheme inputs through the real app (Qwen): 9/10 lost characters, 7 pasted silently: 'sounds good 👍🏽' -> '👍' (skin tone gone), '🇨🇦' -> '🇨' (half a flag), '1️⃣' -> '1', '🏳️‍🌈' -> '🏳', '👏🏾' -> '👏', Thai garbled; 2 caught by implausibleEdit","result_after":"grapheme probe: Swift raw == Python raw on 8/10 (the other 2: Thai rewritten by the model and a German translation, both differ by runtime noise), every emoji kept. Exact A/B on all 400 corpus cases: raw output byte-identical 400/400 for Qwen (and AI), Qwen p50 406 -> 398 ms (no latency cost). Full test suite passes. Swift live #85 also confirmed: all 3 literal fixes hold in the app (s5-c02, s5-c08, s1-c20), 400/400 unchanged vs #83"}}
{"run":87,"commit":"681f9c9","metric":0.9288,"metrics":{"ai_dev_clean_preserved_rate":0.9429,"ai_dev_pass_rate":0.8102,"ai_dev_slang_kept_rate":0.9167,"ai_holdout_pass_rate":0.8,"qwen_dev_errors_fixed_rate":0.962,"qwen_dev_p95_ms":1827,"qwen_holdout_pass_rate":0.9048},"status":"keep","description":"Differential test: Swift cleanResponse + OutputGate vs the harness's Python mirror on 5,849 pairs (2,936 stored model outputs + 2,913 synthetic perturbations; 1,618 rewritten, 118 rejected): 0 differences. The metric scores exactly what ships. Tool added as harness/swift_chain_parity.py","timestamp":1791639539677,"segment":8,"confidence":null,"asi":{"files":"harness/swift_chain_parity.py (gen + compare), harness/ZZParityScratch.swift.template (scratch Swift runner; never committed into bulletproofTests), harness/README.md section. No app or metric change","hypothesis":"differential test of the deterministic chain: the Python mirror of cleanResponse + OutputGate.rejection is what the metric scores, the Swift one is what ships; any disagreement means the number measures something else (#86 showed the Swift/Python gap can hide real bugs)","next_action_hint":"rerun swift_chain_parity.py after any restorer or gate change; the remaining unmirrored Swift-only surfaces are the spell-check calls (SpellCheckGate/introducedMisspelling, protected words) and the verify gate, which SWIFT_VERIFY covers end to end","result":"0 differences on 5,849 pairs: 2,936 stored (input, model output) pairs from every run (both engines, all corpora, harness cache) and 2,913 synthetic perturbations of 548 inputs (joined/added breaks, markdown trailing spaces, slang/contraction expansions, unwrapped/edited code, respelled links/paths/hashtags, recasing, misplaced apostrophes and alot, <text> wrappers, dropped words, typos). Non-trivial: the chain rewrote 1,618 synthetic outputs and the gate rejected 118 (introducedStructure 52, droppedContent 36, lowOverlap 30), all identical between Swift and Python","scope_note":"the spell-check-dependent gate rules (introducedMisspelling, protectedWordRemoved, implausibleEdit) aren't in OutputGate.rejection and aren't covered here; they're exercised by SWIFT_VERIFY"}}
{"run":88,"commit":"04fd391","metric":0.9288,"metrics":{"ai_dev_clean_preserved_rate":0.9429,"ai_dev_pass_rate":0.8102,"ai_dev_slang_kept_rate":0.9167,"ai_holdout_pass_rate":0.8,"qwen_dev_errors_fixed_rate":0.962,"qwen_dev_p95_ms":1827,"qwen_holdout_pass_rate":0.9048},"status":"keep","description":"Token-based output budget: the 3-chars-per-token estimate cut Bengali/Hindi/Tamil/Burmese/emoji corrections short (Bengali pasted at 74%, 3 others rejected mid-character). Budget now ≥ input tokens×2+128 within the KV cache. Dense probes now complete; corpus unaffected (budget only grows)","timestamp":1791640130753,"segment":8,"confidence":null,"asi":{"cause":"maxTokens = max(16, text.count/3)*2+128 assumes ~3 chars/token, and Swift's count is grapheme clusters. Real Qwen tokenizer ratios: English 0.18 tok/char, CJK 0.6, Thai 0.76, Greek 0.88, Amharic 1.27, Hindi 1.31, emoji 1.40, Bengali 1.59, Tamil 1.71, Burmese 3.0. Above ~1.0 even an exact echo exceeds the budget. Python's len() counts code points, so the harness had a larger budget and never saw it (another Swift/Python gap)","files":"LocalModelEngine.tokenBudget (pure, unit-tested: 4 cases incl. KV cap and nil) used inside generate(); ProofreadingError passes through the catch unchanged; harness max_tokens mirrors max(char estimate, tokens*2+128); PIPELINE.md engine note; 5 cases appended to the adversarial slice; before/after Swift outputs in run-2026-10-10-budget-88/; ideas.md: appended-continuation gate","harm_check":"the budget only grows (max of old and new), so outputs that never reached the old cap are unchanged. Over 19,562 stored outputs only 4 came within 90% of the old cap, all guard-set answers (poems, pirate) that were already rejected. Dev .9288 unchanged; full test suite passes. English inputs are never newly rejected as too long (the KV check needs prompt + 3x input tokens > 4096, which the 3,300-char cap already prevents for English)","hypothesis":"the local engine's output budget assumes 3 characters per token, false for Indic/Burmese scripts and emoji, so corrections get cut short; base the budget on the input's real token count and require the exchange to fit the KV cache","next_action_hint":"if real usage shows non-English or emoji-heavy selections, consider the appended-continuation gate (ideas.md). SWIFT_VERIFY not rerun for this change: the budget only grows and the corpus never neared the cap","probe":"5 dense inputs through the real app before: Bengali cut to 74% and PASTED, a 300-emoji run cut to 78% and PASTED, Hindi/Tamil/Burmese cut mid-character and rejected (replacementCharacter). After: Hindi, Tamil, Bengali, Burmese come back complete and identical. The emoji run is now echoed and then continued by the model (degenerate input; noted in ideas.md)"}}
{"run":89,"commit":"e071cbb","metric":0.9288,"metrics":{"ai_dev_clean_preserved_rate":0.9429,"ai_dev_pass_rate":0.8102,"ai_dev_slang_kept_rate":0.9167,"ai_holdout_pass_rate":0.8,"qwen_dev_errors_fixed_rate":0.962,"qwen_dev_p95_ms":1827,"qwen_holdout_pass_rate":0.9048},"status":"keep","description":"Probe: SpellCheckGate on scripts with no dictionary (Bengali, Tamil, Thai, Burmese, CJK, Amharic) and on 2-5-word non-English corrections. 18/19 scripts accepted via 'automatic' (Turkish uses its own dictionary and passes), 14/14 short texts recognized at ≥0.94 and accepted. No bug, no change","timestamp":1791640247524,"segment":8,"confidence":null,"asi":{"hypothesis":"SpellCheckGate on languages with no installed dictionary or short non-English text: the #72 per-language rule falls back to 'automatic' when there's no dictionary, and short texts might fall under the 0.8 confidence bar and hit the US/British rule, rejecting correct fixes","next_action_hint":"spell-check gate is sound across scripts; no change needed. Remaining unprobed Swift-only surface: the opt-in verify gate on non-English text (SpanScorer log-probs), low priority since it's opt-in","result":"no bug. (1) Words in 19 languages under the 'automatic' path, incl. scripts with no dictionary here (bn, ta, th, my, ja, zh, am): 18/19 accepted; the one flagged (tr 'toplanti' with dotless i) has its own tr dictionary, which the gate uses for confidently-Turkish text and which accepts it. (2) 14 short non-English corrections (2-5 words: 'Merci beaucoup!', 'Grazie mille', 'Dzieki, do jutra'...): all recognized at >= 0.94 confidence, all introduced words accepted. Probes: /tmp/sc.swift, /tmp/sc2.swift. Verification only, no code change"}}
