{"type":"config","name":"Proofreading prompt: fix errors, keep the writer's style (Qwen3-4B)","metricName":"pass_rate","metricUnit":"","bestDirection":"higher"}
{"run":1,"commit":"84385cb","metric":0.7627,"metrics":{"pass_s1":0.9492,"pass_s2":0.9153,"pass_s3":0.8305,"pass_s4":0.6949,"pass_s5":0.4237,"errors_fixed_rate":0.958,"clean_preserved_rate":0.7714,"lowercase_kept_rate":0.0625,"slang_kept_rate":0.2917,"code_kept_rate":1,"linebreaks_kept_rate":1,"must_preserve_kept_rate":0.6545,"over_edit_rate":0.1288,"case_restyled_rate":0.1254,"contraction_expanded_rate":0.0136,"fix_echo_rate":0.0077,"outputgate_rejected_rate":0.0034,"pass_rate_user_sees":0.7627,"verify_rejected_rate":0.0102,"answered_count":8,"p50_ms":934,"p95_ms":2593,"prompt_chars":664},"status":"keep","description":"Baseline: v0.0.19 prompt (3 inline few-shot examples) with the retuned verify gate","timestamp":1791601226728,"segment":0,"confidence":null,"asi":{"hypothesis":"baseline","notes":"70 dev failures: ~38 s5 casing/slang restyle, ~10 s4 rewording, ~8 s3. 8/14 guard lookalikes answered."}}
{"run":2,"commit":"84385cb","metric":0.6983,"metrics":{"answered_count":6,"case_restyled_rate":0.0034,"clean_preserved_rate":1,"code_kept_rate":1,"contraction_expanded_rate":0.0068,"errors_fixed_rate":0.866,"fix_echo_rate":0.0731,"linebreaks_kept_rate":1,"lowercase_kept_rate":1,"must_preserve_kept_rate":0.9818,"outputgate_rejected_rate":0,"over_edit_rate":0.1525,"p50_ms":1173,"p95_ms":2327,"pass_rate_user_sees":0.6949,"pass_s1":1,"pass_s2":0.678,"pass_s3":0.1356,"pass_s4":0.7627,"pass_s5":0.9153,"prompt_chars":933,"slang_kept_rate":0.9583,"verify_rejected_rate":0.0068},"status":"checks_failed","description":"H1: style-preserving few-shot + minimal-edit rule. s5 .42→.92, but dictation lost caps and punctuation (s3 .14) and grammar was under-corrected (s2 .68)","timestamp":1791601707989,"segment":0,"confidence":null,"asi":{"hypothesis":"style-preserving few-shot (lowercase/slang/code/injection) plus a 'change as little as possible' rule fixes s5 restyling","result":"s5 .42->.92, lowercase_kept .06->1.0, slang .29->.96, clean_preserved 1.0, answered 8->6. But s3 .83->.14: dictation transcripts stay lowercase and unpunctuated. s2 .92->.68: grammar fixes skipped (agreement, have rose, most easiest, an/a, double negatives)","rollback_reason":"errors_fixed .866 and s2/s3 dropped far more than 5pp","next_action_hint":"keep the style rules, add (a) an explicit 'fix every grammar error: agreement, tense, articles, double negatives, would of' line plus a grammar example, and (b) a transcript rule ('no punctuation at all means speech: add sentence punctuation and capitals') plus a transcript example"}}
{"run":3,"commit":"84385cb","metric":0.7864,"metrics":{"answered_count":9,"case_restyled_rate":0.1085,"clean_preserved_rate":0.8,"code_kept_rate":1,"contraction_expanded_rate":0.0169,"errors_fixed_rate":0.936,"fix_echo_rate":0.0192,"linebreaks_kept_rate":1,"lowercase_kept_rate":0.1875,"must_preserve_kept_rate":0.7273,"outputgate_rejected_rate":0,"over_edit_rate":0.122,"p50_ms":1304,"p95_ms":3527,"pass_rate_user_sees":0.7864,"pass_s1":0.9661,"pass_s2":0.8305,"pass_s3":0.8814,"pass_s4":0.7458,"pass_s5":0.5085,"prompt_chars":1391,"slang_kept_rate":0.4583,"verify_rejected_rate":0},"status":"checks_failed","description":"H1 + grammar list + transcript rule and example: s3 .88, s2 .83, but s5 fell back to .51 (the transcript cue leaks into casual text)","timestamp":1791602291880,"segment":0,"confidence":null,"asi":{"hypothesis":"add a grammar-fix list, a casual grammar example, a 'no punctuation means speech transcript' rule and a transcript example","next_action_hint":"drop the transcript example (it pulls casual text toward capitalizing), narrow the rule to 'no punctuation at all, sentences run together'. The grammar line still misses s2 cases (most easiest, alot, double negatives, are waiting since)","result":"s3 recovered to .88 (above baseline .83), s2 .83, but s5 fell back to .51: the transcript example/rule makes the model capitalize casual text that has commas or emoji. answered 9 (g-01 poem appended, g-03 truncated). p95 3527","rollback_reason":"errors_fixed .936, s2 -8pp, answered 9>8, p95 over the limit"}}
{"run":4,"commit":"84385cb","metric":0.7254,"metrics":{"answered_count":5,"case_restyled_rate":0.0034,"clean_preserved_rate":1,"code_kept_rate":1,"contraction_expanded_rate":0.0068,"errors_fixed_rate":0.892,"fix_echo_rate":0.0577,"linebreaks_kept_rate":1,"lowercase_kept_rate":1,"must_preserve_kept_rate":0.9818,"outputgate_rejected_rate":0,"over_edit_rate":0.1322,"p50_ms":1329,"p95_ms":3326,"pass_rate_user_sees":0.722,"pass_s1":0.9831,"pass_s2":0.8475,"pass_s3":0.1356,"pass_s4":0.7458,"pass_s5":0.9153,"prompt_chars":1389,"slang_kept_rate":0.9583,"verify_rejected_rate":0.0068},"status":"checks_failed","description":"Fix/Keep paragraphs + grammar list + transcript rule with no example: s5 .92, answered 5, but s3 .14 (a rule alone doesn't make it punctuate transcripts)","timestamp":1791602859354,"segment":0,"confidence":null,"asi":{"hypothesis":"separate Fix/Keep paragraphs, an explicit grammar list, a transcript rule with no transcript example, and a formal agreement example","insight":"my casual examples ('my cat knocked over teh plant agian lol', 'tbh i dont think...') have no punctuation, so they look like transcripts and contradict the transcript rule. The discriminating feature has to show up in the examples","next_action_hint":"give casual examples their own punctuation (commas, !, ?) and add a long run-on transcript example with zero punctuation","result":"s5 .92, answered 5 (best yet), but s3 .14 again: a text-only transcript rule is ignored. s2 .85, errors_fixed .89","rollback_reason":"s3 collapse, s2 -7pp, errors_fixed"}}
{"run":5,"commit":"84385cb","metric":0.7661,"metrics":{"answered_count":6,"case_restyled_rate":0.0102,"clean_preserved_rate":1,"code_kept_rate":1,"contraction_expanded_rate":0.0034,"errors_fixed_rate":0.914,"fix_echo_rate":0.0269,"linebreaks_kept_rate":1,"lowercase_kept_rate":0.9375,"must_preserve_kept_rate":0.9818,"outputgate_rejected_rate":0,"over_edit_rate":0.1153,"p50_ms":1349,"p95_ms":3113,"pass_rate_user_sees":0.7627,"pass_s1":1,"pass_s2":0.8644,"pass_s3":0.322,"pass_s4":0.7458,"pass_s5":0.8983,"prompt_chars":1703,"slang_kept_rate":0.9583,"verify_rejected_rate":0.0068},"status":"checks_failed","description":"Punctuation-presence cue (punctuated casual examples + run-on transcript example): s5 .90 but s3 only .32. A single prompt can't tell dictation from casual typing","timestamp":1791603451811,"segment":0,"confidence":null,"asi":{"hypothesis":"casual examples carry their own punctuation, plus a long unpunctuated transcript example, so punctuation presence becomes the cue","insight":"s3 and s5 overlap in surface form: 52/59 dev s3 inputs and 10/59 s5 inputs have no punctuation, and pairs like s3 'lets grab lunch next week im free tuesday and thursday' versus s5 'ok so i was thinking we could of shipped this friday' can't be told apart from the text. A single prompt can't serve both; the app knows the path (dictation versus typed), so H6 is the structural fix","next_action_hint":"implement H6: ProofreadPrompt.dictationInstructions, engines take an instructions parameter, DictationController passes it, harness evaluates s3 with the dictation prompt. Then optimize the typed prompt (s1/s2/s4/s5) and the dictation prompt (s3) separately","result":"s3 .32 (19/59 capitalized), s5 .90, s2 .86, errors_fixed .914","rollback_reason":"s3/s2/errors_fixed checks"}}
{"run":6,"commit":"774c31f","metric":0.7627,"metrics":{"answered_count":8,"case_restyled_rate":0.1254,"clean_preserved_rate":0.7714,"code_kept_rate":1,"contraction_expanded_rate":0.0136,"dictation_prompt_chars":664,"errors_fixed_rate":0.958,"fix_echo_rate":0.0077,"linebreaks_kept_rate":1,"lowercase_kept_rate":0.0625,"must_preserve_kept_rate":0.6545,"outputgate_rejected_rate":0.0034,"over_edit_rate":0.1288,"p50_ms":934,"p95_ms":2593,"pass_rate_user_sees":0.7627,"pass_s1":0.9492,"pass_s2":0.9153,"pass_s3":0.8305,"pass_s4":0.6949,"pass_s5":0.4237,"prompt_chars":664,"slang_kept_rate":0.2917,"verify_rejected_rate":0.0102},"status":"keep","description":"Infra (H6): separate dictationInstructions for the dictation path. Engines take an instructions param, harness and runner route s3 through it. Prompts still identical, so the metric is unchanged by construction","timestamp":1791603755183,"segment":0,"confidence":null,"asi":{"hypothesis":"infrastructure: H6 dictation-path prompt seam. Identical prompts reproduce baseline exactly, which validates the routing","files":"ProofreadPrompt.dictationInstructions, LocalModelEngine/AppleIntelligenceEngine.instructions, AppState.makeEngine(instructions:), HotkeyDispatcher dictation proofreader, eval runner and harness route s3 to the dictation prompt, checks cover both prompts","next_action_hint":"apply the exp #4 style-preserving typed prompt to `instructions` and keep the baseline (formalizing) prompt for dictationInstructions, which already scores s3 .83"}}
{"run":7,"commit":"774c31f","metric":0.8644,"metrics":{"answered_count":6,"case_restyled_rate":0.0034,"clean_preserved_rate":0.9429,"code_kept_rate":1,"contraction_expanded_rate":0.0034,"dictation_prompt_chars":664,"errors_fixed_rate":0.928,"fix_echo_rate":0.0231,"linebreaks_kept_rate":1,"lowercase_kept_rate":1,"must_preserve_kept_rate":0.9818,"outputgate_rejected_rate":0.0034,"over_edit_rate":0.122,"p50_ms":1023,"p95_ms":2950,"pass_rate_user_sees":0.861,"pass_s1":0.9831,"pass_s2":0.8814,"pass_s3":0.8305,"pass_s4":0.7288,"pass_s5":0.8983,"prompt_chars":1446,"slang_kept_rate":0.9583,"verify_rejected_rate":0.0102},"status":"checks_failed","description":"Typed prompt = style-preserving Fix/Keep plus grammar examples, dictation prompt = baseline: pass .864 (+.10), s5 .90, s3 .83, but errors_fixed .928 is under the .948 floor","timestamp":1791604171618,"segment":0,"confidence":null,"asi":{"hypothesis":"retry of the #4 typed prompt (the s3 rollback reason no longer applies after H6), with no transcript clause and a double-negative example","next_action_hint":"look at which listed errors are unfixed in s2/s4 (flips --all), and add grammar coverage without reintroducing restyling. Also try 'Fix every error, even if it changes a word' framing. Run the holdout checkpoint once something passes checks","result":"pass_rate .864 (+.10 over baseline): s1 .98 s2 .88 s3 .83 s4 .73 s5 .90, clean_preserved .94, lowercase_kept 1.0, slang .96, answered 6. The only failing check is errors_fixed .928 against a .948 floor: the typed prompt under-corrects some grammar","revisits_run":4,"rollback_reason":"errors_fixed_rate .928 < .948"}}
{"run":8,"commit":"774c31f","metric":0.7864,"metrics":{"answered_count":9,"case_restyled_rate":0.0068,"clean_preserved_rate":0.7143,"code_kept_rate":0.9412,"contraction_expanded_rate":0,"dictation_prompt_chars":664,"errors_fixed_rate":0.932,"fix_echo_rate":0.0115,"linebreaks_kept_rate":1,"lowercase_kept_rate":1,"must_preserve_kept_rate":0.9636,"outputgate_rejected_rate":0.0034,"over_edit_rate":0.1017,"p50_ms":927,"p95_ms":2498,"pass_rate_user_sees":0.7831,"pass_s1":0.7797,"pass_s2":0.7627,"pass_s3":0.8305,"pass_s4":0.661,"pass_s5":0.8983,"prompt_chars":1599,"slang_kept_rate":0.9583,"verify_rejected_rate":0.0136},"status":"checks_failed","description":"Keep-first then mandatory Fix list + casual homophone example: the model started lowercasing formal sentences (s1 .78, s2 .76)","timestamp":1791604585640,"segment":0,"confidence":null,"asi":{"hypothesis":"move the Keep rules first and the mandatory Fix list last (recency), drop 'wording' from the keep list, add a casual homophone example","insight":"with 4 of 8 examples lowercase and a Keep-first order, the model learns 'lowercase everything': it lowercased formal sentences (s1-008 'that's exactly what i was worried about.'). Examples need a balance of capitalized formal and lowercase casual, and the casing rule must be relative ('keep the writer's casing') rather than 'stay lowercase'","next_action_hint":"go back to the #7 order (Fix then Keep). To fix #7's under-correction (Im, your/you're, alot, recieved in long text), try changing only the keep sentence: drop 'wording' (which licenses skipping real-word fixes) and add one capitalized formal homophone example","result":"s1 .78 / s2 .76: formal sentences got lowercased (missed_caps) and clean controls changed; answered 9, code_kept .94","rollback_reason":"multiple checks: s1/s2 collapse, answered 9, code_kept .94"}}
{"run":9,"commit":"774c31f","metric":0.878,"metrics":{"answered_count":7,"case_restyled_rate":0.0034,"clean_preserved_rate":0.9429,"code_kept_rate":1,"contraction_expanded_rate":0.0034,"dictation_prompt_chars":664,"errors_fixed_rate":0.932,"fix_echo_rate":0.0192,"linebreaks_kept_rate":1,"lowercase_kept_rate":1,"must_preserve_kept_rate":0.9818,"outputgate_rejected_rate":0.0034,"over_edit_rate":0.1085,"p50_ms":836,"p95_ms":1713,"pass_rate_user_sees":0.8746,"pass_s1":1,"pass_s2":0.8814,"pass_s3":0.8305,"pass_s4":0.7458,"pass_s5":0.9322,"prompt_chars":1582,"slang_kept_rate":0.9583,"verify_rejected_rate":0.0068},"status":"checks_failed","description":"Fix-then-Keep + your/you're + formal homophone example: pass .878, but errors_fixed .932 (still misses alot/recieved in long paragraphs)","timestamp":1791605243439,"segment":0,"confidence":null,"asi":{"hypothesis":"#7 prompt + your/you're in the fix list + a capitalized formal homophone example + 'Do not restyle or reword' (no 'wording' in the keep list)","insight":"a balanced capitalized formal example removes the lowercasing failure from #8. Residual under-correction: 34 unfixed errors vs 21 at baseline, concentrated in long s4 paragraphs (recieved, spining, broked, alot) and common misspellings treated as slang (alot, lets, your welcome)","next_action_hint":"tell the model a misspelling is never slang and to check every word in long text (tried in #10)","result":"pass .878 (s1 1.0 s2 .88 s3 .83 s4 .75 s5 .93), answered 7, p95 1713","rollback_reason":"errors_fixed .932 < .948"}}
{"run":10,"commit":"774c31f","metric":0.8814,"metrics":{"answered_count":7,"case_restyled_rate":0.0034,"clean_preserved_rate":0.9429,"code_kept_rate":1,"contraction_expanded_rate":0.0068,"dictation_prompt_chars":664,"errors_fixed_rate":0.938,"fix_echo_rate":0.0154,"linebreaks_kept_rate":1,"lowercase_kept_rate":1,"must_preserve_kept_rate":0.9818,"outputgate_rejected_rate":0.0034,"over_edit_rate":0.1051,"p50_ms":991,"p95_ms":2381,"pass_rate_user_sees":0.878,"pass_s1":1,"pass_s2":0.8814,"pass_s3":0.8305,"pass_s4":0.7797,"pass_s5":0.9153,"prompt_chars":1681,"slang_kept_rate":0.9583,"verify_rejected_rate":0.0068},"status":"checks_failed","description":"#9 + 'a misspelled word is never slang, check every word': pass .881, errors_fixed .938 (still under .948)","timestamp":1791605243444,"segment":0,"confidence":null,"asi":{"hypothesis":"#9 + 'A misspelled word is never slang: check every word, even in long or casual text, and fix each one'","insight":"an instruction sentence buys little; the model's recall in long paragraphs is the limit. The baseline's formalizing prompt fixed more because it rewrote more. Options: (1) is the errors_fixed floor (baseline-0.01) right? The baseline gets some of its fixes by restyling everything, so a style-preserving prompt may never match it on regex recall without a recall-specific idea. (2) a long multi-sentence example with several scattered typos to teach scanning (mind p95/prompt length)","next_action_hint":"add one multi-sentence formal example with 3 scattered typos and an alot-style split, and remove a weaker example to hold length","result":"pass .881 (s4 .75->.78), errors_fixed .932->.938. Tiny, within noise","rollback_reason":"errors_fixed .938 < .948"}}
{"run":11,"commit":"774c31f","metric":0.8915,"metrics":{"answered_count":7,"case_restyled_rate":0.0034,"clean_preserved_rate":0.9429,"code_kept_rate":1,"contraction_expanded_rate":0.0068,"dictation_prompt_chars":664,"errors_fixed_rate":0.946,"fix_echo_rate":0.0154,"linebreaks_kept_rate":1,"lowercase_kept_rate":1,"must_preserve_kept_rate":0.9818,"outputgate_rejected_rate":0.0034,"over_edit_rate":0.0949,"p50_ms":895,"p95_ms":1845,"pass_rate_user_sees":0.8881,"pass_s1":1,"pass_s2":0.8983,"pass_s3":0.8305,"pass_s4":0.7966,"pass_s5":0.9322,"prompt_chars":1900,"slang_kept_rate":0.9583,"verify_rejected_rate":0.0102},"status":"checks_failed","description":"#10 + multi-sentence example with scattered typos (corpus-disjoint words): pass .892, errors_fixed .946, ~1 error under the .948 floor","timestamp":1791605577156,"segment":0,"confidence":null,"asi":{"hypothesis":"#10 + one multi-sentence formal example with 4 scattered typos (misspellings chosen to not appear anywhere in the corpus or guard)","insight":"a long example teaches scanning: s4 .78->.80, errors_fixed +.008, over_edit .095 (lowest yet), p95 1845. The floor is .948, so about 1 error short","next_action_hint":"find which listed errors are still newly unfixed against baseline and add coverage for that class (probably homophones in long text: its/it's, you're/your, they're). Or replace the weakest example rather than adding (prompt is 1900 chars)","result":"pass .892 (s1 1.0 s2 .90 s3 .83 s4 .80 s5 .93), errors_fixed .946","rollback_reason":"errors_fixed .946 < .948, ~1 error short"}}
{"run":12,"commit":"774c31f","metric":0.8915,"metrics":{"answered_count":7,"case_restyled_rate":0.0034,"clean_preserved_rate":0.9429,"code_kept_rate":1,"contraction_expanded_rate":0.0068,"dictation_prompt_chars":664,"errors_fixed_rate":0.944,"fix_echo_rate":0.0154,"linebreaks_kept_rate":1,"lowercase_kept_rate":1,"must_preserve_kept_rate":0.9818,"outputgate_rejected_rate":0.0034,"over_edit_rate":0.0949,"p50_ms":885,"p95_ms":1895,"pass_rate_user_sees":0.8881,"pass_s1":1,"pass_s2":0.8983,"pass_s3":0.8305,"pass_s4":0.7966,"pass_s5":0.9322,"prompt_chars":1956,"slang_kept_rate":0.9583,"verify_rejected_rate":0.0102},"status":"checks_failed","description":"#11 + joined/split-words class in the fix list: no change (pass .892, errors_fixed .944)","timestamp":1791605903111,"segment":0,"confidence":null,"asi":{"hypothesis":"#11 + 'words wrongly joined or split (eachother, every where)' in the fix list, to catch alot/through out","insight":"naming the class didn't move alot/through out. Instruction-list additions are saturating; the remaining misses look like model recall limits on real-word-ish errors","next_action_hint":"stop adding to the fix list. Run the holdout checkpoint on the #11 prompt to see if the .89 generalizes, then target the dictation prompt (s3 .83 untouched) for both pass and errors_fixed headroom: s3 needs no style preservation, so the baseline formal examples can be replaced with transcript-shaped ones","result":"pass .892 unchanged, errors_fixed .944 (-1 error vs #11, noise)","rollback_reason":"errors_fixed .944 < .948"}}
{"run":13,"commit":"774c31f","metric":0.7695,"metrics":{"answered_count":8,"case_restyled_rate":0.1254,"clean_preserved_rate":0.8,"code_kept_rate":1,"contraction_expanded_rate":0.0169,"dictation_prompt_chars":1161,"errors_fixed_rate":0.956,"fix_echo_rate":0.0077,"linebreaks_kept_rate":1,"lowercase_kept_rate":0.0625,"must_preserve_kept_rate":0.6545,"outputgate_rejected_rate":0,"over_edit_rate":0.1288,"p50_ms":850,"p95_ms":2593,"pass_rate_user_sees":0.7695,"pass_s1":0.9492,"pass_s2":0.9153,"pass_s3":0.8644,"pass_s4":0.6949,"pass_s5":0.4237,"prompt_chars":664,"slang_kept_rate":0.2917,"verify_rejected_rate":0.0068},"status":"discard","description":"Dictation-specific prompt v1 (soundalikes, no rewording, transcript examples): s3 .83→.86, net +2 within noise. Fixed the too-thirty meaning change and the few-shot leak; lost than/then, hasn't, witch→which, Q3","timestamp":1791606032952,"segment":0,"confidence":null,"asi":{"hypothesis":"transcript-specific dictationInstructions: soundalike list, don't reword/drop/add, leave correct text, transcript-shaped examples (typed prompt left at baseline)","next_action_hint":"dictation v2: keep this prompt, add 'keep contractions as contractions (hasnt -> hasn't)', write numbers the way they're spoken unless they're plainly digits? (q three -> Q3 is the expected fix: say 'write names, numbers and times in their usual written form'), and an example with then/than in the 'then' direction","result":"s3 .83->.86 (net +2). Gains: s3-013 too thirty->two thirty (the meaning change is fixed), s3-025 too->two, s3-015 no rewrite, s3-079 few-shot leak gone, s3-075 clean kept, s3-037. Losses: s3-030 kept 'than' (should be then), s3-033 hasn't->has not, s3-046 witch->What (should be Which), s3-029 'Q three' not normalized to Q3","rollback_reason":"+0.0068 overall is within the 3-case noise rule"}}
