{"run":44,"commit":"7a97409","metric":0.9143,"metrics":{"answered_count":7,"answered_pasted":0,"case_restyled_rate":0,"clean_preserved_rate":0.875,"code_kept_rate":1,"contraction_expanded_rate":0,"dictation_prompt_chars":1445,"errors_fixed_rate":0.9286,"fix_echo_rate":0.037,"linebreaks_kept_rate":1,"lowercase_kept_rate":1,"must_preserve_kept_rate":0.9091,"outputgate_rejected_rate":0.0286,"over_edit_rate":0.0857,"p50_ms":1101,"p95_ms":1643,"pass_rate_user_sees":0.9143,"pass_s1":0.875,"pass_s2":1,"pass_s3":1,"pass_s4":0.75,"pass_s5":0.9,"prompt_chars":1900,"slang_kept_rate":1,"verify_rejected_rate":0.0286},"status":"checks_failed","description":"Fresh 35-case generalization set: current chain pass .914 vs baseline chain .714. Gate bug found: the British-English spell checker rejects the US 'neighbor'. Checks don't apply to this corpus","timestamp":1791622568586,"segment":1,"confidence":null,"asi":{"baseline_chain_on_fresh":"pass .714 (s5 .20, lowercase 0, slang 0, clean .50)","finding_spellcheck_locale":"s1-f07: model wrote the US 'neighbor', and NSSpellChecker on this Mac (British English) flags it, so introducedMisspelling rejects a correct fix. A real gate bug for any locale mismatch: SpellCheckGate should accept a word any English variant knows","hypothesis":"out-of-sample check: the current chain on 35 fresh cases written after tuning, vs the baseline chain at 2856ecb","next_action_hint":"make checks.sh skip when BULLETPROOF_EVAL_CORPUS is set (its thresholds are dev-corpus baselines), restore fresh-2026-10-10 from /tmp/fresh-backup, re-add the env hook, rerun. Then fix the SpellCheckGate locale bug","result":"current chain pass .914 vs baseline chain .714 (+.20; the dev gain was +.15), so it generalizes. s5 .20->.90, lowercase/slang 0->1.0, clean .50->.88. Remaining fails: s4-f02 'bred' (a real word) missed, s1-f07 (spellcheck locale), s5-f10 bc->because","rollback_reason":"checks.sh thresholds are dev-corpus baselines and don't apply to the fresh corpus (errors_fixed .929 vs the dev floor .948; s1 = 7/8)"}}
{"run":45,"commit":"0cfc773","metric":0.9143,"metrics":{"answered_count":7,"answered_pasted":0,"case_restyled_rate":0,"clean_preserved_rate":0.875,"code_kept_rate":1,"contraction_expanded_rate":0,"dictation_prompt_chars":1445,"errors_fixed_rate":0.9286,"fix_echo_rate":0.037,"linebreaks_kept_rate":1,"lowercase_kept_rate":1,"must_preserve_kept_rate":0.9091,"outputgate_rejected_rate":0.0286,"over_edit_rate":0.0857,"p50_ms":1101,"p95_ms":1643,"pass_rate_user_sees":0.9143,"pass_s1":0.875,"pass_s2":1,"pass_s3":1,"pass_s4":0.75,"pass_s5":0.9,"prompt_chars":1900,"slang_kept_rate":1,"verify_rejected_rate":0.0286},"status":"keep","description":"Fresh 35-case generalization set (written after tuning): current chain .914 vs baseline chain .714, so it generalizes. Adds the corpus hook, corpus-aware checks, and RESULTS.md","timestamp":1791622644104,"segment":1,"confidence":null,"asi":{"files":"fresh-2026-10-10/ (35 cases + README + both chains' outputs), BULLETPROOF_EVAL_CORPUS hook in fast_eval.py and metrics.py (default unchanged: 295 dev cases), report.py writes the corpus into last.json, checks.sh skips the dev-baseline thresholds for other corpora (the corpus-independent checks still apply), RESULTS.md (+fresh section)","hypothesis":"out-of-sample generalization check (rerun of #44 with corpus-aware checks): the current chain on the fresh 35-case set","next_action_hint":"fix the SpellCheckGate locale bug (accept a word that's correct in any installed English variant, e.g. check en_US and en_GB). Measurable on fresh s1-f07 and by replay over stored outputs (introducedMisspelling rejections)","result":"pass .914 vs baseline chain .714 on the fresh set (+.20 vs +.15 on dev), so it generalizes. Gate bug found: the British-English NSSpellChecker rejects the US 'neighbor' (introducedMisspelling)"}}
{"run":46,"commit":"ec86139","metric":0.9429,"metrics":{"answered_count":7,"answered_pasted":0,"case_restyled_rate":0,"clean_preserved_rate":0.875,"code_kept_rate":1,"contraction_expanded_rate":0,"dictation_prompt_chars":1445,"errors_fixed_rate":0.9643,"fix_echo_rate":0,"linebreaks_kept_rate":1,"lowercase_kept_rate":1,"must_preserve_kept_rate":0.9091,"outputgate_rejected_rate":0,"over_edit_rate":0.0571,"p50_ms":1101,"p95_ms":1643,"pass_rate_user_sees":0.9429,"pass_s1":1,"pass_s2":1,"pass_s3":1,"pass_s4":0.75,"pass_s5":0.9,"prompt_chars":1900,"slang_kept_rate":1,"verify_rejected_rate":0},"status":"keep","description":"SpellCheckGate locale fix: on English systems check the US and British dictionaries (misspelled only if both flag it). Stops rejecting US spellings on en_CA/en_GB Macs, and now catches teh/alot/accomodate. Fresh .914→.943; dev user_sees +1, holdout +1","timestamp":1791622905875,"segment":1,"confidence":null,"asi":{"bug":"SpellCheckGate used language nil (the system language with per-word auto-detection). On this en_CA Mac it flagged the US 'neighbor' (a correct model fix rejected as introducedMisspelling), and auto-detection *accepted* teh/alot/accomodate. That's why 'accomodate' was the one good fix the retuned verify gate still vetoed (the triage couldn't see it as a typo)","caveat":"the bug was found on the fresh set, so its fresh-set gain (+1) is no longer fully out-of-sample. The dev/holdout/replay checks above are the independent evidence","dev_holdout_harm_check":"Python dev user_sees .9085->.9119 (s1-006 accomodate verify veto gone), holdout user_sees .8952->.9048, gated dev .9119 unchanged. Over 406 introduced words in all stored outputs: newly flagged 0, no longer flagged only 'neighbor'","files":"SpellCheckGate.firstMisspelled (Swift) + harness spellcheck.swift mirror (rebuilt bin), OutputGateTests.spellingVariantsAreNotMisspellings (full suite passes; the Swift compile fix for [String?] typing came after the Python measurement, same logic)","fix":"on an English system, a word is misspelled only if both the 'en' (US) and 'en_GB' dictionaries flag it; non-English systems keep the automatic behaviour","hypothesis":"fix the SpellCheckGate locale bug found by the fresh set","result":"fresh pass .914->.943 (s1-f07 neighbor now accepted)"}}
{"run":47,"commit":"c993800","metric":0.9714,"metrics":{"answered_count":7,"answered_pasted":0,"case_restyled_rate":0,"clean_preserved_rate":1,"code_kept_rate":1,"contraction_expanded_rate":0,"dictation_prompt_chars":1445,"errors_fixed_rate":0.9643,"fix_echo_rate":0,"linebreaks_kept_rate":1,"lowercase_kept_rate":1,"must_preserve_kept_rate":1,"outputgate_rejected_rate":0,"over_edit_rate":0.0286,"p50_ms":1101,"p95_ms":1643,"pass_rate_user_sees":0.9714,"pass_s1":1,"pass_s2":1,"pass_s3":1,"pass_s4":0.75,"pass_s5":1,"prompt_chars":1900,"slang_kept_rate":1,"verify_rejected_rate":0},"status":"keep","description":"SlangRestorer: put back chat abbreviations the model expanded (bc→because, tbh→to be honest…). Over 6,470 stored outputs: fires 52, 20 fail→pass, 0 pass→fail. Fresh .943→.971, dev +1, AI slang .76→.88 (replay)","timestamp":1791623122627,"segment":1,"confidence":3.9930069930070013,"asi":{"caveat":"bc->because was seen on the fresh set, so its fresh +1 isn't fully out-of-sample. The table is standard chat abbreviations, chosen without reading corpus failures; observed technical shortenings (retro, intro, eng, pr) and ambiguous ones (ya, lol, omg) were deliberately left out","dev_holdout":"Qwen dev gated pass .9119->.9153 (+1, slang .96->1.0), holdout .9048 unchanged (slang already 1.0)","files":"bulletproof/Engines/SlangRestorer.swift (new; first in the cleanResponse chain), SlangRestorerTests (2 tests; full suite passes), harness restore_slang mirror (7/7 cases agree)","harm_check":"replay over 6,470 stored outputs (all runs, both engines, plus fresh): fired 52, fail->pass 20, pass->fail 0","hypothesis":"SlangRestorer: where the writer typed a standard chat abbreviation (idk, tbh, bc, thx, tmrw, u, gonna, ...) and the model replaced exactly that word with its expansion, put the abbreviation back","next_action_hint":"remaining failures are model recall (bred->bread real-word typo, pronoun case, homophones in long text). Little deterministic headroom is left. Consider a final SWIFT_VERIFY and wrap up","result":"fresh .943->.971 (s5 .90->1.0, slang 1.0, clean 1.0); replay on #42 Swift outputs: AI slang .76->.88, AI pass .75->.7575, AI s5 .70->.725; Qwen Swift s5 .9375->.95"}}
{"type":"config","name":"Final live Swift verification, both engines, all 400 (primary: Qwen dev gated)","metricName":"pass_rate","metricUnit":"","bestDirection":"higher"}
{"run":48,"commit":"d113dc2","metric":0.9153,"metrics":{"ai_dev_clean_preserved_rate":0.9143,"ai_dev_pass_rate":0.7729,"ai_dev_slang_kept_rate":0.875,"ai_holdout_pass_rate":0.7714,"qwen_dev_errors_fixed_rate":0.952,"qwen_dev_p95_ms":2648,"qwen_holdout_pass_rate":0.8952},"status":"keep","description":"Final live Swift verification (both engines, 400): Qwen .73→.91, Apple Intelligence .63→.77 vs the original baseline. Both engines keep lowercase, code and line breaks at 1.0, rejections ≤1%","timestamp":1791624198179,"segment":2,"confidence":null,"asi":{"ai_all400":"vs #42: pass .75->.7725, slang .76->.88, clean .88->.92, errors_fixed .862->.876, must_preserve .91->.93. Vs the original baseline: pass .6275->.7725 (+14.5pp), s5 .375->.7625, lowercase 1.0, code 1.0, line breaks 1.0, rejected 4.75%->1%","hypothesis":"final live Swift verification of the full stack after #46 (SpellCheckGate locale fix) and #47 (SlangRestorer), both engines, all 400 (new session baseline)","next_action_hint":"loop complete. Owner actions in RESULTS.md: history rewrite of db65f20 before pushing, latency A/B, the #25 decision, delete /tmp/models. Remaining failures are model recall","qwen_all400":"vs #42: pass .905->.91, slang .97->1.0, must_preserve .99->1.0, rejected 1%->.75%. Vs the original baseline: pass .73->.91 (+18pp), s5 .39->.95, lowercase/slang/code/must_preserve/line breaks all 1.0, clean .76->.96, errors_fixed .915->.943, rejected 4.25%->.75%. Dev .9153 (= Python), holdout .8952","spellcheck_live":"Swift dev user_sees .9153 = gated, so the s1-006 accomodate veto is gone in Swift too"}}
{"type":"config","name":"Latency A/B: current typed prompt vs baseline prompt (paired, same process, Qwen3-4B)","metricName":"latency_ratio_p50","metricUnit":"","bestDirection":"lower"}
{"run":49,"commit":"1555604","metric":1.9184,"metrics":{"baseline_mean_out_tokens":27,"baseline_p50_ms":629.5,"baseline_p95_ms":2073.9,"baseline_prompt_tokens":158,"current_mean_out_tokens":27.2,"current_p50_ms":1220.7,"current_p95_ms":2659.7,"current_prompt_tokens":460,"latency_ratio_mean":1.6579,"n":60,"pass_rate":0.9153},"status":"keep","description":"Latency A/B baseline: the current typed prompt costs 1.92x median latency vs the original prompt (1221 vs 630 ms, paired). All of it is prefilling 460 vs 158 instruction tokens per call","timestamp":1791624476608,"segment":3,"confidence":null,"asi":{"finding":"the current typed prompt (460 tokens) is 1.92x the baseline prompt's (158 tokens) median latency in a paired, interleaved A/B on the same process and model: p50 1221 vs 630 ms, p95 2660 vs 2074 ms, mean ratio 1.66. Output tokens are equal (27.2 vs 27.0), so it's all prefill of the instructions on every call (there's no prompt caching across requests)","files":"harness/latency_ab.py (ABBA-interleaved paired timing, baseline prompt from git 75e4a8a), opt-in hook in fast_eval.main (BULLETPROOF_EVAL_LATENCY_AB=1); RESULTS.md final numbers land with this keep","hypothesis":"measure the latency cost of the longer typed prompt properly (session baseline)","next_action_hint":"prefix KV caching: the instructions are identical on every call, so cache the system-prompt KV once and reuse it (mlx_lm prompt cache in the harness; in Swift, a cached KVCache prefix or ChatSession reuse in LocalModelEngine). That should remove most of the prompt-length cost and also speed up the baseline. Measure the ratio against an uncached baseline","machine_load":"load avg ~2.5-3 (browser, OrbStack running), the same for both arms because of interleaving"}}
{"run":50,"commit":"0ec68d8","metric":0.5721,"metrics":{"baseline_mean_out_tokens":27,"baseline_p50_ms":609.4,"baseline_p95_ms":2024.4,"baseline_prompt_tokens":158,"current_mean_out_tokens":27.2,"current_p50_ms":1194.1,"current_p95_ms":2642.9,"current_prompt_tokens":460,"latency_ratio_mean":0.7096,"n":60,"pass_rate":0.9153},"status":"keep","description":"Prefix KV cache for the system prompt in LocalModelEngine: corrections are now 0.57x the original app's median latency instead of 1.92x (Swift p50 1304→401 ms). Output identical on 398/400, pass unchanged","timestamp":1791625586360,"segment":3,"confidence":null,"asi":{"correctness":"Swift Qwen, all 400: raw output identical on 398/400 against uncached #48. The 2 near-tie flips cancel (s4-038 now keeps the sentence it used to drop, so fail->pass; s5-041 'a lot'->'much', so pass->fail), and pass .91 = .91. Python harness: 25/25 identical in a direct check; regenerated dev on the cached path gives pass .9153, unchanged","files":"LocalModelEngine: PrefixCacheStore actor (system-prompt KV built once per instructions + container, copied per request via KVCache.copy(); only used when template(sys+user) == template(sys) + template(user) in tokens, else falls back to a plain ChatSession), ChatSession(container, cache:). Harness: Qwen.generate_cached mirror (mlx_lm prompt_cache), generation cache key salted 'prefix-cache', latency_ab current_cached arm. Run artifact run-2026-10-10-prefix-cache-50/","hypothesis":"prefix KV caching for the constant system prompt in LocalModelEngine (ChatSession init with a pre-built KV cache), so the prompt length stops costing prefill on every call","next_action_hint":"latency is solved for Qwen (faster than the original app). Apple Intelligence has no exposed KV cache (LanguageModelSession.prewarm only). Loop is done; owner items remain (history rewrite, #25 decision, /tmp/models)","result":"paired A/B (Python, 60 inputs): shipping config (current prompt, cached) vs the original app (baseline prompt, uncached): p50 0.57x (353 vs 609 ms), mean 0.71x, p95 1775 vs 2024 ms. Uncached current was 1.90x. Swift all-400 Qwen: p50 1304->401 ms, p95 2577->1837 ms"}}
{"type":"config","name":"Quality on dev after prefix caching (prompt length now ~free): typed-prompt recall","metricName":"pass_rate","metricUnit":"","bestDirection":"higher"}
{"run":51,"commit":"78dc64c","metric":0.9153,"metrics":{"answered_count":7,"answered_pasted":0,"case_restyled_rate":0.0034,"clean_preserved_rate":0.9714,"code_kept_rate":1,"contraction_expanded_rate":0,"dictation_prompt_chars":1445,"errors_fixed_rate":0.952,"fix_echo_rate":0.0154,"linebreaks_kept_rate":1,"lowercase_kept_rate":1,"must_preserve_kept_rate":1,"outputgate_rejected_rate":0,"over_edit_rate":0.078,"p50_ms":412,"p95_ms":1827,"pass_rate_user_sees":0.9153,"pass_s1":1,"pass_s2":0.8983,"pass_s3":0.8983,"pass_s4":0.8136,"pass_s5":0.9661,"prompt_chars":1900,"slang_kept_rate":0.9583,"verify_rejected_rate":0.0034},"status":"keep","description":"Baseline (prefix-cached path): dev .9153, s4 .81","timestamp":1791625671862,"segment":4,"confidence":null,"asi":{"hypothesis":"session baseline: kept state after #50 (prefix-cached generation path)","notes":"dev .9153 on the cached path; s4 .81 is the weakest typed slice, and its failures are mostly 1 missed homophone/real-word error in long text"}}
{"run":52,"commit":"78dc64c","metric":0.9153,"metrics":{"answered_count":7,"answered_pasted":0,"case_restyled_rate":0,"clean_preserved_rate":0.9714,"code_kept_rate":1,"contraction_expanded_rate":0,"dictation_prompt_chars":1445,"errors_fixed_rate":0.952,"fix_echo_rate":0.0154,"linebreaks_kept_rate":1,"lowercase_kept_rate":1,"must_preserve_kept_rate":1,"outputgate_rejected_rate":0,"over_edit_rate":0.0746,"p50_ms":420,"p95_ms":1922,"pass_rate_user_sees":0.9153,"pass_s1":1,"pass_s2":0.8983,"pass_s3":0.8983,"pass_s4":0.8305,"pass_s5":0.9492,"prompt_chars":2221,"slang_kept_rate":1,"verify_rejected_rate":0.0068},"status":"discard","description":"Second paragraph example with homophones (prompt length is ~free now): pass .9153 unchanged (s4 +1, s5 -1). Recall in long text doesn't respond to more examples","timestamp":1791625906206,"segment":4,"confidence":null,"asi":{"hypothesis":"with prompt length ~free after #50, add a second paragraph-length example with scattered homophone errors (their/it's/you're, corpus-disjoint topic) to raise s4 recall","latency_note":"prefix cache confirmed: +321 prompt chars costs ~+8 ms p50 (412->420)","next_action_hint":"more examples don't move recall; the remaining s4 misses are model-capacity limits. Treat the typed prompt as final","result":"pass .9153 = baseline (s4 .814->.831 +1, s5 .966->.949 -1; prompt-perturbation swap). errors_fixed .952 unchanged","rollback_reason":"no primary change; longer prompt for nothing"}}
{"type":"config","name":"Dev quality with corrected metric (exact acceptable-output match counts its errors fixed)","metricName":"pass_rate","metricUnit":"","bestDirection":"higher"}
{"run":53,"commit":"24e7924","metric":0.9186,"metrics":{"answered_count":7,"answered_pasted":0,"case_restyled_rate":0.0034,"clean_preserved_rate":0.9714,"code_kept_rate":1,"contraction_expanded_rate":0,"dictation_prompt_chars":1445,"errors_fixed_rate":0.954,"fix_echo_rate":0.0154,"linebreaks_kept_rate":1,"lowercase_kept_rate":1,"must_preserve_kept_rate":1,"outputgate_rejected_rate":0,"over_edit_rate":0.078,"p50_ms":412,"p95_ms":1827,"pass_rate_user_sees":0.9186,"pass_s1":1,"pass_s2":0.8983,"pass_s3":0.9153,"pass_s4":0.8136,"pass_s5":0.9661,"prompt_chars":1900,"slang_kept_rate":1,"verify_rejected_rate":0.0034},"status":"keep","description":"Metric correction: an output that exactly matches one of the case's acceptable outputs counts its errors as fixed. Judge agreement .940→.945; every run shifts ~+.005 (deltas unchanged). Dev now .9186","timestamp":1791626110683,"segment":5,"confidence":null,"asi":{"applies_to_all_runs":"original baseline Qwen .73->.735, AI .6275->.635; final #48 Qwen .91->.915, AI .7725->.78; dev baseline constraints (.auto/baseline.json) unchanged (recomputed: identical)","files":"analysis/metrics.py row_flags (fix_exact => errors fixed), RESULTS.md metric-correction section","found_while_looking":"s5-013's verify-gate veto: 'could of' -> \"could've\" is a good fix that the verify gate rejects (originalMoreLikely); user_sees only. Candidate next: of/have triage in SpanTriage","hypothesis":"metric bug fix (measuring stick): an output that exactly matches one of the case's own acceptable outputs had failed because the errors regex names only one variant ('q three -> Q3' while 'Q three' is acceptable; 'could have' while \"could've\" is). Exact acceptable match now counts its errors as fixed","integrity":"not tuning: the rule follows the corpus's own acceptableOutputs, applies to every run, and improves judge agreement .940 -> .945 (judge-GOOD-but-metric-fail 21 -> 19, judge-bad-but-pass unchanged at 3). New session because the metric definition changed","result":"current dev .9153 -> .9186 under the corrected metric (s3-029)"}}
{"run":54,"commit":"9e696a4","metric":0.9186,"metrics":{"answered_count":7,"answered_pasted":0,"case_restyled_rate":0.0034,"clean_preserved_rate":0.9714,"code_kept_rate":1,"contraction_expanded_rate":0,"dictation_prompt_chars":1445,"errors_fixed_rate":0.954,"fix_echo_rate":0.0154,"linebreaks_kept_rate":1,"lowercase_kept_rate":1,"must_preserve_kept_rate":1,"outputgate_rejected_rate":0,"over_edit_rate":0.078,"p50_ms":412,"p95_ms":1827,"pass_rate_user_sees":0.9186,"pass_s1":1,"pass_s2":0.8983,"pass_s3":0.9153,"pass_s4":0.8136,"pass_s5":0.9661,"prompt_chars":1900,"slang_kept_rate":1,"verify_rejected_rate":0.0034},"status":"keep","description":"SlangRestorer v2: match typed abbreviations that carry punctuation (bday!!, thx,). Over all stored outputs: 62 fires, 26 fail→pass (v1: 20), 0 pass→fail. Qwen dev unchanged","timestamp":1791626281651,"segment":5,"confidence":null,"asi":{"correction_to_#53_note":"the s5-013 'could of' verify veto noted in #53 was stale: in current outputs s5-013's span of->have is accepted. The remaining live verify vetoes are AI s5-027 bday!!->birthday!! (bad; fixed by this change), AI s5-063 rewrote->rewritten (bad edit, a correct veto), Qwen s4-022 300->00 (correct catch)","files":"SlangRestorer.swift (typed-core matching) + 2 new test cases (full suite passes), harness restore_slang mirror (9/9 cases agree)","harm_check":"replay over all stored outputs: v2 fired 62 (v1: 52), fail->pass 26 (v1: 20), pass->fail 0","hypothesis":"SlangRestorer v2: v1 skipped typed abbreviations that carried punctuation ('bday!!', 'thx,', 'idk.') because it required the typed word to be letters only. Now it matches the typed word's letter core and keeps the correction's punctuation","next_action_hint":"deterministic headroom is now essentially exhausted on both engines; loop complete","result":"Qwen dev .9186 unchanged (slang already 1.0). AI #48 rows changed by v2: s5-027 (birthday!! -> bday!!, previously a verify veto)"}}
{"type":"config","name":"Long-input stress set (9 docs, 1.8k-3.2k chars): robustness of the full chain","metricName":"pass_rate","metricUnit":"","bestDirection":"higher"}
