{"run":55,"commit":"9e696a4","metric":0.8889,"metrics":{"answered_count":7,"answered_pasted":0,"case_restyled_rate":0,"contraction_expanded_rate":0,"dictation_prompt_chars":1445,"errors_fixed_rate":1,"fix_echo_rate":0,"linebreaks_kept_rate":1,"outputgate_rejected_rate":0,"over_edit_rate":0.1111,"p50_ms":8369,"p95_ms":14140,"pass_rate_user_sees":0.8889,"pass_s4":0.8889,"prompt_chars":1900,"slang_kept_rate":1,"verify_rejected_rate":0},"status":"checks_failed","description":"Long-input stress set: 8/9 pass, all 54 injected typos fixed, line breaks kept, no false gate rejections; p50 8.4 s on ~2-3k-char docs. checks.sh crashed on a None metric (bug)","timestamp":1791626476874,"segment":6,"confidence":null,"asi":{"checks_bug":"checks.sh compares last['code_kept_rate'] >= 0.96 but the value is None when a corpus has no code spans (last.get only defaults missing keys), so a TypeError. Fix: treat None as not-applicable for code_kept/linebreaks","hypothesis":"length robustness of the full chain (restorers, gates, prefix cache) on 9 documents of 1.8k-3.2k chars with 6 injected typos each","next_action_hint":"fix the None handling in checks.sh, restore long-2026-10-10 from /tmp/long-backup, rerun to keep the set. Look at the one over-edit failure and the latency (a 3k-char doc takes ~14 s: decode-bound, ~800 output tokens)","result":"pass .889 (8/9), errors_fixed 1.0 (54/54), linebreaks 1.0, no gate rejections, no content drops. p50 8.4 s / p95 14.1 s on long docs","rollback_reason":"checks.sh crashed on None code_kept_rate (no code spans in this corpus), not a quality failure"}}
{"run":56,"commit":"9e696a4","metric":0.8889,"metrics":{"answered_count":7,"answered_pasted":0,"case_restyled_rate":0,"contraction_expanded_rate":0,"dictation_prompt_chars":1445,"errors_fixed_rate":1,"fix_echo_rate":0,"linebreaks_kept_rate":1,"outputgate_rejected_rate":0,"over_edit_rate":0.1111,"p50_ms":8369,"p95_ms":14140,"pass_rate_user_sees":0.8889,"pass_s4":0.8889,"prompt_chars":1900,"slang_kept_rate":1,"verify_rejected_rate":0},"status":"checks_failed","description":"Rerun of the long set: checks.sh crashed again (eager f-string KeyError; p95 threshold is dev-only). Fixed, rerunning","timestamp":1791626559087,"segment":6,"confidence":null,"asi":{"bug":"the f-string failure message read last['pass_s1'] eagerly (KeyError on corpora without that slice), and the p95 latency threshold (dev baseline) applied to long docs. Both are now fixed in checks.sh (message uses .get, p95 skipped for non-dev corpora)","hypothesis":"rerun of the long-input stress set after fixing checks.sh None handling","next_action_hint":"restore long-2026-10-10 from /tmp/long-backup and rerun; checks now pass manually","result":"same metrics as #55 (cached): pass .889, errors_fixed 1.0","rollback_reason":"checks.sh KeyError on pass_s1 in the failure-message f-string"}}
{"run":57,"commit":"9e696a4","metric":0,"metrics":{"answered_count":0,"answered_pasted":0,"case_restyled_rate":0,"contraction_expanded_rate":0,"dictation_prompt_chars":0,"errors_fixed_rate":0,"fix_echo_rate":0,"linebreaks_kept_rate":0,"outputgate_rejected_rate":0,"over_edit_rate":0,"p50_ms":0,"p95_ms":0,"pass_rate_user_sees":0,"pass_s4":0,"prompt_chars":0,"slang_kept_rate":0,"verify_rejected_rate":0},"status":"crash","description":"Crash: long set dir empty (restore raced the previous revert). Restoring sequentially and rerunning","timestamp":1791626580168,"segment":6,"confidence":null,"asi":{"error":"the long-2026-10-10 corpus dir was empty: my restore ran concurrently with the previous log's revert (same tool batch), which deleted the untracked files again. cases=0, then report.py KeyError","hypothesis":"rerun of the long-input stress set (infra)","next_action_hint":"restore the dir sequentially, then rerun","rollback_reason":"infrastructure crash (empty corpus), no measurement"}}
{"run":58,"commit":"2a69015","metric":0.8889,"metrics":{"answered_count":7,"answered_pasted":0,"case_restyled_rate":0,"contraction_expanded_rate":0,"dictation_prompt_chars":1445,"errors_fixed_rate":1,"fix_echo_rate":0,"linebreaks_kept_rate":1,"outputgate_rejected_rate":0,"over_edit_rate":0.1111,"p50_ms":8369,"p95_ms":14140,"pass_rate_user_sees":0.8889,"pass_s4":0.8889,"prompt_chars":1900,"slang_kept_rate":1,"verify_rejected_rate":0},"status":"keep","description":"Long-input stress set (9 docs, 1.8-3.2k chars): 8/9 pass, all 54 typos fixed, line breaks kept, 0 false gate rejections. One miss: a lowercase paragraph inside a mixed document. Latency 8-14 s, decode-bound","timestamp":1791626620039,"segment":6,"confidence":null,"asi":{"files":"long-2026-10-10/ (9 docs + README + outputs), checks.sh None/KeyError/p95 fixes for non-dev corpora","hypothesis":"length robustness (session baseline): the full chain on 9 documents of 1.8k-3.2k chars (5-8 paragraphs, under the input cap), 6 injected typos each","latency":"p50 8.4 s (1.8k chars) to ~14 s (3k chars), decode-bound (output ~ input tokens). The prefix cache only removes the instruction prefill. Long selections need a progress indicator in the UI, or the 55 s budget is the limit","next_action_hint":"possible product follow-up: per-paragraph keep-lowercase for mixed-style documents (keepAllLowercase is whole-input only); rare in practice. Otherwise done","result":"8/9 pass, all 54 injected typos fixed (errors_fixed 1.0), line breaks 1.0, 0 gate rejections (droppedContent/introducedStructure/verify: no false positives on long text), 0 content drops. One failure s4-L08: a casual lowercase paragraph inside a mixed document got sentence-cased (keepAllLowercase only applies when the whole input has no capitals), plus 'You're' -> 'Your' (introduced error)"}}
{"run":59,"commit":"2a69015","metric":0.8889,"metrics":{"answered_count":7,"answered_pasted":0,"case_restyled_rate":0,"contraction_expanded_rate":0,"dictation_prompt_chars":1445,"errors_fixed_rate":1,"fix_echo_rate":0,"linebreaks_kept_rate":1,"outputgate_rejected_rate":0,"over_edit_rate":0.1111,"p50_ms":8369,"p95_ms":14140,"pass_rate_user_sees":0.8889,"pass_s4":0.8889,"prompt_chars":1900,"slang_kept_rate":1,"verify_rejected_rate":0},"status":"discard","description":"Per-line keepAllLowercase for mixed documents: differs from the whole-input rule on 1 stored output (s4-L08, still failing for another reason). No gain, so dropped for simplicity","timestamp":1791626739839,"segment":6,"confidence":null,"asi":{"hypothesis":"per-line keepAllLowercase: input lines with no capitals keep their output line lowercase even inside mixed-case documents (the s4-L08 failure from #58)","insight":"mixed-style documents (a lowercase line inside a capitalized document) basically don't occur in the corpus, the fresh set or real usage samples. The whole-input rule already covers the casual-message case that matters","next_action_hint":"nothing deterministic left with measurable value. The loop is complete; remaining items are owner actions","result":"per-line vs whole-input rule differs on 1 of all stored typed outputs (s4-L08), which still fails for another reason (You're -> Your). 0 gains, 0 losses anywhere; long-set pass .889 unchanged","rollback_reason":"no measurable gain for added complexity (simplicity rule)"}}
{"type":"config","name":"Dev quality (corrected metric), after dictation sentence-casing (#60). Prior dev .9186","metricName":"pass_rate","metricUnit":"","bestDirection":"higher"}
{"run":60,"commit":"7d7af94","metric":0.9186,"metrics":{"answered_count":7,"answered_pasted":0,"case_restyled_rate":0.0034,"clean_preserved_rate":0.9714,"code_kept_rate":1,"contraction_expanded_rate":0,"dictation_prompt_chars":1445,"errors_fixed_rate":0.954,"fix_echo_rate":0.0154,"linebreaks_kept_rate":1,"lowercase_kept_rate":1,"must_preserve_kept_rate":1,"outputgate_rejected_rate":0,"over_edit_rate":0.078,"p50_ms":412,"p95_ms":1827,"pass_rate_user_sees":0.9186,"pass_s1":1,"pass_s2":0.8983,"pass_s3":0.9153,"pass_s4":0.8136,"pass_s5":0.9661,"prompt_chars":1900,"slang_kept_rate":1,"verify_rejected_rate":0.0034},"status":"keep","description":"Dictation path: deterministic sentence casing (sentence starts + pronoun I, leaves iPhone/eBay). Over all stored dictation outputs: 61 changed, 27 fail→pass (all Apple Intelligence), 0 pass→fail. AI s3 .71→.76 (replay); Qwen unchanged","timestamp":1791626934750,"segment":7,"confidence":null,"asi":{"analysis_first":"AI s3 failures in final #48: 23 total; missed capitals are part of 7 (s3-004/006/051/063/034/065/036: AI leaves sentence starts or 'i' lowercase), the rest are soundalike/meaning errors (whether->weather, We're->We were, two->three), which are model-level","files":"ProofreadPrompt.cleanResponse(sentenceCases:) + sentenceCase (skips words with an inner capital: iPhone, eBay; after a colon stays as-is), both engines pass isDictation, 1 test with 3 cases (full suite passes), harness sentence_case mirror (3/3 agree) on the dictation path","harm_check":"replay over every stored dictation (s3) output, both engines, all runs + fresh: changed 61, fail->pass 27 (all Apple Intelligence), pass->fail 0","hypothesis":"deterministic sentence casing on the dictation path only: capitalize sentence starts (after . ! ? + space, line breaks, text start) and the standalone pronoun i. Transcripts are lowercase by accident, the dictation prompt already asks for this, and Apple Intelligence still leaves some lowercase","next_action_hint":"the dictation path's remaining failures are model soundalike errors. Done","result":"replay on #48: AI s3 .7125->.7625, AI pass .78->.79 (corrected metric); Qwen unchanged (its dictation output is already cased). Python dev .9186 = prior (Qwen)"}}
{"type":"config","name":"Live Swift verification after #54 + #60 (both engines, all 400; primary Qwen dev gated, corrected metric)","metricName":"pass_rate","metricUnit":"","bestDirection":"higher"}
{"run":61,"commit":"265463f","metric":0.9186,"metrics":{"ai_dev_clean_preserved_rate":0.9429,"ai_dev_pass_rate":0.7458,"ai_dev_slang_kept_rate":0.875,"ai_holdout_pass_rate":0.7429,"qwen_dev_errors_fixed_rate":0.954,"qwen_dev_p95_ms":1877,"qwen_holdout_pass_rate":0.9048},"status":"keep","description":"Live verification of #54+#60: Qwen .735→.915 vs the original baseline (= Python), p50 398 ms. AI .745 (dictation casing confirmed: missed caps 7→1), below #48's .78 from AI run-to-run variance (typed unfixed 61→79 with unchanged typed code)","timestamp":1791627743896,"segment":8,"confidence":null,"asi":{"ai_variance":"AI pass .745 vs #48 .78 (corrected metric). The drop is AI run-to-run variance: typed unfixed errors 61->79 with unchanged typed model code (SlangRestorer v2 only restores abbreviations). AI typed pass has ranged .68-.80 across 7 live runs. The sentence-casing fix is confirmed live (AI s3 missed_caps 7->1, 0 uncased s3 outputs left); AI s3 pass .7125 = #48, because other s3 errors rose","honest_reading":"AI vs the original baseline, live: .635 -> .745 (this run) / .78 (#48); treat AI as ~.75-.79","hypothesis":"live Swift verification of #54 (SlangRestorer v2) and #60 (dictation sentence casing), both engines, all 400","next_action_hint":"nothing further in the loop; report AI as a range and stop","qwen_live":"dev .9186 = Python, holdout .9048, all 400 .915 (corrected metric; original baseline .735), p50 398 ms (prefix cache), rejected .5%"}}
{"run":62,"commit":"7ac7cde","metric":0.9186,"metrics":{"ai_dev_clean_preserved_rate":0.9143,"ai_dev_pass_rate":0.7831,"ai_dev_slang_kept_rate":0.9583,"ai_holdout_pass_rate":0.7905,"qwen_dev_errors_fixed_rate":0.954,"qwen_dev_p95_ms":1855,"qwen_holdout_pass_rate":0.9048},"status":"keep","description":"Apple Intelligence greedy decoding (GenerationOptions(sampling: .greedy)): AI .745→.785 all 400 (dev .783, holdout .790), slang .85→.94, errors fixed +.024. Determinism check next","timestamp":1791628524562,"segment":8,"confidence":null,"asi":{"files":"AppleIntelligenceEngine.options = GenerationOptions(sampling: .greedy), passed to both respond(generating:) calls; test decodingIsGreedy (full suite passes)","hypothesis":"greedy decoding for Apple Intelligence (GenerationOptions(sampling: .greedy)): a proofread has one right answer, and default sampling made AI vary run to run (typed pass .68-.80 across identical runs)","next_action_hint":"rerun SWIFT_VERIFY unchanged and diff AI raw outputs against run-2026-10-10-ai-greedy-62 to confirm determinism. If they're identical, AI numbers become stable single values","pipeline_md_correction":"context/pipeline.md says AI has 'no temperature control here'. The SDK does have GenerationOptions(sampling:, temperature:)","result":"AI all 400: pass .745 (#61) -> .785; dev .7831, holdout .7905, errors_fixed .847->.871, slang .85->.94, s5 .75->.875, s2 .76->.81. One run, determinism unverified. Qwen identical"}}
{"run":63,"commit":"189bbbd","metric":0.9186,"metrics":{"ai_dev_clean_preserved_rate":0.9143,"ai_dev_pass_rate":0.7831,"ai_dev_slang_kept_rate":0.9583,"ai_holdout_pass_rate":0.7905,"qwen_dev_errors_fixed_rate":0.954,"qwen_dev_p95_ms":1874,"qwen_holdout_pass_rate":0.9048},"status":"keep","description":"Determinism check: Apple Intelligence with greedy decoding gives byte-identical output on 400/400 across two runs (it varied run to run before). Final AI .785, now a stable number","timestamp":1791629235023,"segment":8,"confidence":null,"asi":{"hypothesis":"determinism verification of #62 (AI greedy decoding): an identical rerun, raw outputs diffed","implication":"AI numbers are now single stable values, not ranges (before: typed pass .68-.80 across identical runs), and AI A/B tests are one run instead of 3+. Final AI all-400: .785 (dev .783, holdout .790) vs the original baseline .635 (corrected metric)","next_action_hint":"AI A/B is now cheap and exact. Previously noise-limited AI-specific ideas (AI @Guide wording, AI dictation guide) could be revisited if wanted. Otherwise done","result":"Apple Intelligence raw outputs identical on 400/400 between run 1 (#62) and run 2; user_sees identical 400/400; every AI metric identical to 4 decimals. Qwen also 400/400"}}
{"run":64,"commit":"494d883","metric":0.9186,"metrics":{"ai_dev_clean_preserved_rate":0.9429,"ai_dev_pass_rate":0.8102,"ai_dev_slang_kept_rate":0.9167,"ai_holdout_pass_rate":0.7905,"qwen_dev_errors_fixed_rate":0.954,"qwen_dev_p95_ms":1853,"qwen_holdout_pass_rate":0.9048},"status":"keep","description":"AI typed @Guide gets the fix list (agreement, tense, articles, apostrophes, homophones). Exact greedy A/B: AI dev .783→.810 (+11/-3, grammar cases), holdout flat .790, unfixed errors 64→54","timestamp":1791630026447,"segment":8,"confidence":null,"asi":{"analysis_first":"AI greedy failures: 86/400, 76 involve unfixed errors (s4 29, s3 21, s2 17, s5 17). Under-correction is AI's dominant gap, and its typed guide had only a keep-style emphasis","caveat":"holdout flat (+0); gains are dev-heavy but in the targeted class, and holdout unfixed errors also fell 24->23. Judge as a modest, likely-real recall gain","files":"AppleIntelligenceEngine Correction @Guide text (typed path only; DictationCorrection unchanged)","hypothesis":"AI-only, exact A/B (greedy = deterministic): bring the typed prompt's fix list into AI's typed @Guide (agreement, tense, articles, missing apostrophes, misused homophones), since AI attends to its guide channel","next_action_hint":"AI A/B is cheap and exact now; similar fix-list emphasis for DictationCorrection is the AI s3 lever (s3 21 fails)","result":"AI dev .783->.810 (gained 11, lost 3; gains are grammar cases s2/s4: agreement, articles, homophones), AI holdout .7905->.7905 (2 gained, 2 lost), dev unfixed errors 64->54, holdout 24->23. All 400: AI .785->.805 (corrected metric; original baseline .635). Qwen identical"}}
{"run":65,"commit":"494d883","metric":0.9186,"metrics":{"ai_dev_clean_preserved_rate":0.9429,"ai_dev_pass_rate":0.8169,"ai_dev_slang_kept_rate":0.9167,"ai_holdout_pass_rate":0.781,"qwen_dev_errors_fixed_rate":0.954,"qwen_dev_p95_ms":1880,"qwen_holdout_pass_rate":0.9048},"status":"discard","description":"AI dictation @Guide + soundalike list: dev s3 +2, holdout s3 -1, the targeted soundalike errors unchanged. Discarded (no real gain); typed AI output identical 320/320 (determinism holds)","timestamp":1791630797742,"segment":8,"confidence":null,"asi":{"determinism_bonus":"typed AI outputs identical 320/320 with unchanged typed code: greedy determinism confirmed a third time","hypothesis":"AI DictationCorrection @Guide gets the soundalike list (the same generic list as Qwen's dictation prompt; no corpus-failure words) plus 'every other word is the speaker's own'","insight":"AI's dictation soundalike errors are model-level; guide emphasis doesn't reach them. AI dictation stays at #64 levels","next_action_hint":"AI levers exhausted short of a stronger model. Loop complete","result":"AI dev s3 +2 (s3-018, s3-028), holdout s3 -1 (s3-036); the targeted soundalike failures (s3-002 whether, s3-005 We're->We were, s3-007 except->accepts, s3-013 two->three) are unchanged. AI dev .810->.817, holdout .790->.781","rollback_reason":"the targeted class didn't move; net +1 with a holdout loss is not evidence of a real gain"}}
{"run":66,"commit":"2c27fb5","metric":0.9186,"metrics":{"ai_dev_clean_preserved_rate":0.9429,"ai_dev_pass_rate":0.8102,"ai_dev_slang_kept_rate":0.9167,"ai_holdout_pass_rate":0.7905,"qwen_dev_errors_fixed_rate":0.954,"qwen_dev_p95_ms":1827,"qwen_holdout_pass_rate":0.9048},"status":"keep","description":"Out-of-sample check of #64 on the fresh set (Swift, exact A/B): AI .829 before and after, 35/35 outputs identical. Qwen fresh .971. #64 is neutral out of sample. Recording run, no code change","timestamp":1791631192741,"segment":8,"confidence":null,"asi":{"hypothesis":"out-of-sample check of #64 (AI typed @Guide fix list) on the fresh 35-case set: exact A/B (greedy) between the code just before #64 (worktree at 189bbbd) and HEAD, both engines live in Swift","interpretation":"#64's dev gain (+8, grammar cases) doesn't show up out of sample, but it doesn't hurt either. Kept as harmless; its true effect is probably smaller than dev suggests","next_action_hint":"loop complete. AI out-of-sample 0.829 vs Qwen 0.971 shows Qwen is the better engine for this policy; recommend Qwen as default","result":"AI fresh pass .829 both before and after #64, with 35/35 AI outputs byte-identical (the fix-list wording never changed a fresh output). Qwen Swift fresh .971 (= Python). The standard dev measurement is unchanged (.9186)"}}
{"run":67,"commit":"27c83ec","metric":0.9186,"metrics":{"ai_dev_clean_preserved_rate":0.9429,"ai_dev_pass_rate":0.8102,"ai_dev_slang_kept_rate":0.9167,"ai_holdout_pass_rate":0.7905,"qwen_dev_errors_fixed_rate":0.954,"qwen_dev_p95_ms":1827,"qwen_holdout_pass_rate":0.9048},"status":"keep","description":"H4 fix: a lowercase protected word the model corrects to a spell-checker guess is a learned typo, so the fix is accepted and the entry forgotten (signficantly, personible). Names stay protected (Caitlin→Caitlyn still rejected). Unit-tested; eval unchanged (vocab frozen)","timestamp":1791631501667,"segment":8,"confidence":null,"asi":{"design_evidence":"NSSpellChecker autocorrection exists for 209/223 corpus typos but also for ~40% of legit jargon/names (Figma->Sigma, Codable->Coddle, npm->nom), so blocking *learning* on it would cripple the vocabulary. Guesses for names include exactly the swaps to block (Caitlin->Caitlyn, Zoey->Zoe, [name]->Aleksei), so the exemption is restricted to always-lowercase words","files":"SpellCheckGate.guesses(for:), PersonalVocabulary.forget(_:), OutputGatedEngine protected-word check, 2 new PersonalVocabularyTests (s5-061 sequence; Caitlin->Caitlyn stays rejected); full suite passes incl. the existing Jon->John test","hypothesis":"H4: personal vocabulary can learn a typo the model missed twice and then block every later fix of it (s5-061 'signficantly'; the user's real pending list has 'personible'). Fix at the protection point: a lowercase protected word replaced by one of the spell checker's guesses is a learned typo, so accept the fix and forget the entry. Capitalized words (names) stay fully protected","metric_note":"the eval freezes the vocabulary, so the primary can't move (dev .9186 unchanged); evidence is the unit tests and the guess analysis. User impact: 'personible' -> 'personable' (a guess) will be accepted and forgotten instead of becoming a permanent block","next_action_hint":"H5 (dictation fallback telemetry) and H7 (practice drill learning model rewrites) are the remaining untouched backlog items; both are product hygiene, not correction quality"}}
