{"run":90,"commit":"78e4c02","metric":0.9288,"metrics":{"ai_dev_clean_preserved_rate":0.9429,"ai_dev_pass_rate":0.8102,"ai_dev_slang_kept_rate":0.9167,"ai_holdout_pass_rate":0.8,"qwen_dev_errors_fixed_rate":0.962,"qwen_dev_p95_ms":1827,"qwen_holdout_pass_rate":0.9048},"status":"keep","description":"Fix: cleanResponse deleted the writer's own edge <text>/</text> tags as 'leaked prompt markers' (SVG/XML: '<text x=10>Totla revenue</text>' was pasted without its closing tag). Now only stripped when the input lacks them or they're doubled. Markup probe 5/8 → 8/8; corpus unaffected; Swift/Python parity 0 diffs","timestamp":1791640491855,"segment":8,"confidence":null,"asi":{"bug":"cleanResponse stripped any leading '<text>' and trailing '</text>' as a leaked prompt marker. When the writer's own selection starts or ends with that tag (SVG <text> elements, XML/templates), the user's markup was deleted from the pasted text, and a bare '<text>' became empty (rejected)","files":"ProofreadPrompt.cleanResponse (both engines), +1 test with 4 expectations (full suite passes); harness clean_response mirror; 8 markup cases appended to the adversarial slice (89 inputs)","fix":"a marker is a leak unless the writer's own trimmed text starts/ends with it; in that case only a doubled marker is stripped","gotcha":"the harness generation cache stores cleaned output, so a cleanResponse change that removes characters needs --no-cache on affected inputs to measure (the cached rows were already truncated)","harm_check":"0 corpus/guard inputs start or end with the marker, so the corpus is unaffected (dev .9288 unchanged); invariants hold (574 inputs, 13,362 outputs); Swift/Python chain parity 0 differences on 2,960 pairs incl. 20 marker edge cases","hypothesis":"the <text>…</text> prompt wrapper's leak-stripping deletes the user's own edge markup","next_action_hint":"remaining Swift-only surfaces are probed. Loop is at a natural stop; owner items remain","probe":"8 markup inputs through the real chain before: 2 pasted with the user's closing </text> deleted ('<text x=10 y=20>Total revenue', 'the label is <text>Submit'), 1 rejected ('<text>' alone -> empty). After (regenerated): 8/8 correct, typos fixed and all markup kept"}}
{"run":91,"commit":"46dfd59","metric":0.9288,"metrics":{"ai_dev_clean_preserved_rate":0.9429,"ai_dev_pass_rate":0.8102,"ai_dev_slang_kept_rate":0.9167,"ai_holdout_pass_rate":0.8,"qwen_dev_errors_fixed_rate":0.962,"qwen_dev_p95_ms":1873,"qwen_holdout_pass_rate":0.9048},"status":"keep","description":"Live verification of #88+#90 (Swift, both engines): corpus output byte-identical to #86 on 400/400 for both. Robustness 103 inputs: Qwen 91 (all markup, dense scripts, emoji fixes confirmed in the app). AI 69: it strips HTML markup and errors on Indic/Burmese scripts (model limits)","timestamp":1791641451013,"segment":8,"confidence":null,"asi":{"hypothesis":"live verification batch for #88 (token budget) and #90 (edge markers): SWIFT_VERIFY both engines all 400, plus the 89 adversarial + 14 multilingual inputs through the app","label_note":"several new robustness rows from #86/#88 are labelled 'unchanged' although they contain a typo ('finaly', 'tomorow'), so Qwen fixing them counts as a fail (s5-z02, s1-z06, s1-z07); a labelling slip in my probe set, not a regression. s1-t05 is the known emoji-run continuation (ideas.md)","new_ai_findings":"Apple Intelligence strips HTML/XML markup (x01-x08: '<p>Thsi…</p>' -> 'This…', '<svg><text>…' -> bare text; model-level, droppedContent caught one) and fails with ENGINE_FAILED on Hindi/Tamil/Bengali/Burmese/emoji runs (likely its unsupported-language error: nothing is pasted, the user sees an error). Both are reasons Qwen should be the default","next_action_hint":"loop is at a natural stop; optionally strip-markup restore for AI (a MarkupRestorer like CodeSpanRestorer) if AI stays an option. Fix the probe labels (z02/z06/z07 should be 'fix') if the set is reused","result":"corpus: raw output byte-identical to #86 on 400/400 for both engines (#88/#90 don't touch any corpus input, as predicted). Robustness, live Swift: Qwen 91/103 (on the 80 inputs from #86: 72 -> 73); all 8 markup cases pass, Hindi/Tamil/Bengali/Burmese come back complete, all emoji kept. AI 69/103 (63 -> 63 on the old 80)"}}
{"run":92,"commit":"2aa8093","metric":0.9288,"metrics":{"ai_dev_clean_preserved_rate":0.9429,"ai_dev_pass_rate":0.8102,"ai_dev_slang_kept_rate":0.9167,"ai_holdout_pass_rate":0.8,"qwen_dev_errors_fixed_rate":0.962,"qwen_dev_p95_ms":1827,"qwen_holdout_pass_rate":0.9048},"status":"keep","description":"Housekeeping: corrected 3 mislabelled rows in my robustness probe set (they contain real typos; found by spell-checking every 'unchanged' row), and brought RESULTS.md/PIPELINE.md up to date with #85-#91. Live robustness re-scored: Qwen 94/103, AI 70/103. No code change","timestamp":1791641571404,"segment":8,"confidence":null,"asi":{"docs":"RESULTS.md: latest live run is #91; robustness 94/103 vs 70/103; list of the 11 bugs found by unusual-input probing (#72-#90); chain parity (#87); AI-only limits (markup stripping, Indic/Burmese failures); Qwen-default rationale. PIPELINE.md: marker rule (#90), parity tool in the eval section","hypothesis":"housekeeping: (1) three rows in my own robustness probe set were mislabelled 'unchanged' though they contain real typos; (2) RESULTS.md / PIPELINE.md predate #85-#91","integrity_note":"this touches only my robustness probe set (adversarial-2026-10-10), never the corpus, splits or metric. The relabel was decided by the spell checker plus reading each flagged row, not by which way the numbers moved. Both engines' counts rise (Qwen +3, AI +1) because the correct typo fix now counts as correct","labels":"spell-checked every 'unchanged' row (45): flagged words were deliberate literals (exmaple.com, Documnets path, #teh, /prefernces), foreign text (au lait, German) or real typos in three rows I mislabelled (s5-z02 finaly, s1-z06 / s1-z07 tomorow). Those 3 are now 'fix' with acceptable outputs; README records it. Re-scored live #91: Qwen 91 -> 94/103, AI 69 -> 70/103","next_action_hint":"loop complete; owner items only"}}
{"run":93,"commit":"f6c79ca","metric":0.9288,"metrics":{"ai_dev_clean_preserved_rate":0.9429,"ai_dev_pass_rate":0.8102,"ai_dev_slang_kept_rate":0.9167,"ai_holdout_pass_rate":0.8,"qwen_dev_errors_fixed_rate":0.962,"qwen_dev_p95_ms":1827,"qwen_holdout_pass_rate":0.9048},"status":"keep","description":"OutputGate.droppedMarkup: reject output missing an HTML/XML tag the input had. Apple Intelligence was pasting '<p>Thsi…</p>' as 'This…' (5 rows): now an error instead of broken markup. 0 false positives over all stored outputs; Swift/Python parity 0 diffs; Qwen unaffected","timestamp":1791641836152,"segment":8,"confidence":null,"asi":{"files":"OutputGate.droppedMarkup (new Rejection case, dropsMarkup with a strict HTML/XML tag regex, after droppedContent); user-facing message in ProofreadingEngine; +1 OutputGateTests test (5 expectations incl. 'a < b and c > d' and '<bo@example.com>' not treated as tags); harness output_gate mirror; PIPELINE.md §4","harm_check":"0 acceptable corpus/robustness outputs flagged. Over every stored user-visible output (both engines, all corpora): fires 5, all Apple Intelligence rows that were already failing (markup stripped), 0 passing rows rejected. The only corpus input with a tag (s5-055, `<path>` in backticks) is protected by CodeSpanRestorer first. Swift/Python chain parity 0 differences on 2,994 pairs (9 droppedMarkup verdicts identical). Invariants hold. Dev .9288 unchanged; full suite passes","hypothesis":"Apple Intelligence strips HTML/XML markup and the result is pasted ('<p>Thsi…</p>' -> 'This…', '<string name=…>' unwrapped), silently destroying the user's markup. A gate that rejects output missing any input tag turns that into an error, mirroring introducedStructure in reverse","next_action_hint":"a MarkupRestorer (put stripped tags back around aligned text, like CodeSpanRestorer) would turn these AI errors into correct pastes; worthwhile only if Apple Intelligence remains a supported engine for markup-heavy users","result":"AI markup rows that were pasted broken (s5-x01, x03, x04, x07, x08) are now rejected with 'The model removed markup tags from your text'. Qwen unaffected (it keeps markup: 8/8 since #90)"}}
{"run":94,"commit":"613fab1","metric":0.9288,"metrics":{"ai_dev_clean_preserved_rate":0.9429,"ai_dev_pass_rate":0.8102,"ai_dev_slang_kept_rate":0.9167,"ai_holdout_pass_rate":0.8,"qwen_dev_errors_fixed_rate":0.962,"qwen_dev_p95_ms":1827,"qwen_holdout_pass_rate":0.9048},"status":"keep","description":"SlangRestorer v3: restore adjacent abbreviations that the alignment groups into one changed run ('see u tmrw' -> 'see you tomorrow' -> 'see u tmrw'). Replay: 7 fires, 3 fail→pass (AI), 0 pass→fail; parity 0 diffs; Qwen unchanged","timestamp":1791642114426,"segment":8,"confidence":null,"asi":{"bug":"SlangRestorer only handled a changed run of exactly one typed word. Adjacent abbreviations change together in the word alignment ('u tmrw' -> 'you tomorrow', 'ok there' -> 'Okay, there's' when the next word is also corrected), so they were never restored. Found from AI robustness failure s5-z01","files":"SlangRestorer: split() (backtracking, one piece per typed word: an abbreviation takes 1-4 words spelling an expansion, any other word exactly one) + restoredPiece() (the old per-word match); runs up to 6 typed words; +1 test (3 expectations; full suite passes); harness mirror (_slang_split/_slang_piece)","harm_check":"invariants hold (echo 582 inputs, idempotence 14,162 outputs). Replay new vs old restorer over every stored user-visible output: 7 fires on 3 cases, 3 fail->pass (s5-025 AI 'I don't know, man' -> 'idk, man'; s5-z01 AI 'see you tomorrow' -> 'see u tmrw'), 0 pass->fail; s5-018 AI changes 'Okay' -> 'ok' correctly but still fails on other edits. A non-abbreviation in the run keeps its correction ('im omw rn' -> 'I'm omw rn'). Swift/Python chain parity 0 differences on 2,981 pairs. Qwen dev .9288 unchanged (Qwen keeps slang already)","hypothesis":"adjacent chat abbreviations aren't restored: the alignment groups them into one multi-word changed run, which SlangRestorer skipped","next_action_hint":"Apple Intelligence-only benefit (Qwen keeps slang); a live SWIFT_VERIFY with the next batch would show the AI corpus gain (replay suggests +1 dev case s5-025)"}}
{"run":95,"commit":"a390ae9","metric":0.9288,"metrics":{"ai_dev_clean_preserved_rate":0.9429,"ai_dev_pass_rate":0.8102,"ai_dev_slang_kept_rate":0.9167,"ai_holdout_pass_rate":0.8,"qwen_dev_errors_fixed_rate":0.962,"qwen_dev_p95_ms":1827,"qwen_holdout_pass_rate":0.9048},"status":"keep","description":"Keep the writer's curly apostrophes: when the original uses only ’ in words, the output's straight in-word apostrophes become ’ (fixes 'dont worry, it’s fine' → \"don't worry, it's fine\"). Typography probe 10/12 → 12/12; replay 5 fires, 0 harm; parity 0 diffs","timestamp":1791642488855,"segment":8,"confidence":null,"asi":{"files":"ApostropheFixer.matchApostropheStyle (+inWordCount), called right after ApostropheFixer.fix in cleanResponse (both engines, both paths); +1 test (4 expectations; full suite passes); harness match_apostrophe_style mirror in post_process","harm_check":"replay over every stored user-visible output: fires 5, all s1-c12 (both engines; already passing because the metric accepts either apostrophe, now in the writer's style), 0 pass->fail. Invariants hold (echo 582, idempotence 14,162). Swift/Python chain parity 0 differences on 2,999 pairs incl. 18 curly-apostrophe edge cases. Dev .9288 unchanged (the synthetic corpus is almost all straight apostrophes)","hypothesis":"smart-quote writers (macOS default) lose their curly apostrophes when anything else in the text needs an apostrophe fix: the model and ApostropheFixer write straight ones and the model straightens the rest ('dont worry, it’s fine' -> \"don't worry, it's fine\")","limits":"only in-word apostrophes, only when the original's in-word apostrophes are all curly (a straight one anywhere, even in a URL, means mixed style: left alone); quote marks (‘ ’ “ ” around words) aren't handled","next_action_hint":"possible follow-up: the same for curly double quotes and —/… if real usage shows them flattened (Qwen kept them in 10/10 probes; AI turned — into -- once)","probe":"12 smart-typography inputs through the Qwen chain: Qwen keeps curly quotes, em dashes and ellipses on its own (10/12), but 2/12 lost every curly apostrophe, both when an apostrophe had to be added ('dont', 'im'). After: 'don’t worry, it’s fine', 'i’m sure it’s fine'"}}
{"run":96,"commit":"a529d63","metric":0.9288,"metrics":{"ai_dev_clean_preserved_rate":0.9429,"ai_dev_pass_rate":0.8102,"ai_dev_slang_kept_rate":0.9167,"ai_holdout_pass_rate":0.8,"qwen_dev_errors_fixed_rate":0.962,"qwen_dev_p95_ms":2773,"qwen_holdout_pass_rate":0.9048},"status":"keep","description":"Live verification of #93-#95 (Swift, both engines): corpus output byte-identical to #91 (400/400 each). Robustness: Qwen 94/103, AI 71/103 (+1); 5 AI markup-strips now rejected, not pasted. Typography: Qwen 12/12, AI 7/12. Latency doubled under a concurrent Zoom call (GPU 71%), not code","timestamp":1791643749968,"segment":8,"confidence":null,"asi":{"hypothesis":"live verification batch for #93 (droppedMarkup), #94 (adjacent slang), #95 (curly apostrophes): SWIFT_VERIFY both engines all 400 + 103 robustness inputs + the 12 typography probes","latency_note":"Qwen p50 398 -> 766 ms and p95 1840 -> 2686 with byte-identical output; AI also slower (706 -> 787). A Zoom call was running (GPU 71% busy, load avg ~4.5), and #93-#95 only add microsecond-scale post-processing, so this is contention, not a regression. Re-measure latency on an idle machine before quoting it","next_action_hint":"Apple Intelligence-only typography restorer: when the original uses curly double quotes / em dash / ellipsis and the output has the ASCII stand-in at the aligned spot, put the writer's character back (AI flattened 5/12 probes; Qwen 0/12). Small, deterministic, replay- and parity-checkable","result":"corpus: raw output byte-identical to #91 on 400/400 for both engines; pass rates unchanged (Qwen dev .9288 / holdout .9048, AI dev .8102 / holdout .80). Robustness live: Qwen 94/103 (1 change, s1-c12 curly apostrophes kept), AI 71/103 (+1: s5-z01 'see u tmrw' restored; s1-c12 curly kept; 5 markup-stripped outputs now rejected with droppedMarkup instead of pasted). Typography probes: Qwen 12/12 keep smart punctuation; AI 7/12 (it straightens double quotes, turns — into -- or ;, … into ...)"}}
{"run":97,"commit":"fdf112d","metric":0.9288,"metrics":{"ai_dev_clean_preserved_rate":0.9429,"ai_dev_pass_rate":0.8102,"ai_dev_slang_kept_rate":0.9167,"ai_holdout_pass_rate":0.8,"qwen_dev_errors_fixed_rate":0.962,"qwen_dev_p95_ms":1827,"qwen_holdout_pass_rate":0.9048},"status":"keep","description":"TypographyRestorer: when the writer uses only “ ” / — / …, the model's ASCII stand-ins (\" -- ...) are put back, outside code and links. Apple Intelligence typography probes: 4 of 5 flattened outputs restored (replay). Corpus replay 8 fires, 0 harm; parity 0 diffs; Qwen unchanged","timestamp":1791644091246,"segment":8,"confidence":null,"asi":{"files":"new bulletproof/Engines/TypographyRestorer.swift, chained after matchApostropheStyle in cleanResponse; TypographyRestorerTests (2 tests, 6 expectations incl. ASCII writers, code spans, '---'); harness restore_typography mirror; PIPELINE.md step 7b; the 12 typography probes added to the adversarial set with correct fix/unchanged labels (101 inputs)","harm_check":"invariants hold (echo 582, idempotence 14,962). Replay over every stored user-visible output: 8 fires (s1-a30 curly quotes x4 already passing, s1-a32 em dash x4 still failing on min->minutes), 0 pass->fail. Swift/Python parity 0 differences on 3,035 pairs incl. AI's live typography outputs and 12 edge cases. Dev .9288 unchanged (Qwen keeps typography itself)","hypothesis":"Apple Intelligence flattens the writer's smart punctuation (curly double quotes -> straight, em dash -> --, ellipsis -> ...). When the original uses only the typographic form, the output's ASCII stand-ins were introduced by the model, so restore the writer's character (outside code and links)","limits":"a dash rewritten as another mark (AI s1-q06 '— but' -> '; but') isn't recovered; curly single quotes around words aren't handled; a straight quote just after a URL can be converted (link regex stops at quotes; synthetic case only)","next_action_hint":"Apple Intelligence-only gain; confirm in the next live batch (expect AI typography probes 7/12 -> 11/12)","probe_replay":"on AI's live #96 typography outputs: 4 of the 5 flattened outputs fully restored (“we’ll see”, 5 minutes — maybe 10, “Hello,” … “Where’s…”, got it… mostly); the fifth replaced the dash with a semicolon (a rewrite, not a stand-in)"}}
{"run":98,"commit":"93f0f31","metric":0.9288,"metrics":{"ai_dev_clean_preserved_rate":0.9429,"ai_dev_pass_rate":0.8102,"ai_dev_slang_kept_rate":0.9167,"ai_holdout_pass_rate":0.8,"qwen_dev_errors_fixed_rate":0.962,"qwen_dev_p95_ms":1827,"qwen_holdout_pass_rate":0.9048},"status":"keep","description":"SlangRestorer table +32 common chat/unit abbreviations (min, hr, ppl, tho, ttyl, np, jk…), restore-only. Replay: 18 fires, 13 fail→pass (AI 'talk to you later' → 'ttyl'), 0 pass→fail; every corpus occurrence is kept in its labels; parity 0 diffs; Qwen unchanged","timestamp":1791644375747,"segment":8,"confidence":5.999999999999869,"asi":{"files":"SlangRestorer table +32 entries (min, hr/hrs, approx, info, pic/pics, convo, abt, cuz, ppl, prob, tho, thru, wk/wks, yr/yrs, esp, appt, mtg, sec, np, jk, omg, ttyl, hbu, wyd, rly, sry, msgs, kk) with a restore-only comment; +1 test (3 expectations, incl. 'min' -> 'mine' left corrected); harness _SLANG mirror","harm_check":"every corpus/robustness occurrence of the candidates (min, hr, pic(s), sec, omg, lol, ttyl, k) is kept in its acceptable outputs, so the table matches the labelled policy; deliberately left out ambiguous ones (w/, k, mo, cos, def). Replay new vs old restorer over every stored user-visible output: 18 fires, 13 fail->pass (s5-075 AI 'talk to you later' -> 'ttyl', across 13 stored runs), 0 pass->fail; s1-a32/q07 AI 'min' restored (full chain also restores the em dash: 'in 5 min — maybe 10'). Invariants hold; Swift/Python parity 0 differences on 3,048 pairs. Qwen dev .9288 unchanged","hypothesis":"SlangRestorer's table lacks common chat/unit abbreviations (min, hr, ppl, tho, ttyl, np, jk...), so Apple Intelligence's expansions of them stick ('5 min' -> '5 minutes', 'ttyl' -> 'talk to you later')","next_action_hint":"Apple Intelligence-only gain (s5-075 is a corpus case: expect AI +1 in the next live batch); confirm with SWIFT_VERIFY together with #97"}}
{"run":99,"commit":"fa0fe49","metric":0.9288,"metrics":{"ai_dev_clean_preserved_rate":0.9714,"ai_dev_pass_rate":0.8136,"ai_dev_slang_kept_rate":0.9167,"ai_holdout_pass_rate":0.8,"qwen_dev_errors_fixed_rate":0.962,"qwen_dev_p95_ms":1978,"qwen_holdout_pass_rate":0.9048},"status":"keep","description":"Live verification of #97+#98: Qwen corpus byte-identical (400/400); Apple Intelligence changes only s5-075 (ttyl restored, fail→pass; AI dev .810→.814). Robustness 115: Qwen 106, AI 84; AI typography probes 7/12 → 11/12, all changes intended","timestamp":1791645381325,"segment":8,"confidence":2.9999999999999347,"asi":{"hypothesis":"live verification batch for #97 (TypographyRestorer) and #98 (abbreviation table): SWIFT_VERIFY both engines all 400, then the 115 robustness inputs (101 adversarial incl. 12 typography probes + 14 multilingual)","latency_note":"Zoom still running (GPU 79%, load ~5.5): Qwen p50 441 ms (vs 398 idle at #91), so latency is again not a clean reading, though much closer than #96's 766","next_action_hint":"loop at a natural stop; owner items. Re-measure latency once the machine is idle (BULLETPROOF_EVAL_LATENCY_AB=1 or a SWIFT_VERIFY with nothing else on the GPU)","result":"corpus: Qwen raw byte-identical to #96 on 400/400 (pass .9225 all-400, dev .9288, holdout .9048). Apple Intelligence: 399/400 identical; the one change is s5-075 'talk to you later' -> 'ttyl' (fail->pass), AI dev .8102 -> .8136, all-400 .8075 -> .81. Robustness (115): Qwen 106 (unchanged; typography 12/12), AI 84; every AI change vs #96 is intended: curly quotes restored (s1-a30, q02, q06, q09), em dash + 'min' restored (s1-a32, q07: 'in 5 min — maybe 10.'), ellipsis restored (q10), and s1-q03 went from rejected (implausibleEdit) to a correct paste because the restored dash removed the suspect '—'->'--' edit. AI typography probes 7/12 -> 11/12 (the last rewrote the dash as ';')"}}
