{"run":35,"commit":"d5bf7a6","metric":0.9085,"metrics":{"ai_dev_clean_preserved_rate":0.8571,"ai_dev_lowercase_kept_rate":0.6562,"ai_dev_pass_rate":0.6881,"ai_holdout_pass_rate":0.6952,"answered_count":7,"answered_pasted":0,"case_restyled_rate":0.0034,"clean_preserved_rate":0.9714,"code_kept_rate":0.9412,"contraction_expanded_rate":0,"dictation_prompt_chars":1445,"errors_fixed_rate":0.952,"fix_echo_rate":0.0154,"linebreaks_kept_rate":1,"lowercase_kept_rate":1,"must_preserve_kept_rate":0.9636,"outputgate_rejected_rate":0,"over_edit_rate":0.0814,"p50_ms":1317,"p95_ms":2623,"pass_rate_user_sees":0.9051,"pass_s1":1,"pass_s2":0.8983,"pass_s3":0.8983,"pass_s4":0.8136,"pass_s5":0.9322,"prompt_chars":1900,"qwen_holdout_pass_rate":0.8952,"slang_kept_rate":0.9583,"verify_rejected_rate":0.0068},"status":"keep","description":"Apple Intelligence dictation gets its own @Generable guide (DictationCorrection): AI s3 missed capitals 15→2, AI s3 pass .59→.69. Fixes the #29 bug. Qwen unchanged","timestamp":1791618802226,"segment":0,"confidence":8.776470588235286,"asi":{"ai_s3_across_runs":"missed_caps: #28 old guide 2, #29 style guide 13, #31 15, #33 dictation guide 7, #35 dictation guide 2. AI s3 pass .725/.688/.588/.637/.688","ai_typed_noise":"AI typed-slice pass .678/.700/.734/.681/.691 across runs with identical typed code, so AI noise is ~±3 pp overall and ~5-11 pp per slice","files":"AppleIntelligenceEngine: DictationCorrection @Generable with a transcript guide, isDictation from instructions, 1 new test (full suite passes). Also lands the function-wrapped .auto/measure.sh and .auto/swift_verify.sh (pgrep wait for other xcodebuilds)","hypothesis":"fix the #29 bug: Apple Intelligence dictation path uses its own @Generable DictationCorrection guide (punctuation, capitals, soundalikes, keep words) instead of the typed 'lowercase stays lowercase' guide","next_action_hint":"AI backtick loss (code_kept .53-.77) is the next AI-only target: a CodeSpanRestorer that puts back input backtick spans the model unwrapped or quoted (aligned like LineBreakRestorer). Check why AI linebreaks are .92/.50 here despite the restorer (rejected outputs? anchor misses?)","qwen":"dev .9085, holdout .8952 (unchanged)"}}
{"run":36,"commit":"e715808","metric":0.9119,"metrics":{"ai_dev_clean_preserved_rate":0.8571,"ai_dev_lowercase_kept_rate":0.6562,"ai_dev_pass_rate":0.6915,"ai_holdout_pass_rate":0.6952,"answered_count":7,"answered_pasted":0,"case_restyled_rate":0.0034,"clean_preserved_rate":0.9714,"code_kept_rate":1,"contraction_expanded_rate":0,"dictation_prompt_chars":1445,"errors_fixed_rate":0.952,"fix_echo_rate":0.0154,"linebreaks_kept_rate":1,"lowercase_kept_rate":1,"must_preserve_kept_rate":0.9818,"outputgate_rejected_rate":0,"over_edit_rate":0.0814,"p50_ms":833,"p95_ms":1819,"pass_rate_user_sees":0.9085,"pass_s1":1,"pass_s2":0.8983,"pass_s3":0.8983,"pass_s4":0.8136,"pass_s5":0.9492,"prompt_chars":1900,"qwen_holdout_pass_rate":0.8952,"slang_kept_rate":0.9583,"verify_rejected_rate":0.0068},"status":"keep","description":"LineBreakRestorer v2 (symmetric): restore shrunk blank lines and remove breaks the model added between aligned words. Over 4,800 stored outputs: fires 22, 14 fail→pass, 0 pass→fail. Qwen unchanged","timestamp":1791619044984,"segment":0,"confidence":8.776470588235286,"asi":{"diagnosis_of_remaining_ai_linebreak_losses":"#35 AI: s4-001 shrank '\\n\\n' to '\\n' (v1 skipped gaps that already had any newline), s4-003 *added* a newline mid-paragraph, so the structure gate rejected it, and s4-004 dropped the sign-off (content loss, not restorable)","files":"LineBreakRestorer.swift v2 (+2 tests: added/shrunk breaks; full suite passes), harness mirror (7/7 cases agree)","harm_check":"replay over all 4,800 stored outputs (12 runs, both engines): fired 22, fail->pass 14, pass->fail 0","hypothesis":"LineBreakRestorer v2, symmetric: between words aligned on both sides, give the gap the original's break count (restores shrunk '\\n\\n' and removes model-added breaks); keep the next-word anchor for lost breaks near rewritten words","next_action_hint":"CodeSpanRestorer for AI backticks (code_kept .53-.77); replay-measurable the same way","result":"replay on #35 outputs: fired 2/800 (both AI): s4-001 fail->pass, s4-003 no longer rejected by introducedStructure. AI linebreaks .87->.93. Qwen .9119 unchanged (fires on 0 Qwen dev rows)"}}
{"run":37,"commit":"598b419","metric":0.9119,"metrics":{"ai_dev_clean_preserved_rate":0.8571,"ai_dev_lowercase_kept_rate":0.6562,"ai_dev_pass_rate":0.7051,"ai_holdout_pass_rate":0.7048,"answered_count":7,"answered_pasted":0,"case_restyled_rate":0.0034,"clean_preserved_rate":0.9714,"code_kept_rate":1,"contraction_expanded_rate":0,"dictation_prompt_chars":1445,"errors_fixed_rate":0.952,"fix_echo_rate":0.0154,"linebreaks_kept_rate":1,"lowercase_kept_rate":1,"must_preserve_kept_rate":0.9818,"outputgate_rejected_rate":0,"over_edit_rate":0.0814,"p50_ms":833,"p95_ms":1819,"pass_rate_user_sees":0.9085,"pass_s1":1,"pass_s2":0.8983,"pass_s3":0.8983,"pass_s4":0.8136,"pass_s5":0.9492,"prompt_chars":1900,"qwen_holdout_pass_rate":0.8952,"slang_kept_rate":0.9583,"verify_rejected_rate":0.0068},"status":"keep","description":"CodeSpanRestorer in cleanResponse: put back backticked code the model unwrapped, quoted or edited. Over 4,800 stored outputs: fires 50, 38 fail→pass, 0 pass→fail. AI code kept .53→1.0 (replay)","timestamp":1791619218929,"segment":0,"confidence":8.80235988200589,"asi":{"files":"bulletproof/Engines/CodeSpanRestorer.swift (new), chained last in ProofreadPrompt.cleanResponse, CodeSpanRestorerTests (6 tests; full suite passes), harness mirror restore_code_spans (6/6 cases agree, also applied on cache hits)","harm_check":"replay over all 4,800 stored outputs (12 runs, both engines): fired 50, fail->pass 38, pass->fail 0","hypothesis":"CodeSpanRestorer in cleanResponse: backticked code is never proofread. Same span count: restore each span's content in order. Otherwise, per missing span: quoted copy -> backticks, else the first bare whole-word copy outside code gets re-wrapped","next_action_hint":"SWIFT_VERIFY (the .auto scripts are committed and unedited) to confirm the full AI stack live. Remaining AI gaps: lowercase .56-.75, slang .56-.78 (it still capitalizes/expands some casual text); content drops (s4-004 sign-off)","result":"replay on #35 outputs: AI code_kept .53->1.0, AI pass .690->.705, AI s5 .54->.60, must_preserve +.105; Qwen (Swift) code_kept .96->1.0 (s5-055 --output<path> fixed). Python Qwen dev .9119 unchanged (its s5-055 output was already right)"}}
{"run":38,"commit":"9c4a03b","metric":0.9119,"metrics":{"ai_dev_clean_preserved_rate":0.8857,"ai_dev_lowercase_kept_rate":0.7188,"ai_dev_pass_rate":0.7017,"ai_holdout_pass_rate":0.7429,"answered_count":7,"answered_pasted":0,"case_restyled_rate":0.0034,"clean_preserved_rate":0.9714,"code_kept_rate":1,"contraction_expanded_rate":0,"dictation_prompt_chars":1445,"errors_fixed_rate":0.952,"fix_echo_rate":0.0154,"linebreaks_kept_rate":1,"lowercase_kept_rate":1,"must_preserve_kept_rate":0.9818,"outputgate_rejected_rate":0,"over_edit_rate":0.0814,"p50_ms":1309,"p95_ms":2639,"pass_rate_user_sees":0.9085,"pass_s1":1,"pass_s2":0.8983,"pass_s3":0.8983,"pass_s4":0.8136,"pass_s5":0.9492,"prompt_chars":1900,"qwen_holdout_pass_rate":0.8952,"slang_kept_rate":0.9583,"verify_rejected_rate":0.0068},"status":"keep","description":"Live verification of the full stack (Swift, both engines, 400): Qwen .73→.905, Apple Intelligence .63→.71 against the original baseline. AI code kept 1.0, lowercase .71, line breaks .87. Qwen Swift = Python (.912 dev)","timestamp":1791620312183,"segment":0,"confidence":10.970588235294072,"asi":{"ai_all400_vs_original_baseline":"pass .6275->.7125 (+8.5pp), s5 .375->.625, s1 +10, s4 +7.5, s2 +6, s3 .66->.60 (within AI run noise: #35 had s3 .69), errors_fixed +.035, lowercase .32->.71, slang .42->.67, code .54->1.0, must_preserve .59->.87, linebreaks .67->.87, rejected 4.75%->1%","hypothesis":"live end-to-end verification of the full stack (prompts + ContractionRestorer + LineBreakRestorer v2 + CodeSpanRestorer + introducedStructure + AI dictation guide), Swift, both engines, 400 cases","next_action_hint":"AI content drops (s4-004 deletes the sign-off). A 'droppedContent' gate (output loses a whole line or sentence of the input) would block silent deletions; measure false positives over the 4,800 stored outputs first. Separately, the AI casual-style gap (lowercase .71, slang .67) is the last big AI style gap","qwen_all400_vs_original_baseline":"pass .73->.905, s5 .39->.94, lowercase .07->1.0, slang .21->.97, code .96->1.0, must_preserve .61->.99, clean .76->.96, rejected 4.25%->1%. Qwen Swift dev .9119 now equals Python (the CodeSpanRestorer fixed the s5-055 runtime diff)","remaining_ai_linebreak_losses":"s4-004 (AI deleted the 'Kind regards, Sofia' sign-off), s4-044 (AI dropped lines)"}}
{"run":39,"commit":"3ec14dc","metric":0.9119,"metrics":{"ai_dev_clean_preserved_rate":0.8857,"ai_dev_lowercase_kept_rate":0.7188,"ai_dev_pass_rate":0.7017,"ai_holdout_pass_rate":0.7429,"answered_count":7,"answered_pasted":0,"case_restyled_rate":0.0034,"clean_preserved_rate":0.9714,"code_kept_rate":1,"contraction_expanded_rate":0,"dictation_prompt_chars":1445,"errors_fixed_rate":0.952,"fix_echo_rate":0.0154,"linebreaks_kept_rate":1,"lowercase_kept_rate":1,"must_preserve_kept_rate":0.9818,"outputgate_rejected_rate":0,"over_edit_rate":0.0814,"p50_ms":833,"p95_ms":1819,"pass_rate_user_sees":0.9085,"pass_s1":1,"pass_s2":0.8983,"pass_s3":0.8983,"pass_s4":0.8136,"pass_s5":0.9492,"prompt_chars":1900,"qwen_holdout_pass_rate":0.8952,"slang_kept_rate":0.9583,"verify_rejected_rate":0.0068},"status":"keep","description":"OutputGate droppedContent: reject output that loses a sentence or sign-off line. 26 flags in 5,600 stored outputs, all on failing rows, 0 false positives. Qwen unchanged .912","timestamp":1791620569811,"segment":0,"confidence":12.53781512605028,"asi":{"caught_examples":"AI s4-004 deleted 'Kind regards,\\nSofia'; AI s4-001 deleted 'Best,'; Qwen s4-038 dropped a whole sentence; translations (s5-068 both engines); the s3-079 few-shot leak","false_positive_check":"replay over 5,600 stored outputs (both engines, all runs): flags 26, all on failing rows, 0 on passing rows","files":"OutputGate.Rejection.droppedContent + dropsContent (Swift), user message in ProofreadingEngine.swift, 2 OutputGateTests (full suite passes, incl. 'u ok?' -> 'Are you okay?' still accepted), harness output_gate mirror (4/4 cases agree)","hypothesis":"OutputGate droppedContent: reject when any sentence of 4+ words keeps fewer than half its words, or in multi-line text a short line (sign-off, name) vanishes entirely. Silent deletion is the worst muddle, and no other gate saw it","keep_rationale":"safety gate with zero false positives in 5,600 historical outputs; Qwen dev primary unchanged by construction. Rejection means nothing is pasted (typed path) or the raw transcript is pasted (dictation), both better than losing the user's words","next_action_hint":"remaining AI gap: casual restyling (lowercase .71, slang .67). Consider a deterministic casing transfer for typed text whose first letter is lowercase and has no other capitals (AI-only issue; Qwen is already at 1.0); measure by replay plus the 0-pass->fail harm check","result":"Qwen dev pass .9119 unchanged, outputgate_rejected 0 on dev"}}
{"run":40,"commit":"8605d26","metric":0.9119,"metrics":{"ai_dev_clean_preserved_rate":0.8857,"ai_dev_lowercase_kept_rate":1,"ai_dev_pass_rate":0.7254,"ai_holdout_pass_rate":0.7619,"answered_count":7,"answered_pasted":0,"case_restyled_rate":0.0034,"clean_preserved_rate":0.9714,"code_kept_rate":1,"contraction_expanded_rate":0,"dictation_prompt_chars":1445,"errors_fixed_rate":0.952,"fix_echo_rate":0.0154,"linebreaks_kept_rate":1,"lowercase_kept_rate":1,"must_preserve_kept_rate":0.9818,"outputgate_rejected_rate":0,"over_edit_rate":0.0814,"p50_ms":833,"p95_ms":1819,"pass_rate_user_sees":0.9085,"pass_s1":1,"pass_s2":0.8983,"pass_s3":0.8983,"pass_s4":0.8136,"pass_s5":0.9492,"prompt_chars":1900,"qwen_holdout_pass_rate":0.8952,"slang_kept_rate":0.9583,"verify_rejected_rate":0.0068},"status":"keep","description":"Typed path keeps all-lowercase writing lowercase (cleanResponse keepsLowercase). Over 4,480 stored typed outputs: fires 251, 128 fail→pass, 0 pass→fail. AI lowercase .71→1.0, AI s5 .63→.74 (replay). Qwen unchanged","timestamp":1791620761729,"segment":0,"confidence":14.627450980392016,"asi":{"files":"ProofreadPrompt.cleanResponse(keepsLowercase:) + keepAllLowercase, LocalModelEngine passes instructions != dictationInstructions, AppleIntelligenceEngine passes !isDictation, 2 ProofreadPromptTests (full suite passes), harness post_process(typed) mirror, also on cache hits","harm_check":"replay over 4,480 stored typed outputs (all runs, both engines, s3 excluded): fired 251, fail->pass 128, pass->fail 0. Corpus check: 0 of 50 all-lowercase typed inputs want capitals","hypothesis":"typed path only: if the input has no uppercase letters at all, lowercase the output (a writer who uses no capitals gets none back). This enforces the user's keep-my-style policy in code for the model that ignores it (Apple Intelligence)","limitation":"inputs with any capital (e.g. 'hey could you reveiw my PR') aren't covered; per-word casing transfer for those would need alignment, and proper-noun fixes make it riskier","next_action_hint":"remaining AI casual gap: slang expansion (.76) and casing in mixed-case casual inputs. Next candidates: per-word casing restore for words aligned to an all-lowercase input word when the input starts lowercase; or stop and write the final report","result":"replay on #38 outputs: AI pass .7125->.735, AI s5 .625->.7375, AI lowercase_kept .71->1.0, slang .67->.76. Qwen dev .9119 unchanged (already 1.0 lowercase)"}}
{"run":41,"commit":"9e1bd35","metric":0.9119,"metrics":{"ai_dev_clean_preserved_rate":0.8857,"ai_dev_lowercase_kept_rate":1,"ai_dev_pass_rate":0.7288,"ai_holdout_pass_rate":0.7619,"answered_count":7,"answered_pasted":0,"case_restyled_rate":0.0034,"clean_preserved_rate":0.9714,"code_kept_rate":1,"contraction_expanded_rate":0,"dictation_prompt_chars":1445,"errors_fixed_rate":0.952,"fix_echo_rate":0.0154,"linebreaks_kept_rate":1,"lowercase_kept_rate":1,"must_preserve_kept_rate":0.9818,"outputgate_rejected_rate":0,"over_edit_rate":0.0814,"p50_ms":833,"p95_ms":1819,"pass_rate_user_sees":0.9085,"pass_s1":1,"pass_s2":0.8983,"pass_s3":0.8983,"pass_s4":0.8136,"pass_s5":0.9492,"prompt_chars":1900,"qwen_holdout_pass_rate":0.8952,"slang_kept_rate":0.9583,"verify_rejected_rate":0.0068},"status":"keep","description":"ApostropheFixer: fix unambiguous missing-apostrophe contractions (Im, dont, wasnt…) the model left, outside code. Over 5,600 stored outputs: fires 10, 5 fail→pass, 0 pass→fail. AI pass +.005 (replay). Qwen unchanged","timestamp":1791620970361,"segment":0,"confidence":14.627450980392016,"asi":{"analysis_first":"remaining AI typed failures after #40 (replay): unfixed 49, slang 8, contraction 4, rejected 4, extra 4. Under-correction dominates and is mostly a model limit (typed unfixed errors 52-74 across AI runs with no trend, so the #29 guide didn't cause it)","files":"bulletproof/Engines/ApostropheFixer.swift (new; skips code spans, identifiers, #/@ tags), chained after CodeSpanRestorer and before keepAllLowercase, 4 tests (full suite passes), harness fix_apostrophes mirror (6/6 cases agree)","harm_check":"replay over 5,600 stored outputs: fired 10, fail->pass 5, pass->fail 0","hypothesis":"ApostropheFixer: deterministically fix missing apostrophes in contractions that can't be real words (Im, Ive, dont, wasnt, thats...; never cant/wont/were/well/ill/its/lets), both paths, outside code. AI leaves 'Im'/'Ive' unfixed","next_action_hint":"returns are now small (5/5,600). Remaining AI gaps: grammar recall (model limit), slang expansion (8). The project is at a natural stopping point: write the final report, delete /tmp/models, and do the db65f20 history rewrite before pushing","result":"replay on #38 AI outputs: pass .735->.740, s1 +2.5pp, errors_fixed +.006; Qwen .9119 unchanged","simplicity_note":"small gain (2 AI cases on 400) for ~60 lines; kept because it's exact, harmless and principled. Fine to drop if simplicity is preferred"}}
{"run":42,"commit":"7a97409","metric":0.9119,"metrics":{"ai_dev_clean_preserved_rate":0.8571,"ai_dev_lowercase_kept_rate":1,"ai_dev_pass_rate":0.7525,"ai_holdout_pass_rate":0.7524,"answered_count":7,"answered_pasted":0,"case_restyled_rate":0.0034,"clean_preserved_rate":0.9714,"code_kept_rate":1,"contraction_expanded_rate":0,"dictation_prompt_chars":1445,"errors_fixed_rate":0.952,"fix_echo_rate":0.0154,"linebreaks_kept_rate":1,"lowercase_kept_rate":1,"must_preserve_kept_rate":0.9818,"outputgate_rejected_rate":0,"over_edit_rate":0.0814,"p50_ms":1306,"p95_ms":2660,"pass_rate_user_sees":0.9085,"pass_s1":1,"pass_s2":0.8983,"pass_s3":0.8983,"pass_s4":0.8136,"pass_s5":0.9492,"prompt_chars":1900,"qwen_holdout_pass_rate":0.8952,"slang_kept_rate":0.9583,"verify_rejected_rate":0.0068},"status":"keep","description":"Final live verification (Swift, both engines, 400): Qwen .73→.905, Apple Intelligence .63→.75 vs the original baseline. Both engines keep lowercase, code and line breaks at 1.0. AI dev = holdout = .75","timestamp":1791622075324,"segment":0,"confidence":14.627450980392016,"asi":{"ai_all400_vs_original_baseline":"pass .6275->.75 (+12.3pp; replay predicted ~.74), s5 .375->.70, s3 .66->.70 (dictation guide fix confirmed live), lowercase .32->1.0, slang .42->.76, code .54->1.0, must_preserve .59->.91, line breaks .67->1.0, case_restyled .07->0, rejected 4.75%->1.5%, errors_fixed .826->.862. AI dev .7525 and holdout .7524 agree","hypothesis":"final live verification of the full stack after #39-#41 (droppedContent gate, all-lowercase keep, ApostropheFixer), Swift, both engines, 400 cases","latency":"Swift Qwen p50/p95 1306/2601 vs 680/1836 in the original baseline run; Swift latency varies ~±40% (the same old prompt measured 947/3081 once), so an idle-machine A/B is needed before shipping","next_action_hint":"stop the loop and write the final report. Owner actions: rewrite db65f20 before pushing (real-usage.md), delete /tmp/models (7.5 GB), latency A/B, decide on #25's closing reminder (injection vs -0.5pp)","qwen_all400_vs_original_baseline":"pass .73->.905, s5 .39->.94, lowercase .07->1.0, slang .21->.97, clean .76->.96, must_preserve .61->.99, rejected 4.25%->1%. Dev .9119 / holdout .8952, identical to Python"}}
{"run":43,"commit":"7a97409","metric":0.9085,"metrics":{"ai_dev_clean_preserved_rate":0.8571,"ai_dev_lowercase_kept_rate":1,"ai_dev_pass_rate":0.7525,"ai_holdout_pass_rate":0.7524,"answered_count":7,"answered_pasted":0,"case_restyled_rate":0.0034,"clean_preserved_rate":0.9714,"code_kept_rate":1,"contraction_expanded_rate":0,"dictation_prompt_chars":1445,"errors_fixed_rate":0.948,"fix_echo_rate":0.0231,"linebreaks_kept_rate":1,"lowercase_kept_rate":1,"must_preserve_kept_rate":0.9818,"outputgate_rejected_rate":0,"over_edit_rate":0.0847,"p50_ms":873,"p95_ms":1967,"pass_rate_user_sees":0.9051,"pass_s1":1,"pass_s2":0.8814,"pass_s3":0.8983,"pass_s4":0.8136,"pass_s5":0.9492,"prompt_chars":1795,"qwen_holdout_pass_rate":0.8952,"slang_kept_rate":0.9583,"verify_rejected_rate":0.0068},"status":"discard","description":"Retry of #19 (drop the backtick example, now redundant with CodeSpanRestorer): pass .9085 (-1 case, s2), errors_fixed back to .948. Not worth a ~5% prefill saving","timestamp":1791622199155,"segment":0,"confidence":17.55294117647046,"asi":{"hypothesis":"retry of #19 with a changed assumption: CodeSpanRestorer (#37) now guarantees backticked code, so the backtick few-shot example is redundant; and errors_fixed had +.004 margin after #39-#41. Shorter prompt (-105 chars, ~35 tokens, ~5% of prefill)","insight":"the backtick example also contributes to grammar recall (s2-1). Every typed-prompt edit near this optimum costs about 1 case, which confirms the #16-#19 fragility finding. The prompt is done","next_action_hint":"the loop is concluded (see RESULTS.md). Further gains need a stronger model or human-judged data. Remaining items are owner actions: history rewrite, latency A/B, the #25 decision, /tmp/models cleanup","result":"pass .9085 (-1: s2), errors_fixed .952->.948 (at the floor), code_kept 1.0 (restorer holds), prompt 1795 chars","revisits_run":19,"rollback_reason":"primary -1 case for a ~5% prefill saving"}}
{"type":"config","name":"Generalization check: fresh 35-case set (written after tuning), current chain (baseline chain: 0.714)","metricName":"pass_rate","metricUnit":"","bestDirection":"higher"}
