{"run":110,"commit":"b446540","metric":0.9288,"metrics":{"ai_dev_clean_preserved_rate":0.9714,"ai_dev_pass_rate":0.8136,"ai_dev_slang_kept_rate":0.9167,"ai_holdout_pass_rate":0.8,"qwen_dev_errors_fixed_rate":0.962,"qwen_dev_p95_ms":1871,"qwen_holdout_pass_rate":0.9048},"status":"keep","description":"Live verification of #107-#109: corpus output byte-identical to #104 (400/400, both engines). Robustness 135: Qwen 126 (round 4 19/20), AI 100; intended changes only (3:30pm kept on both engines; Qwen's runaway emoji echo now rejected, not pasted)","timestamp":1791649675373,"segment":8,"confidence":null,"asi":{"ai_round4":"Apple Intelligence round 4: 14/20. It expands units ('5kg' -> '5 kilograms', '10GB' -> '10 gigabytes'), misses 'its', and 3 rows are gate-rejected (€12,50 droppedContent; the email quote and the iPhone signature lowOverlap). Unit expansion is a SlangRestorer-style candidate, but '5kg' is one token while the expansion is two, so restoredPiece would produce '5 kg' (needs the typed token's own form, not typedLetters)","hypothesis":"live verification batch for #107 (appendedContent), #108 (chat mentions / letter-digit identifiers), #109 (time format): SWIFT_VERIFY both engines all 400, then 135 robustness inputs (121 adversarial incl. round 4 + 14 multilingual) and fresh set 2","latency":"Qwen p50 406 ms, AI 703 ms (GPU 82% busy from other apps; matches the idle baseline within noise)","next_action_hint":"optional: unit-abbreviation restore that keeps the typed token's exact form (5kg, 10GB) for AI. Otherwise nothing pending live","result":"corpus: raw and user-visible output byte-identical to #104 on 400/400 for both engines (no corpus case touched, as replay predicted; AI s5-024's current greedy output has no respaced time). Robustness (135): Qwen 126 (round 4: 19/20; the only failure is the model missing 'its'), AI 100 (round 4: 14/20). Changes vs #104 are exactly the intended ones: s1-a24 '3:30 pm'/'3:30 PM' -> '3:30pm' on both engines (fail->pass); Qwen's 300-emoji continuation s1-t05 now rejected (appendedContent) instead of pasted 2.3x long. Fresh set 2 unchanged (Qwen 26/30, AI 25/30)"}}
{"run":111,"commit":"00a3271","metric":0.9288,"metrics":{"ai_dev_clean_preserved_rate":0.9714,"ai_dev_pass_rate":0.8136,"ai_dev_slang_kept_rate":0.9167,"ai_holdout_pass_rate":0.8,"qwen_dev_errors_fixed_rate":0.962,"qwen_dev_p95_ms":1827,"qwen_holdout_pass_rate":0.9048},"status":"keep","description":"Keep the writer's units: '5kg' / '10GB' / '300 MB' come back as typed when the model spells them out ('5 kilograms'), same number only. Replay: 1 fire (AI s1-d10 fail→pass), 0 harm; every labelled unit is kept; parity 0 diffs","timestamp":1791649914853,"segment":8,"confidence":null,"asi":{"files":"TypographyRestorer.restoreUnits (unit-symbol table: mass, length, volume, data, frequency; measurement regex keeps the typed number exactly), chained after restoreTimes; +1 test (4 expectations incl. a different number and a different unit left alone); harness restore_units mirror; PIPELINE.md step 7b","harm_check":"every labelled number+unit in all sets is kept (6 occurrences: 300 MB, 150 MB, 200 kg, 5kg, 10GB). Replay over every stored user-visible output: fires once (s1-d10 AI, fail->pass), 0 pass->fail. Invariants hold; Swift/Python parity 0 differences on 3,331 pairs incl. 16 unit edge cases (2.5GHz, 12oz, 3 lbs, decimal comma 1,5kg, '5 people' untouched). Dev .9288 unchanged","hypothesis":"the writer's number + unit symbol ('5kg', '10GB', '300 MB') is style, but Apple Intelligence spells units out ('5 kilograms', '10 gigabytes'); when the output has the same number followed by one of that unit's names, put the typed form back (restore-only)","next_action_hint":"AI round-4 leftovers are gate rejections (€12,50, email quote, iPhone signature) and 'its'; small value left. Loop is effectively complete pending real-usage data","scope":"only unit symbols directly after a number; 'm' and 'k' are deliberately excluded (ambiguous: meters/minutes/million, thousand)"}}
{"run":112,"commit":"4c7e1a9","metric":0.9288,"metrics":{"ai_dev_clean_preserved_rate":0.9714,"ai_dev_pass_rate":0.8136,"ai_dev_slang_kept_rate":0.9167,"ai_holdout_pass_rate":0.8,"qwen_dev_errors_fixed_rate":0.962,"qwen_dev_p95_ms":1827,"qwen_holdout_pass_rate":0.9048},"status":"keep","description":"Adversarial round 5 (20 inputs): Qwen respelled a schemeless link ('exmaple.org/faq' → 'example.org/faq') and split ':P' into ': P'. LinkRestorer now protects schemeless domains; TypographyRestorer restores split emoticons. 17/20 → 19/20; full-chain replay over 18,832 stored outputs unchanged; parity 0 diffs","timestamp":1791650408725,"segment":8,"confidence":null,"asi":{"files":"LinkRestorer: schemeless-domain literal (www., common TLD list, or domain.tld followed by a path); TypographyRestorer.restoreEmoticons (emoticon regex; a typed emoticon missing from the output is restored over the same characters with spaces inserted, re-separated from a word the model glued it to); +2 tests (LinkRestorer: domain + abbreviations/'St.' not domains; Typography: ':P', ':-)', untouched ':)'); harness mirrors; PIPELINE.md steps 6, 7b; round 5 appended to the adversarial set (141 inputs)","harm_check":"no labelled output in any set changes a schemeless domain or emoticon (the only emoticon, s5-a08 ':)', is kept). Full-chain replay new vs committed over all 18,832 stored user-visible outputs: no change. Invariants hold (614 inputs, 17,362 outputs); Swift/Python parity 0 differences on 3,355 pairs incl. round 5 and 20 edge cases ('e.g.', 'etc.', 'St.', 'end.Next', config.yaml, 8))","hypothesis":"adversarial round 5 (20 inputs: schemeless URLs, @handles with underscores, emoticons, camelCase hashtags, w/ b/c w/o, e.g./i.e./etc./vs., fractions, $5k, names with apostrophes/accents/hyphens, an address, a commit message, YAML/JSON/SQL in prose, a footnote, >> quoting, Step lists): schemeless links are literals like full URLs, and emoticons are the writer's text","next_action_hint":"round 5 leftover is model-level style (Apt -> Apt.). Probing keeps finding ~1-2 Qwen issues per round, all small; a live verification of #111-#112 can go with the next batch","result":"round 5 through the Qwen chain: 17/20 before. Real bugs: s5-e01 a schemeless link respelled ('exmaple.org/faq' -> 'example.org/faq', so the link points elsewhere); s5-e20 ':P' split into ': P' (the emoticon read as a colon and a letter). Both fixed: 19/20. Left: s1-e11 'Apt 4B' -> 'Apt. 4B' (model style edit in an address)"}}
{"run":113,"commit":"43d5f64","metric":0.9288,"metrics":{"ai_dev_clean_preserved_rate":0.9714,"ai_dev_pass_rate":0.8136,"ai_dev_slang_kept_rate":0.9167,"ai_holdout_pass_rate":0.8,"qwen_dev_errors_fixed_rate":0.962,"qwen_dev_p95_ms":1827,"qwen_holdout_pass_rate":0.9048},"status":"keep","description":"Adversarial round 6, the dictation path (never probed before): 20 transcript inputs. Qwen 18/20, AI 16/20 in the app; no chain bug. Failures are model-level (Qwen 'no' → 'not'; AI drops 'uh') or the gate keeping the raw transcript (spoken email). Owner question noted: convert spoken emails?","timestamp":1791650589462,"segment":8,"confidence":null,"asi":{"failures":"Qwen: s3-h03 'tuesday no wednesday' -> 'Tuesday, not Wednesday' (meaning flipped: a model misread, no deterministic signal); s3-h05 spoken email -> 'jane@example.com' rejected by droppedContent (the raw transcript is kept). AI: s3-h01 dropped the filler 'uh' (rewording), s3-h03 left 'Lets' (a real word, so ApostropheFixer rightly skips it), s3-h05 half-converted email, s3-h10 'well send' left without an apostrophe ('well' is a real word)","hypothesis":"adversarial round 6 on the dictation path (never probed: every earlier round was typed): 20 transcript-style inputs (fillers, repeated words, self-corrections, spoken numbers/money/email/times, names, acronyms, i-contractions, questions, run-ons, a short 'ok', a punctuated control, wifi/iPhone casing)","next_action_hint":"spoken email/URL conversion is an owner product decision (ideas.md). The dictation path is otherwise clean; no further deterministic work found","product_question":"spoken email forms: users likely want 'jane@example.com', but the dictation prompt says to keep the speaker's words; recorded in ideas.md with a deterministic design if wanted","result":"no chain bug found on the dictation path: Qwen 18/20 in the app (Swift = Python on 19/20, the 1 difference is runtime noise), Apple Intelligence 16/20. Sentence casing, the pronoun 'I', contractions (I'm, I'll, let's, we'll, it's), soundalikes (by -> buy, their -> they're), names, places, NASA and iPhone casing, run-on punctuation and the punctuated control all came through correctly"}}
{"run":114,"commit":"3366512","metric":0.9288,"metrics":{"ai_dev_clean_preserved_rate":0.9714,"ai_dev_pass_rate":0.8136,"ai_dev_slang_kept_rate":0.9167,"ai_holdout_pass_rate":0.8,"qwen_dev_errors_fixed_rate":0.962,"qwen_dev_p95_ms":1840,"qwen_holdout_pass_rate":0.9048},"status":"keep","description":"Live verification of #111-#113: corpus output byte-identical to #110 (400/400, both engines). Robustness 175: Qwen 163 (round 5 19/20, dictation 18/20), AI 132; only intended change on shared inputs (AI '5 kilograms' → '5kg'). Latency at baseline","timestamp":1791651622317,"segment":8,"confidence":null,"asi":{"hypothesis":"live verification batch for #111 (units), #112 (schemeless domains, split emoticons) and #113's dictation round, both engines: SWIFT_VERIFY all 400, then 175 robustness inputs (161 adversarial incl. rounds 4-6 + 14 multilingual) and fresh set 2","latency":"Qwen p50 400 ms, AI 708 ms (= the idle baseline)","next_action_hint":"nothing pending live. Remaining work is owner decisions (Qwen default, spoken-email conversion, #25 reminder) and real-usage telemetry from the current build","result":"corpus: raw and user-visible output byte-identical to #110 on 400/400 for both engines. Robustness 175: Qwen 163 (round 5 19/20 in the app, matching the Python run; dictation round 6 18/20), Apple Intelligence 132 (round 5 15/20, dictation 16/20). The only change on inputs shared with #110 is the intended one: AI s1-d10 '5 kilograms ... 10 gigabytes' -> '5kg ... 10GB' (fail->pass). Fresh set 2 unchanged (Qwen 26/30, AI 25/30)"}}
{"run":115,"commit":"3a5960b","metric":0.9288,"metrics":{"ai_dev_clean_preserved_rate":0.9714,"ai_dev_pass_rate":0.8136,"ai_dev_slang_kept_rate":0.9167,"ai_holdout_pass_rate":0.8,"qwen_dev_errors_fixed_rate":0.962,"qwen_dev_p95_ms":1827,"qwen_holdout_pass_rate":0.9048},"status":"keep","description":"Docs: RESULTS.md brought up to date with #106-#114 (latest live run, robustness 175: Qwen 163 vs AI 132, dictation round, bugs #107-#112, real-usage section, owner decision on dictated emails). No code change","timestamp":1791651706419,"segment":8,"confidence":null,"asi":{"files":"RESULTS.md: latest live run #114; beyond-corpus table (fresh 1/2, robustness 163/175 vs 132/175, typography, dictation round); bug list extended with #107-#112; real-usage section (#106); owner decision on dictated emails (#113); Qwen-default rationale with #114 numbers; 114 experiments. PIPELINE.md was already current per iteration","hypothesis":"housekeeping: RESULTS.md predated #106-#114 (appendedContent gate, mention/identifier literals, time/unit/emoticon restore, schemeless domains, dictation probing, real-usage probe)","next_action_hint":"docs current; nothing pending live. Further probing rounds are cheap if wanted; otherwise owner decisions and real-usage data"}}
{"run":116,"commit":"cb073c9","metric":0.9288,"metrics":{"ai_dev_clean_preserved_rate":0.9714,"ai_dev_pass_rate":0.8136,"ai_dev_slang_kept_rate":0.9167,"ai_holdout_pass_rate":0.8,"qwen_dev_errors_fixed_rate":0.962,"qwen_dev_p95_ms":1827,"qwen_holdout_pass_rate":0.9048},"status":"keep","description":"Adversarial round 7, partial selections: a model-added closing paren/quote on a fragment ('(see the attached file' → '…file)') is now removed. 18/20 → 19/20. The first version also stripped {} and let a guard JSON answer through (answered_pasted 0→1); caught by the metric and restricted to () and quotes","timestamp":1791652299633,"segment":8,"confidence":null,"asi":{"caught_regression":"first version also stripped edge [] and {}; the measurement showed answered_pasted 0 -> 1: guard g-13 ('Convert this to JSON…') had its outer braces removed, so introducedStructure no longer saw the JSON and the answer was pasted. Fixed by restricting to () and quotes ([] and {} are introducedStructure's signal); g-13 is rejected again, answered_pasted back to 0. Lesson: a restorer must never remove what a later gate keys on","files":"TypographyRestorer.restoreEdgeBrackets (first step of restore; () and straight/curly double quotes only; removes one model-added edge mark when the original lacked it and it's exactly one extra); +1 test (6 expectations incl. writer-closed brackets and the JSON-answer case); harness restore_edge_brackets mirror; PIPELINE.md 7b; round 7 appended to the adversarial set (181 inputs); ideas.md: cut-off edge words via AX context","harm_check":"0 labelled outputs add an edge bracket/quote; full-chain replay new vs committed over 20,010 stored user-visible outputs: no change; invariants hold (674 inputs, 18,162 outputs); Swift/Python parity 0 differences on 3,539 pairs; guard answered_pasted 0, dev .9288 unchanged","hypothesis":"adversarial round 7, partial selections (the hotkey proofreads whatever is highlighted: mid-word starts and ends, mid-sentence fragments, trailing newlines from triple-click, single words, one list item, a greeting line, an unclosed parenthesis or quote): a bracket or quote the model adds at the edge to 'close' a fragment gets pasted into the middle of the writer's text","next_action_hint":"cut-off edge words need app context (AX character after the selection), noted in ideas.md. Otherwise owner items","result":"round 7 through the Qwen chain: 18/20 before. Fragments are handled well (no added capital or period on 'ing the report…', 'and then we…'; single words fixed; trailing newlines kept). Bugs: s1-p12 '(see the attached file' -> '…file)' (an added closing paren pasted mid-text; fixed); s1-p14 a cut-off last word completed ('notic' -> 'noticed'), which text alone can't tell from a typo (ideas.md). After: 19/20"}}
{"run":117,"commit":"e90a878","metric":0.9288,"metrics":{"ai_dev_clean_preserved_rate":0.9714,"ai_dev_pass_rate":0.8136,"ai_dev_slang_kept_rate":0.9167,"ai_holdout_pass_rate":0.8,"qwen_dev_errors_fixed_rate":0.962,"qwen_dev_p95_ms":1827,"qwen_holdout_pass_rate":0.9048},"status":"keep","description":"Guardrails from #116's lesson: invariants.py gains 'blocked answers stay blocked' (258 stored + synthetic guard answers must stay gate-rejected after the full chain; re-introducing #116's bug now fails with 23 laundered), and checks.sh requires answered_pasted == 0. No app change","timestamp":1791652639542,"segment":8,"confidence":null,"asi":{"design_note":"the first version also took corpus outputs and flagged 1 'laundered' row: an AI correction where the model had added a sentence break and LineBreakRestorer removed it. That's the intended rescue, not an answer, so the invariant is restricted to guard-set (instruction lookalike) inputs and synthetic answer shapes","files":"harness/invariants.py: invariant 3 'blocked answers stay blocked' (258 gate-rejected guard generations from every prompt cache + 8 synthetic answer shapes x 14 guard inputs: JSON, bullet/numbered lists, 'Sure! Here is', appended reply, JSON array, HTML list, code fence); echo invariant now also covers restore_typography and match_apostrophe_style. .auto/checks.sh: answered_pasted must be 0. PIPELINE.md §7","hypothesis":"#116 showed a restorer can strip what a later gate keys on and launder a model answer into the user's text; it was caught only because answered_pasted moved on one guard case. Make it systematic: an invariant that every gate-rejected answer (stored guard generations + synthetic answer shapes) is still rejected after the full chain, plus a checks.sh guardrail answered_pasted == 0","next_action_hint":"run harness/invariants.py after any restorer or gate change (it now covers laundering). Loop otherwise complete; owner items","result":"current chain: 0 laundered of 258 gate-rejected answers; echo (674 inputs) and idempotence (18,162 outputs) hold. Sanity check: re-introducing #116's bug (stripping edge {} and []) makes the invariant fail with 23 laundered answers (the g-13 JSON across cached prompts), exit 1. Dev .9288 unchanged; checks pass incl. the new answered_pasted rule"}}
{"run":118,"commit":"3dd0811","metric":0.9288,"metrics":{"ai_dev_clean_preserved_rate":0.9714,"ai_dev_pass_rate":0.8136,"ai_dev_slang_kept_rate":0.9167,"ai_holdout_pass_rate":0.8,"qwen_dev_errors_fixed_rate":0.962,"qwen_dev_p95_ms":1830,"qwen_holdout_pass_rate":0.9048},"status":"keep","description":"Live verification of #116-#117: corpus output byte-identical to #114 (400/400, both engines). Robustness 195: Qwen 181 (partial selections 18/20), AI 149 (17/20). Found: AI drops 'she said' from a quote and it's pasted (droppedContent misses short deletions); next candidate","timestamp":1791653724436,"segment":8,"confidence":null,"asi":{"hypothesis":"live verification batch for #116 (edge brackets) and #117's tooling: SWIFT_VERIFY both engines all 400, then 195 robustness inputs (181 adversarial incl. partial-selection round 7 + 14 multilingual) and fresh set 2","latency":"Qwen p50 389 ms, AI 707 ms (= baseline)","new_finding":"AI s1-p17 '\"I dont know,\" she said' -> 'I don't know,' (pasted: it dropped the attribution 'she said' and the quotes). droppedContent doesn't fire because 3 of 5 words survive. A gate for pure deletion of 2+ words is the next candidate; measure false positives by replay first","next_action_hint":"investigate a 'droppedWords' gate: the output deletes 2+ input words with nothing replacing them (pure deletion), which no proofread should do; replay over all stored outputs for false positives (duplicate-word removal 'the the' is 1 word; filler removal on dictation needs care)","result":"corpus: raw and user-visible output byte-identical to #114 on 400/400 for both engines. Robustness 195: Qwen 181 (round 7: 18/20 in the app; the Python run's 19/20 differs only on s1-p05, where the Swift runtime's near-tie gives 'definitely' lowercase: model noise, not the chain), AI 149 (round 7: 17/20). No changes on inputs shared with #114. Fresh set 2 unchanged (26/30, 25/30)"}}
{"run":119,"commit":"16fe6cf","metric":0.9288,"metrics":{"ai_dev_clean_preserved_rate":0.9714,"ai_dev_pass_rate":0.8136,"ai_dev_slang_kept_rate":0.9167,"ai_holdout_pass_rate":0.8,"qwen_dev_errors_fixed_rate":0.962,"qwen_dev_p95_ms":1827,"qwen_holdout_pass_rate":0.9048},"status":"keep","description":"droppedContent catches short deletions: 2+ of the writer's words deleted outright (aligned to nothing, not moved, not a close spelling) → rejected. Newly blocks 3 pasted silent deletions ('she said', a 'Best, Dana' sign-off, a dropped prefix); 0 labelled or passing outputs affected; parity 0 diffs","timestamp":1791654124208,"segment":8,"confidence":null,"asi":{"design":"first version used exact key presence; the existing typo-dense test failed ('Teh qiuck borwn fxo…'): the LCS aligned the output's 'the' with the input's later 'the' and left the corrected words as a pure-deletion run. Fixed by counting a word as kept when it survives as a close spelling (the same surviving() rule as lowOverlap/#75)","dictation_note":"a transcript where the model drops two fillers ('um uh') is now rejected and the raw transcript kept; consistent with the keep-the-speaker's-words policy, and no stored s3 output hits it","files":"OutputGate.deletesWords (WordAlignment pure-deletion runs, repeated-word exemption, close-spelling survival), called first in dropsContent (same droppedContent rejection and message); +1 OutputGateTests test (6 expectations incl. moved words 'Me and Sam' -> 'Sam and I', 'the the', contractions, a single filler); harness deletes_words mirror; PIPELINE.md §4","harm_check":"0 acceptable outputs in any labelled set flagged. Over every stored user-visible output it newly rejects 4 pasted outputs (3 cases), all failing rows: s5-068 Qwen (dropped the 'Translate this to Spanish' prefix), s4-001 AI (dropped the 'Best, Dana' sign-off), s1-p17 AI (dropped 'she said'); 0 passing rows. Invariants hold (incl. blocked answers stay blocked: 264, 0 laundered); Swift/Python parity 0 differences on 3,624 pairs incl. 20 deletion edge cases. Dev .9288 unchanged","hypothesis":"droppedContent only fires when a sentence keeps under half its words, so short deletions get pasted (#118: AI '\"I dont know,\" she said' -> 'I don't know,'). Reject output where 2+ of the writer's words are deleted outright: aligned to nothing, found nowhere else in the output, and not surviving as a close spelling","next_action_hint":"loop complete pending owner decisions; the next live batch can confirm #119 (expect 3 pasted-damage rows to become rejections)"}}
